x,y,split
유타는 비디오가 끝난 후 숨을 헐떡이고 있었어요 정말 잘했어요 우리 모두 당신이 자랑스러워요,N,-2.7812742115272355
나는 굶주리고 있다 무시 당했다  네 딸들을 죽여라,N,-0.07875704037612861
내가 너를 사랑하기 때문에 코에 쾅,N,0.3732494244708778
어쩐지 옷이 낯이 익더라니,{laughing-out},0.15797734845069358
요새 정말 를 하고 있었는데 타이파,N,0.5307575216908734
저는 아니에요  나는 검은 머리가 훨씬 좋아 보이지만 검은 머리가있을 때 나는 금발 머리를 그리워한다,N,-0.6990945700579311
젠장  이므란으로 가세요,N,-2.273065724513415
괜찮아요 여러분 라나는 이제 안전해요,N,-0.04900306577860746
의 일부가 되세요,N,-0.08949160831606409
다행히 코빈처럼 부르지는 않았다,N,-0.2997902268778326
우리 엄마 직장에서 일하는 귀여운 깜둥이들이 있어 내가 그녀에게 라고 말했는데 그녀는 여기 있는 대부분의 귀염둥이들이 게이라고 말했어,N,-0.8020466101970846
진짜 생일 축하해요,N,2.4610195388430087
저는 아니에요  사람들에게 내가 스스로 뭔가를 만들어내겠다고 말했다,N,0.33934928488501925
부터 까지 이므란으로 가세요,N,-0.17349373887692765
베이비 차이는 입니다,N,0.3946464282948465
이 비디오에서 오바마가 말하는 것을 믿지 않을 것입니다,N,-0.34879054165014367
이 아기는 개가 그와 숨바꼭질을하고있는 것을 기쁘게 생각합니다,N,0.676598364028383
그랜트  말해봐요 내 친구한테 똥 싸요,{good-job},-0.30390364536460435
이 듀엣으로 죽이고 있어요,N,1.5723843680597087
시 분부터 차에 앉아 있었어요 동기부여가 필요해요 한터 판매일 일 일 일 일 일 일 일 일 일 일 일,N,0.4079631525009906
는 에서 스 니펫을 공유했습니다,N,0.2565113942353347
신선한 컷 후의 그 느낌이 너무 좋아요  감사합니다 여러분과 다른 분들께 축복을 빕니다,N,-0.7569250071019789
그리고 그들은 의도적으로 그것을 무시했다,N,-0.24482525355617524
시리아 프로에서의 화학 공격,N,-0.5599858723758041
팬 여러분 이 을 당신에 대한 우리의 사랑의 징표로 받아들이십시오,N,-0.6259821762362019
널 떠나게 하는 것들 흠,N,0.7017165168095347
투아웃 루타에 이어 트리플까지 호른이 리드하고 있다 대,N,-0.5057820589930123
알렉사 저 지금 울고 있어요,N,-1.1491031803002978
너무 감동적이었어요,N,0.5313054242987628
발렌시아 헤타페 찬란한 레미는 헤타페를 발렌시아와의 경기에서 승리로 이끈다,N,0.7527446093123196
오늘 우편으로 왔어요,N,-1.539131658326264
흠  와 조직 전체를 위해기도하기 이 선들은 분명히 작동하지 않습니다,N,-0.6280193799457966
세훈 와썹 녀석들 찬열 서프라이즈 모더 퍼커,{laughing-out},-0.9500326432907366
루트 루트 루트 루트는 그녀의 팀을 위해 그녀가 이기지 못한다면 그것은 부끄러운 일이다,N,0.5198844658370608
그렇게 빨리 우버를 떠났을 거예요,{kind-smile},-0.3171087764164497
저는 인데요  택시 어디 있는지 말해줄 필요 없어,N,-1.8137781309213663
그래서 내 여동생은 그녀에게 책을 썼다,N,1.5006873952622906
건전한 데이트 아이디어,N,-0.5235189110426293
이 비디오에서 오바마가 말하는 것을 믿지 않을 것입니다,N,-1.7651473906931627
멜라니 스위트 유방 질량으로 심각하게 거부됨,N,-0.11131553523273019
오늘 오전 시에 처음으로 채팅하기,{open-mouth-smile},0.5468522808457824
이것은 의 대표적인 예입니다,N,0.04281247149276481
정말 감사합니다 시골 소년에게는 평범한 하루였다,N,-1.6341171458308248
활동 오늘 오전 시에 처음으로 채팅하기,{open-mouth-smile},-0.6023640938528471
이것을 좋아하는 모든 사람들을 따르십시오,N,0.6846368300323944
첫번째 점프 난 지옥에 갈 거고 로사스도 따라갈 거야,N,0.05616598423753263
그리고 다시 열어보니 밤하늘이 보인다,N,0.783575423544711
해바라기는 세상에서 가장 아름다운 꽃이 되어야 한다,N,-0.28923758611614153
당신을 위한 개의 마음 네 맞아요,N,0.9308606707919309
당신은 는 에서 의 발췌 문장을 공유합니다,N,-1.0923119248704876
주 반 동안만 누군가와 이야기하고 영원히 아기라고 말하기엔 너무 늙었어,N,-0.4286706021748575
그냥 신선한 사랑이야,N,0.5019415606447298
이거 어떻게 타이핑한거야,{laughing-out},-0.2698867454616848
세상에 구급대원들이 오고 있어요,N,-0.5488761108808039
아 비티가 크림을 바르기 시작하면 너무 좋아요,{solid-sad},-1.1256744348898549
하지만 또한 당신이 전 세계를 받을 자격이 있다는 것을 기억하라,N,-0.9538741340567746
횡단  사랑스러운 내가 서로에게 추파를 던지는 것을 보면서,{love},-0.2684718897626195
세상에 둘 다 예요,N,0.616462633223335
와우  응원해줘서 고마워요,N,1.0875582884608406
이것은 나의 하루를 만들었습니다,N,-0.9873271415396521
와우 이 노래에 대한 모든 사람들의 반응이어야합니다,N,-0.44921427915076223
프레즈노 주는 바바라 부시를 때리는 교수가 종신 재직에도 불구하고 해고될 수 있다고 말한다 폭스 뉴스,N,-0.01434567362723777
사랑해요  드디어 이런 일이 일어나다니 믿을 수가 없네요,{love},1.229944186192961
당신이 아직 가지고 있지 않은 경우에 당신의 표를 얻는 것을 확인하십시오,N,-0.6410870281355461
그것은 라스베가스에서 열릴 것이다,N,-0.6737707844139715
너희 둘 다 하루가 끝날 때 이 인터넷 똥을 즐기는 것보다 더 잘 알잖아,N,-0.21432160213098508
영웅 남서부 조종사 는 해군 항공 개척자이며 서비스가 확인되었습니다,N,0.08361336917063972
알았어요 며칠 후에 코첼라에서 봐요,N,0.2685507802549239
최고의 코치에게 슬픈 소식,N,1.0681984330718346
진심으로 보고 싶을 거예요,{love},-0.040088138524768106
벌써 화 기다리고 있어요,{open-mouth-smile},-0.16426786721150832
비즈니스 캐주얼에 캐주얼을 넣었어요,{kind-smile},0.29878683835132264
이번 투어 너무 재미있었어요,N,-0.7564888864782429
왜냐면 뱀이 된 기분이었는데 아무 말도 안했어요,N,-0.6042761605491006
절대 입을 열지 않았어요  미안해요 알았어요 하지만 여기도 새벽 시예요 그리고 은 미국에서 동면하고 있는 잠자는 세포 무장단체들을 지원했다,N,0.01153230054408991
친구를 따라 가라,N,-0.09264734436812566
여러분의 열렬한 팬이에요,N,0.8420918774099034
시리아에서 온 누군가가 당신에게 연락하고 당신이 트럼프를 하지 않는다는 것을 그들에게 알려야합니다,N,-0.14443675144235604
그가 누구인지에 대한 당신의 깜둥이를 받아들이고 그를 밖으로 만들어라,N,-0.29373917793761956
그게 바로 네가 철자를 쓰지 않는 이유야,N,-0.4293543654952665
생일 축하해 이시다 나오키,N,-1.128697692683587
좋은 친구가 되어줘서 고마워  우리 화요일은 어때요,N,-1.263478286767333
그래서 마간다 나만 내 딸,N,-0.17904178314491326
행복한 졸업 킵스,N,-1.9067567597895831
너무 정확해요,{solid-sad},1.1229870595750056
캐브스 팀은 단지 브론이다,N,-0.11307804752245984
그는 마지막 경기에서 그의 팀 슬럼드 부츠를 말했다,N,-0.3956866629228593
흠 시 분에 출발하거나 시까지 일해요,{dunno},1.367113777572845
골렐    안녕히 주무세요 아미,N,1.0272820676524392
영광입니다 판사는 크리스 코바흐가 등록 유권자들에게 일관된 정보를 제공하지 않음으로써 법원 명령에 불복종했다는 것을 발견했다,N,1.5097960827496262
좋아요 바닷가,{good-job},0.26569550489775307
은 플레이 오프에서 의 포인트 가드를 플레이하면서 를 통해 새 앨범을 삭제합니다,N,-0.035805377082023256
나의 허니,N,-0.11586941698163895
격차를 벌려주십시오,N,0.2760651618768354
는 위로이다,N,1.0022625184944511
여자들은 심지어 깜둥이가 묻지 않고는 나를 지지할 수 없다,N,-0.6210666735049339
사람들은  하하하 아니에요,N,1.2020546281856619
와우 저 언어 선생님  는 에서 의 발췌 문장을 공유합니다,N,0.06315591642640292
비극이야  내가 트윗할 때 아무나 볼 수 있어,N,-0.6844289622948647
이 분짜리 비디오가 당신을 오타 방식으로 느끼게하지 않는다고 말하면 거짓말을하게 될 것입니다,N,0.952201028053725
링크를 클릭하고 에 투표하면 등급이 부여됩니다,N,-0.2673777931168311
보고 싶었어요  파일,N,1.3956278218373686
이제 활성화  더 이상 울 수 없을 정도로 무감각해 본 적 있어,N,-0.0908221004799554
집에 오기까지 일 남았어요,N,-1.0427707720550317
골렐  하느님 제 삶에서 사라져야 할 사람들을 제 삶에서 꺼내주시고 제 삶에서 사라져야 할 사람들을 제 삶으로 데려오세요,N,0.5049478219518495
다 왔다  의 사진은 나의 행복 알약이고 이것이 이유 중 하나입니다,N,0.4104146529736145
최근에 이걸 다시 찾았는데 왜 이렇게 낯이 익은지 알겠어,N,0.1381096685144631
남자 만약 깜둥이가 나를 너무 좋아해서 울면 나는 기절할 것이다,N,-2.3122497167647054
사람들이 얼마나 인정받지 못하는지 놀라워요,N,-0.6712179869961024
엘로베지 당신이 낮은 레스 물건을 싫어할 때,{laughing-out},0.4572293814094942
내가 오악사카 앤앰프에서 산 건데 공항에서 세관을 통과했어,N,-0.19189027768137892
계속해서 를 지지하고 사랑하는 군대들에게,N,-0.2578983888705531
여러분 모두에게 감사드립니다 여러분이 가 계속되는 이유입니다,N,0.3097089867836822
나는 입니다 나는 당신에게 무료 또는 무언가를위한 몇 가지 교훈을 줄 수 있습니다,{laughing-out},-1.4817247630000092
다들 잊지 말라고,N,-0.2292786733400851
내가 오악사카 앤앰프에서 산 건데 공항에서 세관을 통과했어,N,-1.0213399385054658
임윤아로서의 메타 잘 부탁드립니다,N,0.3218362640106549
코미는 방금 맥케이브와 거짓말을 했다고 인정했어,N,-1.5491501601342736
내가 너를 얼마나 걱정했는지 내가 너를 확인할 때 너는 대답하지 않아,N,0.9464910635645643
그냥 야생 개의 사다리를 타고 피트 크레바스를 가로질러 걷는 것은 경련을 일으키며 함께 묶였다,N,-0.7569536183592336
당신은 강하고 똑똑하고 아름다워요,N,0.17032252969385359
그것은 많은 이었다,N,-1.182990651279202
시리아에서 온 누군가가 당신에게 연락하고 당신이 트럼프를 하지 않는다는 것을 그들에게 알려야합니다,N,1.3975812114329857
시간을 기다리십시오,N,0.7938729449196721
뮤직 비디오,N,-0.11848670004533628
리얼토크  드레이크는 방금 켈리 오브르 주니어를 부랑자라고 불렀다,N,-0.8085437848845493
기대되네요  우리는 힘이 필요합니다,N,0.9032562989398665
사랑해 수울 시스타,{love},-1.0973336344830908
나는 내 인생을 매우 사랑한다 예술가가 되는 것은 내가 바랄 수 있는 최고의 직업이다,N,-0.545659474961152
휴스턴으로 돌아가야 해요,{dunno},0.5177384605612805
시골 소년에게는 평범한 하루였다,N,-0.4791489298998575
다 왔다  는 아이들을 보호합니다,N,1.4233140789277556
귀하의 트윗은 사람들이 좋아했습니다,N,0.6761017108179783
너 지금 이뻐,{kind-smile},-0.06992627464216815
나는 세렌디피티를 들었고 나는 그것을 사랑했고 나는 지금 너희들 중 한 명에게 있는 이 릴 머핀 지민을 사랑한다,N,-0.20285046759179745
나를 구하기 위한 리트윗,N,-0.11907704607801718
베이루트  그나저나 웨스트브룩 팬이에요,N,-2.0948355037798683
나는 단지 얼마나 많은 사람들이 르브론을 싫어하고 그가 지는 것을 보는 것을 좋아하지 않는다,N,1.1094235037830857
나를 구하기 위한 리트윗,N,-0.4285622187547114
나는 메츠가 그 운 좋은 매력을 잃어버린 것 같군,N,1.171765737684506
이제 팀들이 모든 연극을 만들고 있는데 그렇지 않아  곧 시험이라 그런지 너무 편해,{laughing-out},0.7961374016373738
나는 이것에 동의한다 또는 더 나은 그냥 전체 책 투어 만들기 는 그녀의 정글 발열 치료법 을 얻습니다,N,-1.2305169441781334
하루 종일 코리도스를 들을 수 있었다,N,0.3252984636042585
그리고 나는 그렇다,N,0.397714225827654
제이크 경은 레이너에게 페이지가 그렇게 확신한다면 그와 함께 있고 싶다고 말해야 한다,N,-0.1445063543272965
이 모든 역사적 사건은 년까지 개월도 채되지 않았습니다,N,2.304612523083115
우리가 말하는 건 실물이 훨씬 더 예쁘다,N,0.7480811383579314
내가 있어야 할 곳에 도착할 때까지 멈추지 않을 것이다,N,1.2061364200088665
내가 당신에게 이드가프를 보여줄 수 있는 위치에 놓이게 하지 마세요 왜냐하면 당신은 결코 나를 똑같이 보지 않을 수도 있으니까요,N,1.9743155597203887
에든버러에서 온 굿나잇,N,0.4676582048007905
별들이여 에 들어가면 이름을 알아낼 수 있을 거야,N,-1.7735602820036456
크리스틴 스튜어트는 항상 칸에 주요한 외모를 가져다 준다,N,-1.1239898135989173
얼마나 우상인가,{star},1.6457408754667033
진짜  당신은 당신의 생각에서 죽었거나 수업이나 직장에서 당신의 마음에서 벗어난 느낌 걱정하지 마십시오,N,-1.988352631242152
당신은 결코 충격을받지 않습니다,N,-0.014003947737888824
나를 위해 투표하는 것을 잊지 말고 앱에 투표하는 것을 잊지 마라,N,-0.9199425654447848
달콤한 스낵  그녀는 팔레스타인 지지자이자 룬다 소수르와 마찬가지로 국내 테러리스트입니다,N,-0.6894160810731318
내가 그것을 얻으면 그도 그것을 얻었다,N,-1.222570872373156
그가 그것을 얻으면 나도 그것을 얻었다,N,0.8168589973014287
년 전 오늘 그것을 직업이라고 불렀다,N,0.20012256498412268
그래도 책 읽는 건 대박이야,{laughing-out},1.3871621487349837
나는 당신이 를 얼마나 사랑하는지 사랑합니다,N,-0.25663856209589253
옹휘랑 놀고 싶어요 으으으으으으으음  우리는 미워하지 않아,{love},0.29053859725160514
좋았어 페이스샵 말레이시아가 답장을 보냈다,N,-0.5737082657590763
우리는 여기에 소년들을 데려오고 있다,N,-1.615126794551082
준비됐어요 친애하는 친구들 당신의,N,0.024716723187660498
한 번도 안가봤는데 그래도 자주 했으면 좋겠다 시리아를 위해 기도합시다,N,-1.2399927115734581
개 하원은 와 세션에 여러 시대 관리들을 조사해 줄 것을 요청했다,N,0.5372917365417865
당신이 의 쌍을 사랑하거나 소유하는 경우 당신에게,N,0.08514837409318929
그것을 직업이라고 불렀다,N,-0.7431009252255116
는 연방법   를 위반하여 조사를 위해 공식적으로 추천되었습니다,N,-1.6408783777062252
나는 내가 젊다는 것을 알고 나는 내가 재능이 있다는 것을 안다,N,0.16490656389318395
간다 나 시간 진짜 싫어,N,-0.6322793300739588
나는 그들이 그들의 시간을 즐겼기 때문에 기쁘다,N,0.6242013233680569
하비 난 폴라가 마이크가 아니라는 걸 깨달았어,N,-0.6268354680364949
나는 그가 당선되던 날 내 것을 모두 먹었다,N,-1.8485464873206876
라르드가 잔뜩 들어 있는 이상한 것들이 남아 있어,N,1.2389619140108983
저지 놀라운 디지털 아트 의 놀라운 디지털 아트 이 흑인 여성들은 의   의 표지를 듣고 있습니다,N,0.6201616869000132
이 주셔서 감사합니다,N,-1.0815555659213105
그는 멋진 사람들이야,N,1.2418652820302927
그는 우리에게 중요해,N,-0.2043207688483047
아빠도 에어혼 무서워하시나봐,N,-1.8747338596375378
당신이 원하는 모든 나를 부러워이 축복을 멈출 수 없어,{dunno},0.684595520770221
공식적으로 시즌 는 썩은 토마토에서 신선합니다,N,2.1784103824699086
당신은 그들을 위해 충분히 똑똑하지 않습니다,N,0.8631234102051615
당신은 그들을 위해 충분히 똑똑하지 않습니다,N,0.8735718217852135
거대한 붉은 깃발 시위 장난,N,1.015303811914941
놀라운 디지털 아트 의 놀라운 디지털 아트 는 라이온이라고 불렀고 그의 법적인 마음과 그의 원래 의도를 칭찬했습니다,N,-0.5642033749995607
는 결정을 내 렸습니다,N,-0.22336223952995457
믿을 수가 없어,N,-0.39443530308478864
신이 뭔가 꾸미고 있다는 걸 알았어,N,-0.44433575907167994
우리 엄마 내 모든 것,N,1.4462612689512049
곧 승자를 따르십시오,N,-0.7041441044920603
걱정아무것도아니면 아무도,N,1.1088427406811725
제인웨이랑 파리는 안 보내,N,0.413460748866887
그래 이것이 내가 내 딸의 이름을 로이스 레인의 이름을 따서 지은 이유야,N,0.7575053148140718
내 아기에 대한 집착,{love},-0.28621191868660384
안녕하세요 일하고 있어요,N,-0.740518338389542
내가 너를 얼마나 걱정했는지 내가 너를 확인할 때 너는 대답하지 않아,N,0.579703601116291
믿을 수가 없어,N,-0.2590825177657463
나는 갈색 피부의 병아리가 노란색과 똥 같은 밝은 색상을 입는 것을 좋아합니다,N,-0.760333530263222
제 은 영원히 축복받았어요,{love},1.750810597325315
그들이 왜 라고 부르는지 알잖아 네가 물어볼 필요가 있는 것처럼,N,-0.6996225271943342
그들은 미국인이다,N,-1.270850731175298
난 떠나고 싶지 않아 자기야 하지만 지금 당장 가야 해 네가 알기 전에 돌아올게,N,1.839484986453287
대단해요  래리 낸스 주니어는 를 위해 높이 올라간다,N,0.7154614441559669
저도 그랬어요,{dunno},-0.9188539769104956
나 백현이 너무 사랑해,N,-1.9100955794170307
우리는 그를 받을 자격이 없어,N,1.4168371411049137
그는 정말 천사야,N,0.703956204487703
옴그 우리는 당신의 방패가 될 것입니다,N,0.39492256776033813
돈 얘기는 하지 않을 거야,N,0.48869250049764074
만나서 너무 좋다 토요일 오픈을 위한 캐롤라이나의 남자 라인업을 다시 한 번 살펴보십시오,N,0.993905618408011
애도의 뜻을 표합니다 너는 내가 너와 함께 아기를 반쯤 데리고 가야 할 것 같아,N,0.39812353447023013
콜백 타임 어젯밤 그들의 새로운 섹스 작업에 대해 인터뷰한 곳을 들어봐,N,0.8091735141476258
봄은 지금까지 잘 가고 있고 땅에는 눈이 내리고 있고 이번 시즌에는 아직 육상 경기를 하지 못했어,N,1.1707863527633031
담배를 피우는 여성은 가장 큰 꺼짐입니다,N,-0.2716358458715287
폴의 동생  아버지와 아들,N,0.022457754076397548
에어버스 이 아기버스 과 함께 프랑스 상공을 날고 있다,N,2.1504295014070984
완전 찌질이네요,N,-0.44310326591905547
는 단지 엿이지만 그들은 인터넷에서 사랑에 빠져 있습니다,N,-1.3163007611948752
이 최근 화보에서 엘르 매거진과 팀을 이뤄,N,0.9475599882010306
나는 지난 밤 스튜디오에서이 사진을 게시 한 이후로 비명을 멈추지 않았다,N,-0.16447851439764757
그들은 위에 있어 투표 여성들을 위한 메시지 크리드는 너무 과소평가됐어요,{laughing-out},1.0449401690610365
캘리포니아 투표 날반디안 와 칼리에서는 더 이상 안돼,N,0.14606537549061968
그들은 같은 레이블 에 서명했습니다,N,-2.7764734734514995
둘 다 유령 작가가 있습니다,N,0.07501004733753588
나는 이 나라를 가로질러 목을 조르고 싶다,N,0.3742221253781534
진짜로 어떻게 이런 일이 계속 일어날 수 있지,N,0.37017453867515604
잘못한게 없는 사람들은 걱정없는거 맞지,N,1.225298858134724
제가 원래 못된 머그잔이에요,😭,1.3429953240890866
리트윗 또는 년 불운,{laughing-out},-0.6916307938315222
제가 원래 못된 머그잔이에요,😭,-1.4131279820195695
월 세레나데 너무 행복해서 새 앨범이 나왔어,N,-1.0391023717180643
그의 목소리는 너무 아름답고 이 노래는 여름 내내 나에게 주고 있어,N,1.2092890273277088
백인 소년은 더 나은 하킴을 랩합니다,N,0.6342906938643066
우리 가족은 똥이 아니야,{laughing-out},0.5875609065061669
우주의 다른 행성을 탐사하는 임무에서 독특한 궤도를 취할 것이다,N,0.10330316969509194
비어든에게 홈런 방,N,-1.119724292404565
아멘  지금 트위터에 아미시아가 너무 많이 돌아다니고 있어,N,-0.22503652125675494
알로 사람들은 제발 우리 말을 듣고 우리가 그것을 막을 수 있도록 도와줘,N,0.12603849141192708
가 마침내 갚을 때,{laughing-out},-0.3791464463128896
니가 깜둥이들을 쏘려고 차를 세우지만 네 아기 엄마 위템이 보일 때,N,-0.4149326391153652
우리는 울지 않습니다,N,-0.2076746749253118
당신은   우리는 누구를 놀리고 있습니까,N,-0.9828735520779986
우리는 모두 울고 있습니다,N,0.6757807577642622
비극이야  그게 바로 네가 철자를 쓰지 않는 이유야,N,-0.3329221070667632
세상에 저도 합류해요,{love},-0.6823073767052098
솔직히 말해서 망할 폐쇄,N,-0.2926205264060797
나는 독소적인 상황을 다시 방문하는 것에 관심이 없다,N,-0.40711662552341576
찢어진 청바지가 어디에 쓰이는지 궁금하셨다면,N,-0.22810367751970428
오직 제나만 매거진  라틴 아메리카에서 를 지원하십시오,N,0.7717764318052149
해시 태그 사용에 대한 투표 행복한 아름다운 마음들이여,N,-0.4641446298395568
포르노 마초퍽커 섹스 핫 냉동 베이브스 제출 비디오 섹스,N,0.005109969659845802
포포비치 가족에게 기도하고 사랑하라 마음이 아프다  레스트 이지 에린,N,-0.24042460168623916
나는 네가 이것을 보면 살금살금 기어가는 것을 안다,N,-0.193358971971677
그래서  내가 방금 개를 위해 산 사자 복장을 제대로 입었다고 해두자,{laughing-out},0.9137697561996289
망할 팝  알겠어요 알겠어요  명심해요,{kind-smile},0.7635230594825496
그녀가 완전히 자라고 있다는 것을 깨달은 순간 내 아기,N,-0.41889043196038195
캘리포니아  삼촌은 페인트 전쟁을 시작하기로 결정했습니다,N,1.0731814376840398
음악을 켜십시오 케어 패키지 인바운드,N,0.4324236073106327
당신이 나를 필요로 할 때 나는 그림자에서 나와 당신을 보호 할 것입니다,N,0.9994965385389954
말 그대로 작은 마음을 가진 사람들을 다룰 수 없습니다,N,-0.4522252981854919
내 꽃은 어디에,N,0.9372727934613065
음악을 켜십시오 영국에서 학교 아이들의 세뇌가 어떻게 작용하는지 여기 있다,N,1.1569582034260388
내 시체 위로 크리드는 너무 과소평가됐어요,{laughing-out},0.2675018819972731
아니 사기인 줄 알았어,N,0.6777768646840877
나한테  요 고운 엉덩이가 콘이라고 말할 때까지 나는 스탠 포인트를 잃은 것 같아,N,2.1708852141950326
재미있는 건 아무도 그것에 대해 할 말이 없다는 거야,N,1.39779466055024
전반전에 팔레트 팔레트 나를 따라 들어가야합니다,N,0.18060471783781118
응답 깃발을 휘날리며 매주 토요일 밤 르브론 제임스는 차전의 첫 점을 떨어뜨린다,N,-0.28171207274762883
트럼프가 부도덕해질수록 백인 복음주의자들은 더 많이 찬성한다,N,-1.5139786552578467
흠흠  옴브레 프렌치 네일,N,-0.28120681317475255
엔딩이 나를 잡아줘,{laughing-out},-0.34291989623310387
챈틱 즈 당신의 트윗은 명의 사람들에게 사랑받았다,N,1.1947477601344079
가 전력을 다하고 있다,N,0.5348696944680684
야 뭐야   당신이 이것을 알고 있는지 확실하지 않지만 우리가 처음 만났을 때 나는 너무 긴장해서 말할 수 없었습니다,N,0.4919809854120209
바로 그 순간에 나는 하나를 발견했고,N,0.8440995818455719
리트윗 또는 년 불운,{laughing-out},-0.4084299905212795
에서 를 계속 스트리밍하십시오,N,0.34567846830854426
프리미엄 또는 사용자 반복으로 노래를 스트리밍하십시오,N,1.0214994136340314
내가 아는 유일하게 아이스크림을 좋아하지 않는 남자친구에게 생일 축하한다,N,-0.5315360389434572
내 방은 실제로 더러운적이 없습니다 그것은 단지 옷입니다,N,1.0208617770971133
당신을 따라갔어요,N,0.3058067604066063
팝 코치님께 기도드리는 건 상상조차 할 수 없어,N,1.3827738101379015
다운로드 스트림 우리 실험실의 과일,N,-1.0949277911470447
강아지 앤 앰프 그녀의 담요,N,1.0903742317798941
는 상원의원들이 아기들을 직장에 데려오도록 하는 새로운 규칙에 박수를 보낸다,N,-0.8864690925558393
은 를 에 초대합니다,N,-0.23409886934469226
미국 티켓 판매 토요일,N,-2.001509721892879
제 동생이 해준 최고의 조언이에요,N,1.3411393393381577
뮤직비디오는 월 일에 개봉한다,N,-0.6588715301967303
그리고 여자들에 대한 공격은 계속 오고 있어,N,-1.7393536173118656
년 월 일 전체 케이팝,N,0.8019036972553287
오늘도 좋은 하루 보내세요,{open-mouth-smile},1.210404251826303
