x,y
조금 많이 죄송하긴 해써요,😂
열심히 슨배님덜 따라갈게요,😍
얍 색조합 잘 못하는데 원작하고 비슷하게 갑니다,😂
까까님 생일메세지 정말 감사해요,🥺
까까님도 남은 시간 즐겁게 보내세요,🥰
아 내스급 성현제 책갈피가 아니라 옷핀입니다,😂
정규직 기다려라모두들 감사합니다,❤
우왕 솜사탕차배치가 초컷이래서,😂
우리껀 춘절이후에 받아욥요기는 솜사탕 차폼이용,😁
흐뭇하게 시작해서 중간에 탈탈 거리는 장면에서 빵 터졌다가 마지막에 울컥했어요,😂
떨어진 아기 천사 생일 기념 이벤트,🔥
도영이 커버곡이 들어간 도 함 오늘도 고생했어요 트레저메이커,❤
아 내 망태기 크고 아늑하니깐 편히 쉴겨,❤
기간은 넉넉하게 월 첫째주 금요일까지,❤
아래 공지사항을 꼭 읽으신 후 이벤트에 함께 해주세요,👍
에스에프나인  루아이의 넘치는 애정을 받고 모두의 마음을 이리저리 흔들던 요한이의 깜짝 반전 엔딩,😍
애교쟁이 요하니가 오늘 하루의 힘이 되셨기를 바라며 감기 조심하시고 내일 만나요,❤
위아이 루아이  엔하이픈 희승희승이는 하늘에서 가장 빛나는 별,❤
제가 왕창 살게여,😍
핡 굿즈로 사고싶을정도로 갓벽해여,❤
와 ㅅㅂ 잠시만요,😍
헤헷콩딱 가끔 재업 타래,❤
내가 좋아하는 국민 착장,😍
현근택꼴보기싫어윤석열찍는다 뿌듯하네요,😊
에 양도합니다 양도합니다 디엠주세요,😊
언니 안녕 헤헿 온마음 다해 널,😊
내 우주가 물들어,💕
알아서 다가오세요 먼저 다가갈줄 몰라요,😊
꾹꾹이랑 수다 타임 넘 행복해따,😊
달밤이랑 수다할 날도 기다려 기다려,💜
드려요괄은 꼭 부탁드릴게요,🥺
타니님 소환 보라해요,💜
중복이시면 죄송합니다,🙏
비나이다 비나이다,🙏
피자치킨에 진심인 울 짱플러 우당탕탕 춤추는걸 보는데 저도 모르게 심장이 쿵쿵쿵 나와줄거라고 부시모 믿습ㄴ다,🙏
설마 진짜요알티만이라도 해주세요,🙏
ㅜ모자옷상의 하의 외투지팡이 구성이에요,🙏
이러고 있었는데 끝까지 완주할 수 있도록 마음 눌러주신 샘들 넘 감사합니다,❤
통판공지계 선착순 이벤트 등 소소하게 준비해 온마음 다해 널,😊
쥬지에 초콜릿발라서 달달하게 빨아먹는 상상,💕
참여해 주신 팬분들 감사합니다,💕
유주  에이스준잘 자요 초이스으,🙏
진입장벽 안 높으니 친구해오,💕
흔적 남기시면 제가 찾아갈게욥    굿나잇,💕
너무 귀여워 움쪽쪽 사랑해,😭
오늘은 호랑이로 변신,💜
의 기운받아 위까지,😭
덕분에 매일 행복해요,😭
오늘은 호랑이로 변신,💜
너무 스윗해,😭
편하게 흔적 남겨주시면 찾아갈게요,😘
덕자 너무 필요했는데 딱 당첨되서 너무 얼떨떨하고 감사합니다,😘
시린 가을은 청소년관람가 이기 때문에나쁜놈 업보 후회공을 좋아 하시는 모든분들이 가볍게 읽기 좋답니다알라딘 외 타 플랫폼은 투에즈님 너무 감사해요옹,😘
꾸금을 쓰는 중이었습니다,😘
이기야 그치만 나는 쥐뿔도 양심이 없는 인간이지정구기오빠 보고 심장이 뛴다면 알티해줘여,😘
팔 감사합니다,👍
앷누도 고마워   굿굿,👍
우리고키 등,👍
킹미들과 함께라서 언제나 든든합니다,👍
란린도 전력 분 또한  와 가슴이 죽인다 신음도 죽인다,👍
처음으로 성인 멜로디 트친소,💙
린히메 포스타입 온리전의 성공적인 개최를 위해 팔로우 추첨 한 분께,❤
아마기 린네 스마트폰 아크릴 거치대,💙
너무 기쁘고 고마웠던 그날,💜
오늘도 함께해요,😁
미안하다사랑한다,😁
미국  최근에는 뷔가 만든 신조어이자 우리 귀염둥이 정원아 너무 생일 축하해,😊
정원이랑 찍은 히히,😁
우아아아 오랫만에 버터 회신이 왔어요어제 리퀘 안하던 새로운곳 찾아서 요청했는데 플레이 해준대요 얏호,😁
귀요미들 보고 가세용,😁
일곱이 모두 모였습니다뚠뚠해서 더 귀여워요,🥰
해적 도깨비 깃발 출장십오야열정 해적선 단원들과,🔥
트메 빨리 보고싶어요,🥺
최현석  썸데이 씨어터,🔥
기다려주세요 사랑해요,❤
남은 무대도찌저노차,🔥
아 왕자님하프린수야 하,❤
오늘 밤 시까지 분 원하시는 치킨 드립니다얼굴 개도랏맨 하,❤
육회 마라탕 간장게장,❤
미더덕 생굴 닭발,❤
칠보고 죠스바 선우,💖
,🥺
난 언제나 열려있어 만나서 세븐틴 얘기하자,💖
민서야 이토시나몽,💖
드리핀 드리핀과함께하는멘션파티 올려드린 세 사이즈 모두 링크 드릴께욥예쁘게 사용해주세요,💖
마이 러브 동글동글언니이,😆
꿈꾸는라디오 완료,💕
유주 놀이   꿈꾸는라디오 완료,💕
최예나  엠카운트다운지구미들의아픔 슬픔 외로움을 잊게 해줄,😆
예나등장예나가 우리 곁에 있어서너무너무 든든한 오늘 하루,👍
지구  최예나  엠카운트다운지구미들의아픔 슬픔 외로움을 잊게 해줄,😆
지구 기혀니 젛은점 노래 안빼구 일단 불러줌,😆
일케 겉옷으로 힙하게 입고 나가볼까봐요,😆
석진아 너무 예쁘다,😍
김남준 손 넘 귀여운거있죠,😆
히힛 감사합니다,😆
지금 바로 씻기전에 라이브,😆
를 자랑하는 면미연이와 함께 행복한 목요일 보내요 네버랜드,😆
크흠 요즘 많이 바빠보이구 힘들어보이던데 ㅠ 무슨일이나 고민있음 말햐 아무것도 모르는사람이 말하는 답도 은근 도움될때가 있더라구 사랑해 오프로 만났으면 좋겠다,❤
화이팅  함께인 것을 알기에 든든합니다,🥰
응원하는 승관이는 오늘도 귀엽고 멋있다,🤭
다음주경기화이팅꼭첫승하게해주세요,🙏
버터야 힘내자   함께인 것을 알기에 든든합니다,🥰
투달곰쓰 와잏엇형아 생일 축하하고 왔습니다,✨
마딧는것도 얻어먹고 보람찬 하루,🤤
입니다  자켓 어깨 최예나 천국,🥺
한번이라두 해주세요,💜
카엘오하화  아오이 쌍둥이 생일 컵홀더 협력진 공개,💙
우리 좋은 성적 내 봅시다,🙏
팔로우 이벤트,👉
이번 상품은 세나 아르카나 아크릴 스탠드에요,👉
행복한 하루 마무리 잘 하길 바래요,💜
엄마 제발,🥺
아아 너무 귀하다 우리 밍구,😍
슈퍼스타더보이즈 슈스덥 왔다 라이브테마,😎
흑흑사진 넣는 것도 좋지 강렬하고,😎
잘생겼고 핫트렌딩송이란 세계 여러나라 사람들이 많이 알고 실제로 듣는게 위지,😎
핫트렌딩송이란 세계 여러나라 사람들이 많이 알고 실제로 듣는게 위지,😎
활동도 우리 쭈욱 함께해요  아돌라멋진챌린지,😎
낮 낮 도장 각각 개막공이 얼마 안남았지만 혹시 있으시면 멘션디엠 주세요,🥺
그저 행복하게 웃고만 있으면 돼,🥺
이미 뵤한 느낌이 있어서 차도 잘 나올 것 같아요,🥰
공감   오마카세 반신 커미션,❤
안 오면 후회한다다,💗
나는 로잘린을 사랑해,✨
찬지수야 생일 축하행축축,✌
우리 같이 더 힘내서 멋있는거 많이 만들자화이팅,🥰
티오원  멍냥톢 오무라이스 버즈 에어팟 둘 다 진행해요,✌
오아아아아 ㅏㅏㅏㅏㅏㅏㅏㅏㅏㅏㅏ 최고,😁
본방사수 잠시 후 시 준꽌찬과 함께하는 호캉스,✌
장발피어싱낭창몸한 미인이 른이 아니라면 그것은 범죄입니다 거기다 연상이라니,✌
연상수의 절대조건,✌
디크런치 마마무 문별 누나가 찍어주신,🥺
네 앞에만 서면 별누나 신곡  많관부,✌
크래비티 잉글리쉬라인,✌
장정의 더우인여러분 시간이 됐어요,✌
티오원 노트북이 빠지니 짐이 확 줄어서 너무 편하고 좋다,✨
최강조합 몬스트로,✨
진진 라키 몬스타엑스 기현 의,💜
월 일 저녁 시 분양,✨
아잉 미인고양이,💖
너무 이뻐 유빈이 눈부셔,✨
오세훈 해적 도깨비 깃발 퍼스트룩 표지 화보 공개,✨
해적 아니라 해해적도깨비깃발 퍼스트룩 화보 공개,✨
에 에우리 프롬이들 무대 보느라매일매일 이렇게 벅차올라,🥰
대본리딩 안효섭김세정 비주얼 케미 갓벽,✨
내장님 커미션,✌
지금 바로 씻기전에 라이브,😆
씻기전에 라이브,😆
케플러 쌤들의 방과후 댄스 교실,❤
우주소녀 쪼꼬미 다영 몬스타엑스 기현 영상 도착,❣
어서 확인하세요항상 기다려주셔서 감사합니다,💚
리트윗 누르고 댓글달아줭,❤
나 떨고있나 풀버전,👉
포근하고 따뜻한 푸른 밤 보내길 바라요,💙
퓨즈퓨즈퓨즈퓨즈,🥺
위팀은 공계가 나서서 독려 하더라구요,😂
잘생기고 이쁜 형님 누님들 찾아요,❤
남 여,👍
했어요 넘 반가워요 채소님ㅠㅠㅠ 예전 분들 만나면 왜이리 반갑지요,😂
구매 해주셔서 감사합니다,❤
힘을 얻었고요 을 보면 눈이 부셔,✨
최예나  유리,😘
지훈  모모랜드 제인 선배님과 성공,💯
제인   모모랜드 제인 선배님과 성공,💯
제인  모모랜드 제인 선배님과 성공,💯
모모랜드 제인 선배님과 성공,💯
제인  펙트체크,💯
출장콜걸서산콜걸  모모랜드 제인 선배님과 성공,💯
상품 안내퍼리즈 교환 티켓 명 클레온 홀더대상 명 전체 인원 대상 명 추첨,✌
퍼리즈 교환 티켓 명 클레온 홀더대상 명 전체 인원 대상 명 추첨,✌
의역오역을 포함해요재밌게 봐주세요,💙
리트윗 해주시면 랜덤사진 발송해드립니다,😊
투모로우바이투게더  오늘도 아미들이랑 함께여서 행복,😁
해치지않아스우파 화 예고,❣
괜찮은 거 맞지춤 잘 추는 언니들 알고보니 헐랭이,🤭
리더즈가 행복하면 된거야국가대표 댄서들의 본캐찾기 여행해치지않아스우파 목 밤  새해 첫 프리스타일,🤭
까지캐럿 큐빅의 최애 편과 명장면은 마이크 없이도 들려 굿즈 종 출시 여러분의 책상에 펼쳐질 신세계,🤭
그리고 루나 멤버들의 풋풋한 모습,🤭
일요드라마 너의 밤이 되어줄게  월 일 일 밤 시 분 회 최종회 연속 방송일요드라마 너의밤이되어줄게 정인선 헙,🤭
소눈 표현이 넘 귀여우세요,😆
거기에 따뜻한 커피한잔 꺄아아악,🤭
인스타그램 김우석,❣
최대한 큰 화면으로 본다 좋은 건 크게이 가지는 꼭 잊지 마세요,❣
주접스티커 통판,❣
인스타그램 김우석,❣
팔로우 이벤트,❣
추첨일,💜
홍대입구역 광고시간월일월 일,❣
트친한정  위 축하해,❣
그리고 스페셜클립 도 다시 보자,💙
출장키스방영동여대생,💙
여러분 다들 좋은 꿈꾸고 잘자요,💙
다 잘하는 우리 완디,💙
기념으로완디 셀카 컷들 공개합니다,✨
잠시후 오후 시에 만나요,💜
함미다민서의 메시지를 받고나서 자고싶어요,😭
ㅆㅂ,😑
,😑
아이고,😑
크정국아    아니야,😑
니가 책임져,😑
봄툰 레진 둘다 할인했음 좋겠어요 리디는 바라지도 않음,😑
야 꾸밍아 안 그래두 너한테 카톡 보냈는데,😑
지가 한데요  지금까지 공부했으면서,😑
오함마가 필요하네,😑
어디에서도 볼 수 없는 선배님들 조합을 볼 수 있었던 소중한 시간이었습니다,💙
어제 이것도 올리려고했는데,💜
추첨 분께한입거리 세트 보내드려용,❤
통판 열엇습니당 추첨 분께한입거리 세트 보내드려용,❤
윈드모해 애교만땅,💜
긍정만땅 노래조아,💚
그만큼 크고 알차다는 말,🤤
새우튀김 우동도 느끼하지 않 헤헤,🤤
사람 피말리게함 살짝 감은 눈,🤤
천국은 없다 환타 저천국은없다 안태주 오야붕,🤤
패댁넘 귀여워요 흐아악,🤤
진짜 너 무 기여워,🤤
해적 도깨비 깃발 출장십오야열정 해적선 단원들과,🔥
보러 가기,💗
폼 오픈기간 월 일 월 일 까지,❤
생방송 분 전 이라는 말에 긴장하는스페셜 민지 진희,😭
이런 대박 기회를 놓칠 순 없지,👉
금요일은 리스팅 쉬어가는날토요일 저녁엔 명화 샤냥이 경매가 있으니많은 관심 부탁드립니다,❣
너무 좋겠구요 최고의 칭찬,😭
본방사수 잠시 후 시 준꽌찬과 함께하는 호캉스,✌
잠시 후 시 준꽌찬과 함께하는 호캉스,✌
함께 해주세요,💜
문별  온마음 다해 널,😊
비엑스라고불러주세욤,😘
,😎
거진 달에 걸친 대장정이 끝났습니다우여곡절이 많았지만 만족해요,❣
여자아이들  임영웅 웰메이드 호랑이 기운을받아 새해에도 건행,💙
영광시대 가입완료영,❣
달디와 함께오늘도 시간 함께 꿈꾸라,💚
달디와꿈꿔라 추첨,💗
오픈했습니다월 일까지 폼 제출해주시는 모든 분들께 미니 하트밤 키링 넣어드려요,💗
에 판매합니다   항상 많은 관심과 사 추첨,💗
고양이 인사하는 선우,🥺
ㄴ왜ㄴ 진진라키 목소리가 너무 달콤해서,🤤
스페셜클립  에서 가장 수익성 높은 유틸리티를 가진 가장 인기있는 새로운 토큰을 확인하십시오,🔥
에서 가장 수익성 높은 유틸리티를 가진 가장 인기있는 새로운 토큰을 확인하십시오,🔥
알림 설정에서 다시 보기,👉
음악중심인기가요많관부,❤
투표권 회수 잊지 마시고 계속 힘내주세요,🔥
에서 가장 수익성 높은 유틸리티를 가진 가장 인기있는 새로운 토큰을 확인하십시오,🔥
협력 징짜 너무 많은 축하랑 행복을 주셔서 감사함니다아아,😘
컴백 축하해,❣
드리핀도궁금하다면,💜
윤재 가디언이랑 고개로 쿵치따치,🔥
그러다 마지막에 미소 짓는 거 극락,😭
영원히 끝날 거 같지 않던 트맵 시즌도 끝이 났습니다,🥺
시즌도 그렇고 막방 보면 울컥하네요ㅠㅠ제작진분들 너무 감사드리구 멤버들도 진짜 고생 많았다ㅠㅠ,💜
ㄱ 올영 트친 급구올영 담당자도 친구를 만들기로 마음 먹었읍니다,💚
제가 원더킬포랑 상성이 잘맞는것같습니다하루종일 이영상만 보게되는군요,😎
블루아카이브  웬일로 경제지에서 방문 성과를 정리한 기사가 나왔네요,😂
저스트비 양도합니다반택 준등기 가능싸게 드립니다ㅠ 웬만하면 에눌 맞춰드려요트친가좍들 알티 부탁,💙
주접스티커 통판,❣
헛 좋은 정보 감사합니다,💗
예쁜 애 옆에 예쁜 애의 정석 케플러,💜
예쁜 애 옆에 예쁜 애의 정석 케플러,💜
민서야오늘 는미피면 당연히 뮤트를 안 그릴 수가 없잖아요,😭
나랑 준기래기여워서 자결해버림,🥺
저 이거보고 화가 나서말 목이 확 꺾여서,😭
원투님의 지대쩌는 라임에 또한번 반해벌이는 홀올옥,❤
감사합니다 겉은 착해보여도 속은 무서운 단 어린이들입니다 후후,😘
자석이 오른쪽 엉덩이에 있습니다,😂
지금은 덮개 위에 화분 올려뒀음,😂
년 연말에 코시국땜에 아무데도 못가서 심심한 나머지 신장판 나온거 보고 만화책이나 보자고 전권지름의 결과완독후 바로 입덕서칭일웹탐사국내온리전탐라입성은인을 만나 회지를 얻어읽고사고 또 사모아서 현재에 이르렀다네,😂
내일은 벌써 평일이야,😭
즐거웠길 바래사랑해,🥰
만날 지민이 보고 실실 웃는다,😁
오늘은 좀 더 편안해졌는지 모르겠네 무리하지말고 천천히 회복하자 지민이가 최고,👍
쥬 체고다,🔥
헐 유밍깅 완젼 오랜만,❤
곤님지금 완전 쿠퍼액범벅인데봐주실 누나,❤
라인 나 디엠으로 와주세요,😘
년 월 일 일요일 오후 시 준희 하고 싶은 거 다 해,❤
주학년 라포티셀앳스타일,❤
알티이벤트안녕하세요 월 일은 테스타의 첫째 자랑스러운 천재 아역 배우 출신군 아이돌 가수 배세진의 생일입니다,🐹
드립니다 팔로한정 월요병주치의 돌아왔슴다,😎
벌써 월 둘째주에요 컴백 언제 오나 언제 오나 기다렸는데 돌아오는 주만 지나면 곧 만나네요,🥺
슬임님  내가 너무 사랑하는 그시절의태형이,😍
월요병주치의 돌아왔슴다,😎
데코덴 탑꾸하루티켓 라흐마니노프김경수 티켓꽂이 도안나눔,😍
개인용도로만 사용해주세요,🙏
우리 곧 만날 거 생각하면서 내일부터 트레저도 트메도 모두,💕
,💕
버논이 생일 기념 대박 짱 귀여운 투명 프레임 포카를 나눔합니다,😍
리트윗 추첨 다섯분께 보내드려요,🥺
두발벌려 환영합니다요,😍
비행기에서 보는 낮은 구름에 마음을 빼앗기고밤은 야경에 시선을 빼앗기는 것 같앙,😍
제주도에 있는 나의 엉냐들 제가 또 날아가께여,💜
이 지헌 오늘 재밌었어요 다음에 또 보자,😊
한뮤직 링어벨 기념 알티 이벤트,💚
성 미도리 링어벨 이벤트가 한뮤직에서 시작되었습니다,💚
당첨자 발표는 월 일이벤트 종료 후입니다,😊
특전은 나눔존에 두었으니 편하게 챙겨가세요,😊
지민시히히 다음에 또 만나여,😊
토롯코 보라머리진 방탄소년단 진 석진 직캠 영상을 업로드했습니다,😊
사랑뷔님 잠금화면 태형이도 넘 이뻐요,😊
그림러트친소푸른색으로 가득한 그림을 좋아해요 흔적 남겨주시면 알티위주로 찾아갈게요,🙏
사람 한 명 살려주세요,🙏
개 멜론 주간 인기상 완료,🙏
중독온신돌온 오 부스 인포문의사항은 페잉으로 부탁드립니다,🙏
언제 할까 소리는 못 지르더라도 규봉이라도 흔들게 올해는 제발 꼭 좀 해줘라,🙏
제발   팔로우 이벤트,👉
아르카나 카드 한박스 입니다,👉
많은 참여 해주세요 감사합니다,🙏
수고했다 울 달디,💚
모두모두 고맙습니다,💚
오마이걸  배세진생일가뵤자고세진이의눈부시고도아름다운제막배세진 생일 카페에 협력한 그림이에요생일축하해,🐹
배세진생일가뵤자고세진이의눈부시고도아름다운제막배세진 생일 카페에 협력한 그림이에요생일축하해,🐹
희희 감사합미당,💕
다음에두 엘다님이 맘찍해둘 수 있는 예쁜곳을 만들어보겠어욥 배세진생일가뵤자고세진이의눈부시고도아름다운제막배세진 생일 카페에 협력한 그림이에요생일축하해,🐹
제발 다들 탈앙 탈트 하지 말아주세요,😭
저랑 평생 놀아주세요,💕
이벤트예 앨범이 또 생겼습니다집이 터질 것 같습니다거지꼴이에요 집이,😭
앨범 이것저것 뭐 앨범 구성품 이것저것포카도 넣고 이케이케 해서 드릴 건데택배비 원만 부담해 주쇼 전혀 업데이트를 못하고 있지만나름 완성했던 한복들,😭
뭐가 더 괜찮은 지 모르겠어요,😭
모 아니면 도 정원이 너무조아,😭
마리  찾으면추첨해서 바로드릴게요,😭
사랑스러와  샘 여기서두 갭차이 가끔씩 보여주세요,😘
그런 노푸님이 저도 너무 좋아요,🥰
헐 너무 귀여워요ㅠㅠㅜㅠ감사합니당,😘
한복 물망초 조합해버리기,😘
반박할수없다  나두 사랑해,❤
전정구기 증말 귀여워 미친다,🤭
알아 알아 니 맘 알아,🥰
아미들이 장난 친거야 꾹아,🤭
우리 정구기 열심히 작업하고 노래 연습 춤연습 부단히 하는 거 잘알지,👍
군 마음 풀어사랑하고 사랑해,😘
울 태형이 진짜였네요,👍
그냥 편하게 말하세요,👍
가장 젤젤 멋진 사나이웅,👍
임영웅임영웅유튜브 임영웅사내임영웅단독콘서트임영웅콘서트장인 반크 해냈다한복은 한국 전통의상 콜린스 사전에 등재,👍
반크 해냈다한복은 한국 전통의상 콜린스 사전에 등재,👍
나의 최애곡 이기도 해서 감동이 두 배 였어요,👍
하ㅠㅠ 역시 다정하네요,💙
혹 있으시다면 맘글 찍어주세요,❤
임영웅 가온차트뮤직어워즈,💙
영훈 돌아왔다,😁
알티와 팔로우시 참여가능,😆
발매 후 가게에서도 판매 예정이에요,😁
많은 관심과 참여 부탁드립니다 영훈 돌아왔다,😁
어느 쪽이든 너무 깊게 생각 하는듯,😁
겨울에도 안켜시던 돌침대의 용도,😁
저 잇자나요,🔥
요시   쌈싸라즈 ㅠㅠ 너무 이뻐 흑흑,❤
렌탄    월요병주치의 돌아왔슴다,😎
우리 곧 만날 거 생각하면서 내일부터 트레저도 트메도 모두 월요병주치의 돌아왔슴다,😎
지성이의 생일을 맞아 멘션 추첨 통해 원하시는 포카 선물해드려요,🥰
국내주소 한정입니다,❤
준등기비만 부담해주시 월요병주치의 돌아왔슴다,😎
이리봐도 쟈니 저리봐도 쟈니쟈니에 둘러쌓이니 이리도 행복할수가,💖
우주소녀 쪼꼬미,💖
지누 아프지말구 늘 행복하길,💖
유겸 갓세븐  다가오는 재현이의 살 생일,💖
을 기념하여 알티를 해주시는분들 한 분을 뽑아 샤넬 헤어 미스트를 드립니다재현이를 사랑하는 모든분들 참여가능,🥰
진환이가우리행복이야 평생 진환이팬 평생 진환이편오래오래 응원할게 사랑해,🥰
벌칙영상 모모랜드   배속 댄스,💖
옥타비넬 기숙사장의 정보를 판다면 제법 이득이 들어오지 않을까 싶네요 그거 정말 부러운 것 같아요,🥺
심심한 아리에게,💙
아니용 헤어졌을때 그렇다구용,😆
주말도 포엑이랑 같이 보내서 행벅,😆
많이 아끼고 사랑해,💚
많은 관심과 참여 부탁드립니다 영훈이 격리해제 기념,❤
트위터 인장에 사용할 수 있게 포즈 취해달라고 해서 받았던 영훈 프로필 사진 컷 공유합니다,😆
일간 도 가능하도록 열스밍은 계속된다,😆
비투비 공동 구매를 시작합니다,💙
단 돈  원에 받아보실 수 있습니다,😆
상콤 발랄 귤 이름처럼 상큼함이 느껴졌어요,😆
매끈한 깐달걀 같음부쿠부라서 넘 조와용,💕
와 함께해염풍성한 설날 되시라고 설 축복과 함께 깜짝 이벤트도 준비했어요,😘
문스타 무대 기다리느라 하루에도 번 오르내림,😎
다음 주부터는 수요일 시에 나우에서 만나요,💜
해서 폭풍 칭찬해주고 옴,👍
인원 대 모집 중여성우대중,❤
월요병주치의 돌아왔슴다,😎
간만에 복층 정리 매트리스 바꿨다,😎
우리 곧 만날 거 생각하면서 내일부터 트레저도 트메도 모두 쌤도 아티움에서 만나서 같이 장승하시겠어요,😎
월요병주치의 돌아왔슴다,😎
트친한정 장르한정배송비 부담 가능하신 분만,🥺
해시 함께 심기고막남친 안구정화 심신안정을 찾아줄 빛나는 미모의 찐,🤭
냅다 올리는 트친소 지뢰는 알아서 걸러감,💕
너무 좋아합니다,💚
멜론 엔하이픈 폴라로이드러브 위,😍
좋아하는 노래를 맞춰주셔서저도 넘 기쁘고 좋은 것이랍니다,💖
러뷰어가 많이 축하한다,😭
테스타의 맏형 배세진,🐹
테스타의 맏형 배세진,🐹
한유진 생일 기념으로 이벤트합니다생일 축하해 유진아,❤
평생 행복해야해알티 추첨 한분께 아래 기프티콘 드려요,🥰
덕분에이틀 동안 그 누구보다도 행복했던 골차와 골드니스,🥰
헛ㅠㅠ 감사합니다 혼자님ㅠㅜ 아무도 안해주실줄 알았는데,🥺
저의 사랑쪼압 푸키님이 일당백 해주셔서 백로단은 행복합니다,🥺
많이 좋아하고 사랑해 울 오빠,❤
오늘 내 꿈에서 놀러와주어,❤
세진이문대김우석 도윤 우석모두 성장하는 모습을 보여준 작품이 아니었나 생각함,✌
첫방 본 게 엊그제 같은데 벌써마지막이라니 섭섭하지만과거의 아찬이와 우리 도윤이 모두 행복하길 바라며,🥺
샘  ㅠㅠㅠㅠ교류도 없어서 맘찍해두고 눈치 많이 봤는데ㅠㅠㅠ정말 감사합니다,🤭
두고두고 찾아보겠습니다,✌
멘션은 내일 마저 달게요오다들 좋은꿈 꾸시기를,✌
추첨 주접티커 보내드려요,🐹
세진이문대 브리드 보민이랑 하이파이브 하는 부분 영택이,✌
손 잡아 주신 울님들 모두 감사합니다,💜
오늘 같은 날씨는,✨
우리 명엘의 완벽한 옆선,🥺
년전오늘의김명 팬미팅 오랜만에봐서더옥소중한것같아,✨
가장 빛나는 지금 이 순간우리가 함께한,✨
골든차일드  교보강남점에 전독시존,✨
뒤에가 미친듯이 재밌어요,😭
우리 불가살 막촬 비하인드,💕
불가살 첨부터 끝까지 본방사수 했었는데 늘 다치고 상처 많아 속상도 했네 앞으로 더 성장하고 기대되는 우석이의 앞날을 응원할게,❣
우석이 고생 많았어,❣
서현진님 뮤지컬 공연 보러간 성훈이화질 좀 더 나은거 한장 더있었네,💙
