x,y
듣기 이 흑인 여성들은 의   의 표지를 듣고 있습니다,N
그녀의 물건과 좋아하는 노래,{love}
이래서 내가 페이스북에 답장 안 하는 거야,N
다들 이거 들어봐,N
발표자가 그냥 닥치라고 해서요,😭
이 흑인 여성들은 의   의 표지를 듣고 있습니다,N
나중에 아담과 함께 뜨거운 재미를 보기 전에 뜨거운 샤워 우리 놀자 두 번째 무료 타이틀 업데이트가 왔습니다,N
장엄한 쿨베 타로스를 보십시오,N
그들이 이렇게 하는 것은,N
의 세계주의 양 때문이다,N
우리 모두는 에게 사과드립니다,N
왜냐하면 그가 실제로 이겼으니까요,N
억양에 대해 그렇게 관대하지 않을 거예요,N
이 흑인 여성들은 의   의 표지를 듣고 있습니다,N
프롬은 식은 죽 먹기야,{open-mouth-smile}
아 알잖아요  첫번째 점프,N
년간의 멋진 영화들을 축하합니다,N
앞으로 더 많은 영화들을 위해 건배,N
지난 월부터 나는 몇 주 동안 색종이 대포로 아빠를 따라 다녔다,N
렘폴룰 왜 비명을 질렀지,N
한번 시도해보고 한결같아져서 신나요,N
피부가 정말 예뻐요,N
미국과 영국은 월요일 러시아의 사이버 공격에 대해 최초의 공동 경고를 발표했다,N
루 그는 이것에 대해 바보입니다,N
에서 볼 수 있는 유일한 프롬포즈 라이브,{laughing-out}
누구를 위해서도 변하지 않는다,N
명의 추종자에게 감사드립니다 무료 경품 행사에 참여하고 행운을 빕니다 포스터의 세부 정보 이 아기에게 신의 축복이 있기를,🙌
가장 인기있는 데이트 사이트 무료 온라인 섹스 데이트,N
너희들이 나를 혐오하는 또 다른 이유는 바보 같은 짓이야,N
이런 젠장 그렇게 털썩 주저앉을 줄은 몰랐네,😭
쥬라기 세계 타락한 왕국,N
쥬라기 월드 폴른 킹덤 쥬라기 워,N
가장 인기있는 데이트 사이트 무료 온라인 섹스 데이트,N
생일 사랑에 모두 감사드립니다 알았어요,N
스모킹 스모킹 스모그를 끊을게요,N
이번에는요 마지막 한 팩을 하고 나서요,{laughing-out}
솔로 주년    같지만 달라요,🔥
나는 방금 에 전체 을 썼고 트리거를 보내지 않았다,N
그는 꽤 잘 하고 있었는데 호르몬 괴물이 점령했어  깜둥이가 자제력을 잃었어 망할 포포비치 가족과 함께하는 생각과 기도,{hope}
거짓말을 하고 있어요,N
나는 당신을 너무 사랑합니다 감사합니다,N
말도 안돼요  법학자 주드 바이가 호메이가드를 받았다 사랑하는 나낭에게 감사한다,😭
미스 페인트 휩 드디어 이걸 끝내고 엽서를 만들게 되어 너무 신나,{star}
내가 너한테 돈을 쓰면 난 마녀랑 아주 떡친다,N
왜냐하면 난 내 돈을 사랑하니까,😅
우리는 할 수 있습니다 군대,N
캔자스의 도시로는 충분하지 않았을 때,N
뮤직비디오는 언제 나오나요,N
너는 네가 얼마나 한심하게 들리는지 아니,N
아니면 그게 네 희극적인 행동의 일부인가,N
바보 같은 소리 하고 한심하게 들리는 것,{kind-smile}
좋은 아침이에요 또 하루를 주셔서 감사합니다,N
앨리샤는 이미 집을 뒤흔들고 있는데 아직 도착도 안 했어,N
내일부터 시작하는,N
해피 할로윈 아직도 내가 입은 가장 무서운 복장인 것 같아,N
미친 짓이야  제발 오빠 좀 도와주세요,N
우리는 말 그대로 서로를 미치게 한다,N
하지만 유일한 원인은 서로에게 미쳤다,N
할 일 머리에 새로운 것을하십시오 향수 향기를 착용하십시오 매일 아침 분 운동하십시오,N
좋아 됐어 전화기를 북쪽으로 건네줘,{laughing-out}
다음 관계 은 우리가 개월 깊이까지 알 수 없을 것이다,N
내 동생은 정신병자야,N
더 나빠질 수 없다고 생각하면 그렇게 돼,N
제발 오빠 좀 도와주세요,N
여러분 안녕하세요,N
의 동양 미술관을 방문했습니다,N
그녀는 말 그대로 가장 귀여운 노인이고 그것은 그녀의 탄생이었다,N
음파오오오  사랑은 치유자입니다,N
미국영국 주거 프록시 구매 랜덤,N
지난 시간 동안 아마존 판매 순위에서 가장 큰 이득을 얻은 비닐 카테고리,N
엄마는 아빠한테 잘해주겠다고 했고 아빠는 노력하다가 다치지 않았으면 좋겠어 그 똥은 웃겼어 팝을 위해서,N
네 그냥 홍보인 것 같아요 팀이 이전한다는 얘기는 못 들었어요 모두가 내 딸 재키를 위해 투표하십시오,N
나는 방금 투표했습니다,N
모두가 내 딸 재키를 위해 투표하십시오,N
굿모닝  이이야크 얀 언젠가는,N
키에라 너무 예뻐요,N
올해의 프리미어 리그 팀,N
인스타 스토리를 보지 못했다면 놓치고 있는 거라고 말하는 것뿐이야,N
솔직히 내 뜨거운 에 집에 오기를 기다릴 수 없어,{kind-smile}
조용한 장소 위스콘신 주 밀워키의 조용한 장소를위한 아발론 극장  지난 시간 동안 아마존 판매 순위에서 가장 큰 이득을 얻은 비닐 카테고리,N
스토리콘 엉덩이가 뚱뚱하면 나는 곤 모양이야,N
내 햄스터가 너무 시끄럽고 밖에도 시끄러운 새끼들이 있어,{solid-sad}
앨범은 뭐야,N
내 이 아니야 니키,N
페티송 뽑으면 보너스 포인트,N
축하드려요  이 비디오에서 오바마가 말하는 것을 믿지 않을 것입니다,N
누가 뭘 떨어뜨리든 언제 떨어뜨리든 상관없어,N
백필드 밖으로 그를 찾아라,N
년 톱 플레이  수영하는 밤,N
젠장  우리 가족은 똥이 아니야,{laughing-out}
하나님은 우리의 어머니들에게 영원한 행복을 주신다,N
는 점심과 저녁으로 내가 갈 곳이야,N
평생 건강하게 먹어,N
유타는 비디오가 끝난 후 숨을 헐떡이고 있었어요 정말 잘했어요 우리 모두 당신이 자랑스러워요,N
가족과 함께하는 생각과 기도,{hope}
나는 굶주리고 있다 무시 당했다  네 딸들을 죽여라,N
아마 내가 제대로 하지 않았을지도 몰라,N
내가 너를 사랑하기 때문에 코에 쾅,N
어쩐지 옷이 낯이 익더라니,{laughing-out}
요새 정말 를 하고 있었는데 타이파,N
챔피언스리그 회 우승 발롱도르 회 수상,👀
저는 아니에요  나는 검은 머리가 훨씬 좋아 보이지만 검은 머리가있을 때 나는 금발 머리를 그리워한다,N
젠장  이므란으로 가세요,N
괜찮아요 여러분 라나는 이제 안전해요,N
누가 포옹이 필요하죠,N
의 일부가 되세요,N
다행히 코빈처럼 부르지는 않았다,N
우리 엄마 직장에서 일하는 귀여운 깜둥이들이 있어 내가 그녀에게 라고 말했는데 그녀는 여기 있는 대부분의 귀염둥이들이 게이라고 말했어,N
난 슬프다 감사합니다,N
진짜 생일 축하해요,N
저는 아니에요  사람들에게 내가 스스로 뭔가를 만들어내겠다고 말했다,N
모두를 따르라 오늘부터 방탄소년단 팬미팅이 시작됐습니다,N
부터 까지 이므란으로 가세요,N
베이비 차이는 입니다,N
정말 고마워요 데이비  저는 아니에요,😭
이 비디오에서 오바마가 말하는 것을 믿지 않을 것입니다,N
이 아기는 개가 그와 숨바꼭질을하고있는 것을 기쁘게 생각합니다,N
그랜트  말해봐요 내 친구한테 똥 싸요,{good-job}
태형이 드디어 복수했네,N
못하니까 다시 뺏는거지,{laughing-out}
이 듀엣으로 죽이고 있어요,N
시 분부터 차에 앉아 있었어요 동기부여가 필요해요 한터 판매일 일 일 일 일 일 일 일 일 일 일 일,N
는 에서 스 니펫을 공유했습니다,N
신선한 컷 후의 그 느낌이 너무 좋아요  감사합니다 여러분과 다른 분들께 축복을 빕니다,N
그래서 그들은 년 월 일 이전에 그것을 알고 있었다,N
그리고 그들은 의도적으로 그것을 무시했다,N
시리아 프로에서의 화학 공격,N
팬 여러분 이 을 당신에 대한 우리의 사랑의 징표로 받아들이십시오,N
널 떠나게 하는 것들 흠,N
감사합니다 여러분과 다른 분들께 축복을 빕니다,N
그냥  캡틴 아메리카를 외치는 아이에 대한 크리스의 반응 나는 할 수 없다,N
오늘이 그날인가봐,N
투아웃 루타에 이어 트리플까지 호른이 리드하고 있다 대,N
알렉사 저 지금 울고 있어요,N
너무 감동적이었어요,N
발렌시아 헤타페 찬란한 레미는 헤타페를 발렌시아와의 경기에서 승리로 이끈다,N
개들은 왜 이렇게 탈출을 잘하는 걸까,N
나는 그 여행을 할 필요가 있습니까,N
이모티콘들이 못을 박았어,{love}
오늘 우편으로 왔어요,N
흠  와 조직 전체를 위해기도하기 이 선들은 분명히 작동하지 않습니다,N
파일 이제 활성화,N
세훈 와썹 녀석들 찬열 서프라이즈 모더 퍼커,{laughing-out}
음 황당해요  고마워요 대런,{kind-smile}
허브는 일주일도 안 돼서 아빠가 됐어,N
벌써 올해의 아빠야,N
맹세코 이 거리에서 전쟁이 났을 거야,{laughing-out}
루트 루트 루트 루트는 그녀의 팀을 위해 그녀가 이기지 못한다면 그것은 부끄러운 일이다,N
그렇게 빨리 우버를 떠났을 거예요,{kind-smile}
나는 다시는 영혼을 믿지 않을 것이다,N
저는 인데요  택시 어디 있는지 말해줄 필요 없어,N
언니 반의 다른 아이들 중 한 명이 그녀를 짜증나게 했던 것 같아,N
그래서 내 여동생은 그녀에게 책을 썼다,N
건전한 데이트 아이디어,N
엄지손가락을 자르고 다른 손으로 바꾸거나 새 엄지손가락에 바느질 시간,N
이 비디오에서 오바마가 말하는 것을 믿지 않을 것입니다,N
멜라니 스위트 유방 질량으로 심각하게 거부됨,N
이것은 의 대표적인 예입니다,N
오늘 오전 시에 처음으로 채팅하기,{open-mouth-smile}
중쿡은 정말 행복해 보인다 마침내 그는 술을 마실 수 있다,{laughing-out}
이것은 의 대표적인 예입니다,N
정말 감사합니다 시골 소년에게는 평범한 하루였다,N
활동 오늘 오전 시에 처음으로 채팅하기,{open-mouth-smile}
이것을 좋아하는 모든 사람들을 따르십시오,N
덴젤은 이것을위한 염소입니다,N
첫번째 점프 난 지옥에 갈 거고 로사스도 따라갈 거야,N
노래 너무 좋다 우우,{love}
눈을 감을 때마다 너의 사랑스러운 미소가 보인다,N
그리고 다시 열어보니 밤하늘이 보인다,N
해바라기는 세상에서 가장 아름다운 꽃이 되어야 한다,N
당신을 위한 개의 마음 네 맞아요,N
오 마이 갓 난,N
내가 갖고 싶은 초능력은 무엇일까,N
하지만 너희들은 듣고 싶지 않으니까 미국인 너희들은 개자식들이야 너희들은 똑똑하다고 생각해 응,N
당신은 는 에서 의 발췌 문장을 공유합니다,N
주 반 동안만 누군가와 이야기하고 영원히 아기라고 말하기엔 너무 늙었어,N
그냥 신선한 사랑이야,N
이거 어떻게 타이핑한거야,{laughing-out}
세상에 구급대원들이 오고 있어요,N
너무 기대돼요  이미 올라디포를 경기에서 제외시켰다,N
아 비티가 크림을 바르기 시작하면 너무 좋아요,{solid-sad}
하지만 또한 당신이 전 세계를 받을 자격이 있다는 것을 기억하라,N
그것을 줄 수 있는 사람은 그럴 것이다,N
적은 것에 만족하지 마세요,{love}
횡단  사랑스러운 내가 서로에게 추파를 던지는 것을 보면서,{love}
세상에 둘 다 예요,N
와우  응원해줘서 고마워요,N
이것은 나의 하루를 만들었습니다,N
와우 이 노래에 대한 모든 사람들의 반응이어야합니다,N
방금 표 다 줬는데 이 윙크가 이 윙크보다 더 지저분하다고 굳게 믿는다,N
라틴 아메리카,N
를 사용해 주세요,N
아름다워요  한번 물어보면 눈물나게 하는 똥이야,{laughing-out}
옥수수였군요  이것은 나의 하루를 만들었습니다,N
가장 재미있는 반응은 손 아래로,{laughing-out}
프레즈노 주는 바바라 부시를 때리는 교수가 종신 재직에도 불구하고 해고될 수 있다고 말한다 폭스 뉴스,N
사랑해요  드디어 이런 일이 일어나다니 믿을 수가 없네요,{love}
당신이 아직 가지고 있지 않은 경우에 당신의 표를 얻는 것을 확인하십시오,N
그것은 라스베가스에서 열릴 것이다,N
내 동생은 정신병자야,N
너희 둘 다 하루가 끝날 때 이 인터넷 똥을 즐기는 것보다 더 잘 알잖아,N
영웅 남서부 조종사 는 해군 항공 개척자이며 서비스가 확인되었습니다,N
알았어요 며칠 후에 코첼라에서 봐요,N
최고의 코치에게 슬픈 소식,N
진심으로 보고 싶을 거예요,{love}
벌써 화 기다리고 있어요,{open-mouth-smile}
이 깜둥이가 진짜를 얻었으면 좋겠어  가장 인기있는 데이트 사이트 무료 온라인 섹스 데이트,N
비즈니스 캐주얼에 캐주얼을 넣었어요,{kind-smile}
이번 투어 너무 재미있었어요,N
왜냐면 뱀이 된 기분이었는데 아무 말도 안했어요,N
절대 입을 열지 않았어요  미안해요 알았어요 하지만 여기도 새벽 시예요 그리고 은 미국에서 동면하고 있는 잠자는 세포 무장단체들을 지원했다,N
친구를 따라 가라,N
고마워요 콘스탄틴,N
켈리도 아메리칸 아이돌이었어요,N
여러분의 열렬한 팬이에요,N
시리아에서 온 누군가가 당신에게 연락하고 당신이 트럼프를 하지 않는다는 것을 그들에게 알려야합니다,N
우리는 이것을 기대하지 않았습니다,N
나는 마지막 춤을 사랑한다,N
그가 누구인지에 대한 당신의 깜둥이를 받아들이고 그를 밖으로 만들어라,N
그게 바로 네가 철자를 쓰지 않는 이유야,N
생일 축하해 이시다 나오키,N
좋은 친구가 되어줘서 고마워  우리 화요일은 어때요,N
그래서 마간다 나만 내 딸,N
행복한 졸업 킵스,N
너무 정확해요,{solid-sad}
캐브스 팀은 단지 브론이다,N
그는 마지막 경기에서 그의 팀 슬럼드 부츠를 말했다,N
흠 시 분에 출발하거나 시까지 일해요,{dunno}
골렐    안녕히 주무세요 아미,N
은 미국에서 동면하고 있는 잠자는 세포 무장단체들을 지원했다,N
비디오     격차를 벌려주십시오,N
영광입니다 판사는 크리스 코바흐가 등록 유권자들에게 일관된 정보를 제공하지 않음으로써 법원 명령에 불복종했다는 것을 발견했다,N
좋아요 바닷가,{good-job}
은 플레이 오프에서 의 포인트 가드를 플레이하면서 를 통해 새 앨범을 삭제합니다,N
나의 허니,N
격차를 벌려주십시오,N
좋아요 바닷가,{good-job}
상금은 글러브 케이스 달러,N
는 위로이다,N
여자들은 심지어 깜둥이가 묻지 않고는 나를 지지할 수 없다,N
당신이 그의 비디오와 똥을 게시하는 것은 무엇인가,N
사람들은  하하하 아니에요,N
마침내 주를 만들고 버그 사이언스에 있을 때,{laughing-out}
와우 저 언어 선생님  는 에서 의 발췌 문장을 공유합니다,N
르브론 제임스 다들 이것 좀 봐요,N
다시 한번 어떻게 문을 열었는지 엿봐 그리고 인터넷 거버넌스를 빠져나왔다,N
비극이야  내가 트윗할 때 아무나 볼 수 있어,N
이 분짜리 비디오가 당신을 오타 방식으로 느끼게하지 않는다고 말하면 거짓말을하게 될 것입니다,N
링크를 클릭하고 에 투표하면 등급이 부여됩니다,N
윤기의 맨얼굴 거미 미소 질척한 볼은 내 인생에 필요한 모든 것이다,N
트래비스 스콧과 조니 댕과 탁구,{laughing-out}
파일 이제 활성화,N
보고 너무 신나요,N
보고 싶었어요  파일,N
이제 활성화  더 이상 울 수 없을 정도로 무감각해 본 적 있어,N
그냥 엿먹이는 거야  유튜브에서 보기 나는 내 깜둥이가 우뚝 서서 나에 대한 모든 것을 좋아한다,N
집에 오기까지 일 남았어요,N
골렐  하느님 제 삶에서 사라져야 할 사람들을 제 삶에서 꺼내주시고 제 삶에서 사라져야 할 사람들을 제 삶으로 데려오세요,N
은 그 다음 단계 새로운 것이다,N
이 사람들을 사랑해,N
다 왔다  의 사진은 나의 행복 알약이고 이것이 이유 중 하나입니다,N
최근에 이걸 다시 찾았는데 왜 이렇게 낯이 익은지 알겠어,N
너야  이 아기 병아리는 좀 피곤해서 내 손에 안겨 잠이 들었다,N
아리아나 그란데는 플립텍스트에 접속한 후 그녀의 텍스트를 뒤집고 그녀의 바이오에 붙여넣었다,N
남자 만약 깜둥이가 나를 너무 좋아해서 울면 나는 기절할 것이다,N
차전 승리에 힘입어 레벨링 시리즈를 목표로 삼아라,N
사람들이 얼마나 인정받지 못하는지 놀라워요,N
좀 안됐지만 음,N
내 딸을 어떻게 했는지,N
나딘의 부는 걸프뉴스 프레스 에 살고 있다 제임스는 그의 캐릭터 지오와 얼마나 가까운가,N
나딘 소브랑 라요,N
엘로베지 당신이 낮은 레스 물건을 싫어할 때,{laughing-out}
내가 오악사카 앤앰프에서 산 건데 공항에서 세관을 통과했어,N
계속해서 를 지지하고 사랑하는 군대들에게,N
여러분 모두에게 감사드립니다 여러분이 가 계속되는 이유입니다,N
나는 입니다 나는 당신에게 무료 또는 무언가를위한 몇 가지 교훈을 줄 수 있습니다,{laughing-out}
다들 잊지 말라고,N
그 종이에 똥을 싸지 마라,N
자랑스럽다 얘들아 박살냈어  황 매니저는 멤버들로부터 세계 반 바퀴를 도는 소중한 를 이어가고 있다,N
내가 오악사카 앤앰프에서 산 건데 공항에서 세관을 통과했어,N
임윤아로서의 메타 잘 부탁드립니다,N
를 위한 배너 그건 쉬웠어,N
코미는 방금 맥케이브와 거짓말을 했다고 인정했어,N
내가 너를 얼마나 걱정했는지 내가 너를 확인할 때 너는 대답하지 않아,N
그냥 야생 개의 사다리를 타고 피트 크레바스를 가로질러 걷는 것은 경련을 일으키며 함께 묶였다,N
당신은 강하고 똑똑하고 아름다워요,N
세상에 네  나를 위해 투표하는 것을 잊지 말고 앱에 투표하는 것을 잊지 마라,N
아직도 그 가족 때문에 짠해요,N
예수님은 그냥 넘어갈 수 없어요,{laughing-out}
세상에 저 좀 내버려 두세요 당신에게 블루스를주는 것 장 더 많은 삶 또 다른 스케치 커미션 내가 너를 위해 이 캐릭터를 디자인하게 해줘서 정말 고마워,N
그것은 많은 이었다,N
시리아에서 온 누군가가 당신에게 연락하고 당신이 트럼프를 하지 않는다는 것을 그들에게 알려야합니다,N
모든 사람들은 다른 시계를 가지고 있습니다,N
시간을 기다리십시오,N
나의 놀라운 친구 인 네온을 많이 사랑합니다,N
뮤직 비디오,N
리얼토크  드레이크는 방금 켈리 오브르 주니어를 부랑자라고 불렀다,N
나는 선택에 의해서만 귀여워진다,N
나는 대부분의 시간 동안 릴 부랑자처럼 보인다,N
코베는 전반전에 발에 점을 받았을 것이다,N
기대되네요  우리는 힘이 필요합니다,N
사랑해 수울 시스타,{love}
나는 내 인생을 매우 사랑한다 예술가가 되는 것은 내가 바랄 수 있는 최고의 직업이다,N
휴스턴으로 돌아가야 해요,{dunno}
시골 소년에게는 평범한 하루였다,N
다 왔다  는 아이들을 보호합니다,N
는 실제로 대학에서 이것을 낙서했습니다,N
귀하의 트윗은 사람들이 좋아했습니다,N
너 지금 이뻐,{kind-smile}
나는 세렌디피티를 들었고 나는 그것을 사랑했고 나는 지금 너희들 중 한 명에게 있는 이 릴 머핀 지민을 사랑한다,N
그러니 제발 나를 위해 오지 마라,N
가족과 함께하는 생각과 기도,{hope}
나를 구하기 위한 리트윗,N
베이루트  그나저나 웨스트브룩 팬이에요,N
나는 단지 얼마나 많은 사람들이 르브론을 싫어하고 그가 지는 것을 보는 것을 좋아하지 않는다,N
나를 구하기 위한 리트윗,N
나는 메츠가 그 운 좋은 매력을 잃어버린 것 같군,N
이제 팀들이 모든 연극을 만들고 있는데 그렇지 않아  곧 시험이라 그런지 너무 편해,{laughing-out}
나는 이것에 동의한다 또는 더 나은 그냥 전체 책 투어 만들기 는 그녀의 정글 발열 치료법 을 얻습니다,N
하루 종일 코리도스를 들을 수 있었다,N
그리고 나는 그렇다,N
제이크 경은 레이너에게 페이지가 그렇게 확신한다면 그와 함께 있고 싶다고 말해야 한다,N
이 모든 역사적 사건은 년까지 개월도 채되지 않았습니다,N
따라와요  닉 그게 더 어렵다고 생각하기 때문에 그렇다는 뜻은 아니야,N
우리가 말하는 건 실물이 훨씬 더 예쁘다,N
내가 있어야 할 곳에 도착할 때까지 멈추지 않을 것이다,N
진한 팬케이크  다시 업데이트 하 고 스냅에서 이야기를 분리 해 주셔서 감사 합니다,N
내가 당신에게 이드가프를 보여줄 수 있는 위치에 놓이게 하지 마세요 왜냐하면 당신은 결코 나를 똑같이 보지 않을 수도 있으니까요,N
에든버러에서 온 굿나잇,N
는 뭔가 다른 것입니다,N
별들이여 에 들어가면 이름을 알아낼 수 있을 거야,N
크리스틴 스튜어트는 항상 칸에 주요한 외모를 가져다 준다,N
얼마나 우상인가,{star}
진짜  당신은 당신의 생각에서 죽었거나 수업이나 직장에서 당신의 마음에서 벗어난 느낌 걱정하지 마십시오,N
당신은 결코 충격을받지 않습니다,N
나를 위해 투표하는 것을 잊지 말고 앱에 투표하는 것을 잊지 마라,N
달콤한 스낵  그녀는 팔레스타인 지지자이자 룬다 소수르와 마찬가지로 국내 테러리스트입니다,N
그의 것은 그의 것이다,N
내가 그것을 얻으면 그도 그것을 얻었다,N
그가 그것을 얻으면 나도 그것을 얻었다,N
년 전 오늘 그것을 직업이라고 불렀다,N
그래도 책 읽는 건 대박이야,{laughing-out}
나는 당신이 를 얼마나 사랑하는지 사랑합니다,N
옹휘랑 놀고 싶어요 으으으으으으으음  우리는 미워하지 않아,{love}
좋았어 페이스샵 말레이시아가 답장을 보냈다,N
우리는 여기에 소년들을 데려오고 있다,N
준비됐어요 친애하는 친구들 당신의,N
한 번도 안가봤는데 그래도 자주 했으면 좋겠다 시리아를 위해 기도합시다,N
개 하원은 와 세션에 여러 시대 관리들을 조사해 줄 것을 요청했다,N
당신이 의 쌍을 사랑하거나 소유하는 경우 당신에게,N
나는 내가 젊다는 것을 알고 나는 내가 재능이 있다는 것을 안다,N
굿모닝  년 전 오늘,N
그것을 직업이라고 불렀다,N
난 평생 이 말을 해왔어 그 혼합물은,🤤
다 왔다  난 평생 이 말을 해왔어 그 혼합물은,🤤
는 연방법   를 위반하여 조사를 위해 공식적으로 추천되었습니다,N
나는 내가 젊다는 것을 알고 나는 내가 재능이 있다는 것을 안다,N
간다 나 시간 진짜 싫어,N
그들은 오늘의 행복에 대해 놀고 공연하는 것을 매우 즐겼다,N
나는 그들이 그들의 시간을 즐겼기 때문에 기쁘다,N
하비 난 폴라가 마이크가 아니라는 걸 깨달았어,N
도나는 그렇거든,{hope}
나는 그가 당선되던 날 내 것을 모두 먹었다,N
라르드가 잔뜩 들어 있는 이상한 것들이 남아 있어,N
느껴져요  이 흑인 여성들은 의   의 표지를 듣고 있습니다,N
티모시 커닝햄 시체 발견,{solid-sad}
리얼토크 일어날거야 가족과 함께하는 생각과 기도,{hope}
당신이 마침내 당신의 짝사랑에게 무슨 일이 일어나고 있는지 알려줄 때,N
저지 놀라운 디지털 아트 의 놀라운 디지털 아트 이 흑인 여성들은 의   의 표지를 듣고 있습니다,N
이 주셔서 감사합니다,N
그는 멋진 사람들이야,N
그는 우리에게 중요해,N
아빠도 에어혼 무서워하시나봐,N
당신이 원하는 모든 나를 부러워이 축복을 멈출 수 없어,{dunno}
새로운 시작 그것을 얻으십시오,N
공식적으로 시즌 는 썩은 토마토에서 신선합니다,N
당신은 그들을 위해 충분히 똑똑하지 않습니다,N
당신은 그들을 위해 충분히 똑똑하지 않습니다,N
거대한 붉은 깃발 시위 장난,N
놀라운 디지털 아트 의 놀라운 디지털 아트 는 라이온이라고 불렀고 그의 법적인 마음과 그의 원래 의도를 칭찬했습니다,N
는 결정을 내 렸습니다,N
믿을 수가 없어,N
신이 뭔가 꾸미고 있다는 걸 알았어,N
우리 엄마 내 모든 것,N
나 지금 떨고 있어,N
그게 내가 모든 예술가들과 함께하는 방식이야,😎
곧 승자를 따르십시오,N
걱정아무것도아니면 아무도,N
제인웨이랑 파리는 안 보내,N
그래 이것이 내가 내 딸의 이름을 로이스 레인의 이름을 따서 지은 이유야,N
내 아기에 대한 집착,{love}
안녕하세요 일하고 있어요,N
내가 너를 얼마나 걱정했는지 내가 너를 확인할 때 너는 대답하지 않아,N
