x,y
다른 서명 이동 및 조합입니다,N
우리는 지금 무엇을 가지고 있는가,N
사람들은 재미있는 왈라,😂
라마오 끝 리트윗 또는 년 불운,😂
우리 아이들과 우리 자전거와 함께 오후의 태양을 음미하는 것,👍
좋아요  아무도 언론 인터뷰를 끝내는 것을 좋아하지 않는다,N
제발 당신의 여자를 밖으로 도와주세요 남자,N
제발  이것은 내가 이것을 한 첫 번째입니다,N
그가 원하는 걸 하게 놔둬,N
그냥 스크롤만 하면 돼,N
자제해  피날레에서 를 위해 조각 된 동상,😂
내 페이지가 감시당하고 있다는 걸 알아 그래서 일부러 똥을 올리는 거야,N
나는 한 가지를 위해 세포라에 갔다 결국 을 소비했다,N
그녀가 죽으면 발작을 일으키는 것처럼 보일 때까지 그녀의 똥을 먹어라,N
나는 너희 모두에게 추악한 를 의심의 이익으로 주려고 노력하고 있지만 너희 모두는 너희 자신을 느끼고 있어,N
친구들 너무 슬퍼서 고기를 이길 수 없었던 적 있어,N
는 에서 스 니펫을 공유했습니다,N
그건 엄청난 옥수수였을 거야,N
또 천재 탓이야 엉망이야,N
블레이크 보여요,N
그럼 창살을 뱉어버려요,N
라틴 아메리카,N
아직 여기 있어,N
여전히 가장 현실적인,💚
금요일  대학에 대한 제안을 받게되어 기쁩니다,N
나는 통계를 무시했다,N
놀라운 목표  이 언급되었을 때 그의 미소는 말 그대로 큰 소리로,😭
당신의 트윗은 명의 사람들에게 호평을 받았다,N
여러분은 이렇게 생각해 보셨을 겁니다,N
빌어먹을 난 정말 인간이야,N
나는 정말 존재한다,N
어떤 사람들에게는 이곳이 성역이다,N
여기 있어 내 면봉 키트,N
낯선 사람에게 골수 기증자가 될 거야,N
난 생명을 구할 거야,N
처녀자리 는 매우 비밀스럽고 스콜피오 방식으로 비밀스럽지 않고 절대 알 수 없을 정도로 비밀스럽다,N
이번 주에 세보라 선물 카드를 임의로 떨어뜨리다니,N
이 집은 계약 중이지만 우리는 당신이 찾고있는 것을 찾을 수 있도록 도와 드릴 수 있습니다,N
언니 좀 봐 책이 너무 좋아서 벌써 할인해요,N
주일도 안 됐어요,N
우리는 그 젊은 시나트라를 원한다,N
이것이 번째 에피소드가 아닌 주년 기념일이라고 상상해보십시오,N
여전히 방법이지만 을 희망할 수 있습니다,N
는 게임을하는 동안 심각하게 나를 하지만 여전히 나에게 말을,N
굿나잇 타이가 영원히 그리고 언제나  무료 리프트 라이드 프로모션 코드 사용 리트윗,N
무임승차 확산 진정 개리가 불알을 흔들고 있어요,N
첫번째 점프 이 광고는 뭔가 다른 것입니다,N
너무 좋아보여요  곧 따라잡을 거예요,N
세트 오늘밤 제 초승달 의식을 준비하면서요 그래 그게 내 일이야 여기 있는 사람들은 다 예뻐요,💗
좌파 총잡이 패트리엇 푸시백 파 셰리프 펜실,N
아내 생일 축하해요,💗
프루토  진짜 잘한다,😊
팬딥 무드보드  물론이죠 내 목숨을 구했어요,💚
석진과 정국이 그 가성을 죽이는 것은 그들의 목소리가 너무 놀랍다 안녕하세요 집까지 잘 갔길 바래요,N
폴의 형은 폴처럼 멀쩡하다,N
그때는 셔츠를 아예 입지 않고 후드티만 입는 거야,N
의 힘에 우리는 날아가 버렸습니다,N
방금 를 쳤습니다,N
우리의 번째 직선 국회 의사당 지역 승리를 확보하기 위해,N
오전 에보니는 공공장소에서 그녀의 똥을 가지고 논다,N
정확해요  만약 당신이 사무실에 출마해야 한다고 생각한다면  나는 지금 더 강해지는 법을 배우고 있어,N
그는 때때로 골칫거리가 될 수 있지만 나는 진심으로 그와 그들의 가족을 위해 기도한다,N
내가 빅 침대에 차를 세울 때마다 나는 낮잠을 자고 오늘 나는 그의 개와 함께 잠들었다,N
나는 구부리지 않는다 나는 정말로 팝핀이다,N
세상이 끝나지 않아서 다행이다,N
우와  무엇으로부터의 독립,N
그들에게 땅을 준 영국 제국,N
달릴 필요 없어 그냥 걸어가자,N
끝까지 여러분과 함께 할 것을 약속합니다,N
놀라운 세계,N
나는 오늘의 가장 좋은 부분,N
내 피에 당신의 노래가 곧 연주 될 것입니다,N
솔리드와 줄무늬가 왔다,N
이 모든 증오심은 오바마가 마약 중독자처럼 사납게 뛰게하는 부패한 민주당 원들을 채웠다,N
작년에 찍은 스크린샷인데 이걸 기억하는지 모르겠네요,💚
미션 이 비디오에서 오바마가 말하는 것을 믿지 않을 것입니다,N
제임스 코미에게 명의 국회의원이 자신을 고발했다고 알려라,N
훌륭한 로라 오늘의 가장 좋은 부분,N
저격수들이 총을 쏜다,N
자기  미국인의 가 당신의 우화의 문자 그대로의 단어를 믿습니다,N
이브 바벨탑   점점 더 사랑해요,N
직업이 있나요 더 일하고 돈을 모으세요,N
내 아기가 다음에 너희들과 함께 사진을 찍기를 기다릴 수 없어,💗
제발 도와주세요 로버트 모리스 대학에서 나의 두 번째 부문 제안을 받았다,N
내 아기가 다음에 너희들과 함께 사진을 찍기를 기다릴 수 없어,💗
내가 아는 가장 강한 여성 중 한 명에게 가장 행복한 생일 문자 그대로 비 유적으로 은 당신을 사랑합니다,N
세훈이 촬영 때문에 바빠요 비비랑 아직도 같이 있으면 좋겠어요,😘
당신의 트윗은 명의 사람들에게 호감을 받았다,N
욕하지 않을게 이 트랙은 아무것도 아니지만 잊을 수없는입니다,N
사랑해요   플레이리스트,N
에서의 나의 주간 개의 멘션 개의 좋아요 개의 리트윗,N
리트윗 도달 개의 회신,N
의 놀라운 절약에 소리쳐라,N
한번 봐봐 한 가지 확실한 것은 두 가지입니다,N
가 다시 한번 그것을한다면,💯
좋은 아침 스타 드리머 여러분,N
은 가 출시하고 있습니다,N
는 가 출시하고 있습니다,N
나는 화장실에 갈 때 싫어 개의 포장 마차가 있고 누군가가 내 바로 옆에있는 것을 선택합니다,N
나의 천사가 마침내 태어났다,N
내가 너를 사랑하는 것을 묘사하는 말은 없다,N
안녕하세요 여러분 제가 첫 곡을 만들었어요,N
파산도 드래곤볼츠,😍
은 내가 에 얼마나 흥분했는지 이해하지 못할 것이다 는 쓰레기다,N
엑소 멤버 한 명만 만날 수 있는 기회가 있다면,N
누구를 더 만나고 싶으세요,N
파산도 드래곤볼츠,😍
군대는 타임 스퀘어에서이 아름다운 추가를보십시오,N
진짜 역대급 귀여워요 옴,😍
내 이마에 대고 말할 수 있는 여자는 한 명뿐이고 우리 엄마도 아니에요,😂
진짜 역대급 귀여워요 옴,😍
평화와 사랑을 그대에게,❤
의 켄이 디어라를 두고 바람을 피웠어,N
잠깐만요 는 이 이모티콘이에요 이온은 욜이 그를 쓰레기라고 불렀을 때 그의 거짓말을 전혀 보고 싶지 않다,N
은 내가 에 얼마나 흥분했는지 이해하지 못할 것이다 는 쓰레기다,N
좋은 밤의 일  군대는 타임 스퀘어에서이 아름다운 추가를보십시오,N
좋은 밤의 일  이온은 욜이 그를 쓰레기라고 불렀을 때 그의 거짓말을 전혀 보고 싶지 않다,N
둘 다 정확합니다,N
진짜  모두가 말하는 것을들을 수 있습니까,N
때때로 나는 내가 어떻게 이런 박자를 생각해냈는지 궁금하다,N
신은 칭찬을 받을 자격이 있다,N
이 귀염둥이를보십시오 많은 기다리고있는 영화를 위해 함께 돌아올 것입니다,N
나는 이 노래를 정말 좋아한다,N
우정을 고치고 신뢰를 회복하는 것이 서로에게 노래를 부르는 것만 큼 쉬웠다면,😍
이 땅에서 년을 살았다,N
엿 먹어라 나는 나의 델타를 보려고 한다,N
너무 잘 알고 있어요,😂
나는 백금 금발 머리를 원하지만 나는 건강한 머리카락을 너무 좋아한다,N
새 스냅챗 업데이트,N
이거 떨어뜨릴까,N
가 또 그러네,N
주님은 이 소식으로 저에게 축복을 주셨습니다,N
