x,y
넵넵 저 늦게 해시 투표 동참한거 사실,N
조금 많이 죄송하긴 해써요,{laughing-out}
열심히 슨배님덜 따라갈게요,{love}
맞아맞아 그렇긴 하지,N
근데 난 내용이 맘에 안 들거나 더 안 읽어도 되겠다 싶으면 다 안 읽었는데도 읽은 책처럼 생각해,N
오늘의 한마디를 주세요,N
드리핀 드리핀과함께하는멘션파티 이거 때문에 어제 실 주문을 한지라,N
매우 찔립니다요 근데 넘 잘 입을 것 같아서 함뜨참가,N
얍 색조합 잘 못하는데 원작하고 비슷하게 갑니다,{laughing-out}
끝까지 덕질해라는 뜻인가봐요,{kind-smile}
아 내스급 성현제 책갈피가 아니라 옷핀입니다,{laughing-out}
뮤지광컴퍼니는 끝났지만 나는 멈추지 않는다,N
유튜브는 아직 남았어용,N
크래비티 형준 아이돌라이브 뮤지광,N
우왕 솜사탕차배치가 초컷이래서,{laughing-out}
우리껀 춘절이후에 받아욥요기는 솜사탕 차폼이용,{open-mouth-smile}
에에 아직 못갈겼어 담달에 살구야,N
흐뭇하게 시작해서 중간에 탈탈 거리는 장면에서 빵 터졌다가 마지막에 울컥했어요,{laughing-out}
꼬기 하늘에서 뚝,N
떨어진 아기 천사 생일 기념 이벤트,🔥
도영이의 생일을 맞이해 초특급 감성목소리를 더욱 짜릿하게 즐길 수 있는 카세트 플레이어를 준비해봤습니다,N
하루토,N
슬슬 이 계정 첫번째 트정 준비 할게요,N
저랑 계속 인연이 되고 싶으신 분들은 흔적 부탁해요,N
제가 지뢰시라면 먼저 써셔도 좋습니다트정 같은 경우는 트친들도 얄짤 없어요ㅜ,N
아래 공지사항을 꼭 읽으신 후 이벤트에 함께 해주세요,{good-job}
내일 만나요 판타지,🙌
에스에프나인  루아이의 넘치는 애정을 받고 모두의 마음을 이리저리 흔들던 요한이의 깜짝 반전 엔딩,{love}
극장판 개봉을 기념하여 본 트윗을 알티해주시는 분들 중 추첨을 통해 메가박스 인권을 드립니다,N
과금님의 저 작은 그림까지 너무 갓벽,N
스티커로 내주세요,N
제가 왕창 살게여,{love}
하트뿅뿅  하트뿅,N
멋있는 승민이,N
야매 그림 뭐가 좋다구 그리 절 띄워주시는지 부끄러 죽겟어용 아주,N
민서에게 나는 당신의 차선으로 끌려가고 있다고 말하고 싶어요 사랑해요,N
하트뿅뿅  하트뿅,N
와 ㅅㅂ 잠시만요,{love}
그정도면이쁜거지ㅇㅈㄹ하믄것도걍 어쩌라고싶음하,N
ㅇㅉ라고 내가 표지만들엇냐고 걍 올해 표지가 족같다고 내가옛날얘기꺼낸적잇냐고ㅜ죄송해요저도고삼이라그런지예민해서ㅠ,N
내가 좋아하는 국민 착장,{love}
국민 국민연성  샘,N
좋긴한데 왜 눈물이나죵,N
신이가 납니다   짜짜박박,{laughing-out}
꼭 봐야 하는 휘인 보는 라디오 딘딘의 뮤직하이,N
이형열얘 누가 녹였어,N
이미 올해부터 만원인데,{laughing-out}
만원으로 줄인다는 건가,N
이게 공약이야  하지만 알면서도 또 놀라는 재미,N
아 깜짝아  왜이러케 목소리가 커어,N
문스타 매력 밤하늘 별보다 많다,{star}
엠카를 들었다 놨다,{laughing-out}
문별  복붙실검 올라가면 현근택 잘린다,N
현근택꼴보기싫어윤석열찍는다 뿌듯하네요,{kind-smile}
더보이즈 리빌 풀구성 풀셋 뉴 포카 찬희 포카 엽서,N
에 양도합니다 양도합니다 디엠주세요,{kind-smile}
포카 찬희 엽서 찬희필름 케빈 포춘 상연 앨범 문버전,N
어디 몸에 생채기는 나진 않았나요,N
이리 얼굴을 또 맞이하니 기쁘네요,N
언니 안녕 헤헿 온마음 다해 널,{kind-smile}
내 우주가 물들어,{love}
할 준비 완 유주 놀이,N
알아서 다가오세요 먼저 다가갈줄 몰라요,{kind-smile}
그쵸앗 그리고 샘,N
문 두드리는 사람 잇음 말해요저일거에요가까이서 한번더 보게요,N
꾹꾹이랑 수다 타임 넘 행복해따,{kind-smile}
푹 주무세요  계정 키우려고 한분께 덕자,N
중복이시면 죄송합니다,{hope}
비나이다 비나이다,{hope}
피자치킨에 진심인 울 짱플러 우당탕탕 춤추는걸 보는데 저도 모르게 심장이 쿵쿵쿵 나와줄거라고 부시모 믿습ㄴ다,{hope}
저쪽은 글 하나당 평균 가 몇백개씩 된다고 하는데요 우리는 맘만 먹으면 밀리언도 가능한 킹탄의 킹미들이잖아요,N
틈날때마다 좀 더 힘냅시다,N
주차는 막을 수 있어요,N
후불제경주출장안ㅁㅏ경주키스방경주출장아가씨경주페이만남경주출장만남경주유부녀 밀,N
밀밀린다고요우리가요,N
설마 진짜요알티만이라도 해주세요,{hope}
신발은 구성에 포함되어 있지 않습니다ㅠ,N
ㅜ모자옷상의 하의 외투지팡이 구성이에요,{hope}
원하는 주제 뭘 써야할지 모르겠네유,N
소솔직히 이거 올렸을때 아무도 안눌러주시면 삭제해야지 힛,N
앞으로 잘 부탁드리구 저희,N
오래봐요   극도 같이보구,N
행복한 덕질해요 앙상블 올스타즈 스티커 입금폼,{star}
기간 월 일입금폼,N
통판공지계 선착순 이벤트 등 소소하게 준비해 온마음 다해 널,{kind-smile}
와 역시 춤선 좋다,N
역시 아이돌 짬바,N
쥬지에 초콜릿발라서 달달하게 빨아먹는 상상,{love}
동양풍 메르헨스타 카나타 넘 예쁘지 않나요,N
ㅠㅜ 개쥬님께서 알티이벤 당첨으로 그려주셨답니다 감사합니다,N
참여해 주신 팬분들 감사합니다,{love}
유주  에이스준잘 자요 초이스으,{hope}
에이스 초이스  샤이니트친소 샤월트친소 샤이니트친소 샤월트친소트친소 거의 반년만에 돌리는 거 가튼디탐라가 너무 정체돼잇어서 올립니더ㅓ,N
진입장벽 안 높으니 친구해오,{love}
흔적 남기시면 제가 찾아갈게욥    굿나잇,{love}
쏘옥 하아ㅏ하악,N
너무 귀여워 움쪽쪽 사랑해,😭
의 기운받아 위까지,😭
오늘도 고마워요  케플러  민서야,N
덕분에 매일 행복해요,😭
오늘도 고마워요  케플러  진짜 재윤이 왤케 잘생겼지요,N
귀여워 예서케플러,N
너무 스윗해,😭
최초 공개 변화무쌍한,N
뱀뱀의 무대 엠카운트 여명의끝으로변이좀비보다빠른연공해시이안이 오너입니다,N
편하게 흔적 남겨주시면 찾아갈게요,{love}
덕자 이뱅 당첨은 처음이라 조금 서툴지만 잘 해주셔서 너무 감사했어요,N
덕자 너무 필요했는데 딱 당첨되서 너무 얼떨떨하고 감사합니다,{love}
잘 쓰겠습니다에티로부터온사랑 감사합니다,N
프로미스나인 출간일정공지저의 두번째 단편인 시린 가을이 월 일 알라딘에 출간됩니다,N
시린 가을은 청소년관람가 이기 때문에나쁜놈 업보 후회공을 좋아 하시는 모든분들이 가볍게 읽기 좋답니다알라딘 외 타 플랫폼은 투에즈님 너무 감사해요옹,{love}
꾸금이랑 아닌거 두가지 버전이라,N
꾸금을 쓰는 중이었습니다,{love}
이기야 그치만 나는 쥐뿔도 양심이 없는 인간이지정구기오빠 보고 심장이 뛴다면 알티해줘여,{love}
팔 감사합니다,{good-job}
앷누도 고마워   굿굿,{good-job}
친구들이 좋은 취지로 시작한 프로젝트에 응원 보내주시면 감사드리겠슴댜 병 리싸이클 된 소재로 제작 무려 웨이로 제작을 했다네여 아직 오픈 전이라 알림신청 하시면 오픈시 알림받고 얼리버드가에 내가 뭐랬어 이길거랬잖아 이 기적아닌 기적을 우리가 만들었ㅏㅏㅏ위탈환,N
우리고키 등,{good-job}
고키야 편안하게 쉬어잘자,{kind-smile}
킹미들과 함께라서 언제나 든든합니다,{good-job}
도리벤 란린도 전력 분 계정 생성 기념,{star}
알티이벤트해당 트윗을 해주시는 분들 중 명을 추첨해 아래 상품 드리겠습니다,N
추첨은 월 일 오후 중으로 하겠습니다,N
란린도 전력 분 또한  와 가슴이 죽인다 신음도 죽인다,{good-job}
모두 가져가  모두 가져가,😅
아받대 아이돌 받아쓰기 대회 간식게임 안무 맞추는 문제로 체리밤 팀 많아서 헷갈려하시는,😅
입니다진입장벽 도 없고 일 같은 것도 없어서,N
큡베도 그렇고 오프 자주 뛰기도 하고 잘 놀아요,😅
흔적 남겨주시면 무멘팔로 비투비트친소 비투비트친소 성인멜로디트친 아받대 아이돌 받아쓰기 대회 간식게임 안무 맞추는 문제로 체리밤 팀 많아서 헷갈려하시는,😅
모두 가져가  계속 달리고 있어요지금 시간째요,😅
투모로우바이투게더  자 시작해 볼까,N
투모로우바이투게더  박박,{good-job}
투표계님 등장 빠밤,N
자 시작해 볼까,N
투모로우바이투게더  자 시작해 볼까,N
투모로우바이투게더  응원합니다,{good-job}
를 보내드립니다 추첨은 월 일에 하겠습니다,{good-job}
자 시작해 볼까,N
투모로우바이투게더 제복승현이도 크게크게너무 존잘 멋지다,{good-job}
헬로키티라니 전에 콜라보 한 적이 있었지,N
좋다 나중에 보내주도록,N
희로애락 킹덤 단,N
와 함께하는 밤의라디오 번째 밤이 시작됩니다,N
펜밤라 장학 퀴즈가 펼쳐집니다,N
오늘도 함께해요,{open-mouth-smile}
미안하다사랑한다,{open-mouth-smile}
내 가수 김태형에 대한 자긍심이 뻐렁칩니다,N
뿌듯뿌듯보라색에 올인해 인스타그램 명소로 탈바꿈했다,N
사진작가에게는 꿈같은 섬,N
미국  최근에는 뷔가 만든 신조어이자 우리 귀염둥이 정원아 너무 생일 축하해,{kind-smile}
정원이랑 찍은 히히,{open-mouth-smile}
우아아아 오랫만에 버터 회신이 왔어요어제 리퀘 안하던 새로운곳 찾아서 요청했는데 플레이 해준대요 얏호,{open-mouth-smile}
귀요미들 보고 가세용,{open-mouth-smile}
해적 도깨비 깃발 출장십오야열정 해적선 단원들과,🔥
과연 결과는 내일 밤 시 분 공개,N
예고편 보면서 기다리기,N
시간아 빨리 가줘라,N
최현석  썸데이 씨어터,🔥
무대 앞나구역 열대리티켓팅 대리티켓팅 썸데이씨어터 루시 정세운 정은지,N
안녕저는 한국어 공부를 하고 있습니다,N
한국에 유학와서 을 만나고 싶습니다,{open-mouth-smile}
드리핀 드리핀과함께하는멘션파티 와 이때 진짜 미쳤었는데,N
남은 무대도찌저노차,🔥
하겠습니다 엠카운트다운,N
스트레이키즈 리노 리노  스트레이키즈  난 이지 풀콤도 못하는걸,N
트친과입맛궁합알아보기마라탕이랑 민초는 많이 안먹어봐서 맛을 몰라용,N
막창  진짜 킹받구 ㅠ 짜증나 ㅠ,N
칠보고 죠스바 선우,{love}
내일도 본방사수뱀뱀,N
난 언제나 열려있어 만나서 세븐틴 얘기하자,{love}
민서야 이토시나몽,{love}
드리핀 드리핀과함께하는멘션파티,N
드리핀 드리핀과함께하는멘션파티 올려드린 세 사이즈 모두 링크 드릴께욥예쁘게 사용해주세요,{love}
아악 진짜 아냐 이번그림 맘에 들었는데 사람들이 좋아해줘서 기쁜거있지ㅠㅠ,N
천재라니 너무너무 고마워 알럽유,N
마이 러브 동글동글언니이,{open-mouth-smile}
꿈꾸는라디오 완료,{love}
이게 꿈이라면 깨고 싶지 않아요,{solid-sad}
유주 놀이   꿈꾸는라디오 완료,{love}
유주 놀이 아직 하고있나요,N
유주 놀이  전 절대못해요ㅠㅠㅜㅜㅠㅠㅠㅠ 유라 치명타 터져서 겨우 만 띄우는 사람,{solid-sad}
유주 놀이 정원 갖고싶다 씨앗 파종하게,{solid-sad}
아아 나는 오늘 그림은 무리구,N
포카라도 나눔해야할까,N
다음 업로드 예정작은 유우지님의 소설 패션 권내용 입니다,N
테스트컷   혹시라도 빌보드 블락 하신 분들 계시면 해제 하세요,N
우리가 유난히 집계가 잘 안되는 이유중의 하나가 그게 아닐까 하는 말이 있어서요,N
혹시 모르니까 블락은 안하는게 나을것 같아서요,{dunno}
지금 쓰는 방법이 맞는거같아서다행이긴한데,N
우리도 모르는걸 저들은 하구있었다구,N
어떠케   오빠 라면 먹었갈래,N
드리핀 드리핀과함께하는멘션파티,N
무슨 통화했는지 세상 궁금한데,{dunno}
일시까지 투표하고 이어서 보면 딱 되겠다 그쵸,N
ㄴ선 한번 긋다 휜거는 흐린 눈 해죠여,N
민쉬가 진짜 날씨를 조절할 수 있다면 드리밍 볼때 날씨는 어떨까용,N
우와 꽃 보기만 해도 향기로와요어깨서기는 진짜 옛날에 해봤는데,{dunno}
체력은방력 방업단은천천히꾸준히방탄은아미를건강하게해,N
음 실제론 썩어있어요,N
ㅇ ㅖ 원투님 안구는 소중히,N
길에서 복 많아보인다고 말하며 쫓아오는 사람들 조심하세욧,N
최예나  엠카운트다운지구미들의아픔 슬픔 외로움을 잊게 해줄,{open-mouth-smile}
예나등장예나가 우리 곁에 있어서너무너무 든든한 오늘 하루,{good-job}
지구  최예나  엠카운트다운지구미들의아픔 슬픔 외로움을 잊게 해줄,{open-mouth-smile}
지구 기혀니 젛은점 노래 안빼구 일단 불러줌,{open-mouth-smile}
저요저어 초멘 괜찮죠,N
ㅇㅂㅅ뭔일이래요저 도쿄인데 벌써 진이 파자마 왔어요,N
일케 겉옷으로 힙하게 입고 나가볼까봐요,{open-mouth-smile}
저 키 인데 엠사서 작으려나 걱정했는데 딱 맞춤이에요,N
석진아 너무 예쁘다,{love}
김남준 손 넘 귀여운거있죠,{open-mouth-smile}
히힛 감사합니다,{open-mouth-smile}
지금 바로 씻기전에 라이브,{open-mouth-smile}
가 네이버 채널을 통해 생중계 됩니다,N
엠카운트다운 출연 안내 잠시 후 여섯시,N
엠카운트다운에 미연이 출연합니다,N
오늘도 완벽한 미모,{star}
를 자랑하는 면미연이와 함께 행복한 목요일 보내요 네버랜드,{open-mouth-smile}
여자아이들 자기야 내가 짱짱짱 사랑하는 쟉희 여기서 자기라고 부르는 사람 자기밖에 없어 진짜 난 정말 조아하는디 자기맘은 모르것네,{dunno}
참지않는 연하,N
에에에 아닌뎅 혹시 유령체크 어디서 하는지 알수 있을까요,N
영 불안해요 미친듯이 하고 있어서  참지않는 연하,{dunno}
결국 지웟음어차피아무도보지않어주닉가,{dunno}
오메가버스 테스트우마님은 열성오메가이며 페로몬의 향은 달달한 초코향이 납니다,N
난 극우성이 아닌거야,N
당장 낼 천명 넘을수도,N
이것이 바로 내가 콩콩깅을 트친으로 둔 이유다,🤦
숨좀쉬자 가 분명 대박 날건데,N
그럼 박라키는 이 사이드스플릿을 몇천만번 더 해야할까,{dunno}
담주 위 하면 주 연속 신기록이에요,N
ㅇㅍ 보기 싫어서라도 어떻게든 막아야죠,N
해시 보이는대로 알티와 답멘 달아주세요,N
응원하는 승관이는 오늘도 귀엽고 멋있다,{kind-smile}
다음주경기화이팅꼭첫승하게해주세요,{hope}
꼬리에 꼬리를 무는 그날 이야기가끔보는데,N
몽님 진짜 감사드려요,{kind-smile}
미루지 않고 설거지 할 수 있게 격려해주셔서 감사합니다,{kind-smile}
태일에스엠 다니고 시키는 거 다 해요,{kind-smile}
투달곰쓰 와잏엇형아 생일 축하하고 왔습니다,{star}
마딧는것도 얻어먹고 보람찬 하루,🤤
케이팝예절도 해버릐기,{kind-smile}
음악관련 단어를 해시와 함께 써주시는 것이 필요하다고 하네요,N
최예나 엄청 사심이지만 아받대 막화 속 자켓을 활용해 어깨 쓰는 최예나 모음집,N
태일에스엠 다니고 시키는 거 다 해요,{kind-smile}
아미님들 알고 계시죠,N
이재명만은 떨궈야 한다는 마음으로 윤석열을 선택해야만 했을 때는 마음이 너무 무거웠는데 윤석열도 생각외로 나쁘지 않다는 생각으로 조금 포지티브하게 마음을 열고나니 이젠 너무도 홀가분하다,N
희로애락 킹덤 단,N
쌍둥이들의 생일 축하를 위해 협력해 주신 분들에게 진심으로 감사의 인사를 올립니다,N
픽시 윈시   이거 그 자체,N
민모션 화가 업데이트되었습니다,N
잘 부탁드립니다,N
감사합니다  너무 예쁘고 자랑스럽고,N
어르신 분들이 입은 보라색 외투도 예 는 정말 성실하고 착한 거 같아요,N
처음에 좀 두렵고 걱정되어서 저렇게 잘나가는데 어쩌지,N
나한테 불친절하면 어떡해,N
근데 왔을 때 와 진짜,N
너무 좋아요 진짜,N
너무 착해요 예시문구소중한 우리 별 김호중지금까지처럼 당당하고 거침없이 달리는거야가자,N
김호중나태주자서전주중주말호중사랑 김호중 김호중자서전 빛나는 별 김호중 사랑스런 별우주 끝까지 빛나세요 소중한 우리 별 김호중지금까지처럼 당당하고 거침없이 달리는거야가자,N
김호중나태주자서전주중주말호중사 빛나는 별 김호중 사랑스런 별우주 끝까지 빛나세요 소중한 우리 별 김호중지금까지처럼 당당하고 거침없이 달리는거야가자,N
김호중나태주자서전주중주말호중사 소중한 우리 별 김호중지금까지처럼 당당하고 거침없이 달리는거야가자,N
김호중나태주자서전주중주말호중사랑김호중 김호중자서전 빛나는 별 김호중 사랑스런 별우주 끝까지 빛나세요 소중한 우리 별 김호중지금까지처럼 당당하고 거침없이 달리는거야가자,N
김호중나태주자서전주중주말호중사랑김호중 김호중자서전 소중한 우리 별 김호중지금까지처럼 당당하고 거침없이 달리는거야가자,N
김호중나태주자서전주중주말호중사랑김호중 김호중자서전 김호중마음을치료해주는힐링가수너무나 사랑합니다 소중한 우리 별 김호중사랑아지금까지처럼 당당하고 거침없이 달리는거야가자,N
김호중나태주자서전주중주말호중참여율이 저조한 관계로 시 까지 시간을 늘립니다,N
하는 법이 어려우시다면 언제든지 으로 문의 주세요,N
이 글 인용에 있는 이벤트 글에 다운로드 인증 해 주시고 맛있는 간식 받아가세요,{kind-smile}
우리 좋은 성적 내 봅시다,{hope}
민서가 안 잘생겼을 때,N
너는 항상 완벽한 민서야,N
드리핀 드리핀과함께하는멘션파티,N
팔로우 이벤트,👉
새해에도 계속 이어집니다,{kind-smile}
이번 상품은 세나 아르카나 아크릴 스탠드에요,👉
추첨일 월 일서면굿즈샵 부산사람이 너무너무 싫어,{kind-smile}
제이콥   정국은 오늘 잘 보내나요,N
오늘 운동 했나요운동하는 모습 진심 멋져요,{kind-smile}
움츠리지 마세요,{kind-smile}
너무 사랑해 드리핀 드리핀과함께하는멘션파티,N
그럼 어쩔 수 없죠,{solid-sad}
희로애락 킹덤 단,N
,N
아 회사에 테라리움 가끔 열어서 환기해줘야 하는데,N
주나 안 열어줘도 살아남을 것인가,{solid-sad}
물은 다음주에 출근하는 분들께 부탁해서 한번씩만 줘달라고 해야지,N
테라리움이 문제네 흑흑 답장 안하면 먹고싶지 않아,{solid-sad}
우렁차게 성악발성으로 노래해놓고세상 귀엽게 커피 머시며 형아의 따봉에헷,N
하는 이 귀여운 생명체라니,N
아아 너무 귀하다 우리 밍구,{love}
슈퍼스타더보이즈 슈스덥 왔다 라이브테마,😎
더보이즈는 슈스더비 마음이라는 도화지에 그림을 그려,N
내 폰 안에 움직이는 더보이즈를 획득할 수 있는 기회,N
멤버들이 어떤 그림을 그렸을지 궁금하지 않아요,N
그림뿐  목표가 일코라 그래,N
난 원래 거의 다 일코용을 써서,N
그래서 간단히 넣으려다가 아무튼,N
흑흑사진 넣는 것도 좋지 강렬하고,😎
잘생겼고 핫트렌딩송이란 세계 여러나라 사람들이 많이 알고 실제로 듣는게 위지,😎
핫트렌딩송이란 세계 여러나라 사람들이 많이 알고 실제로 듣는게 위지,😎
지금까지 찍은 우리 집 고양이 사진 중에서 가장 멋지게 찍은 사진이라고 생각해,N
만족스러운 우리 집 스핑크스,N
온라인 쇼케이스도 멋지게 마무리,N
활동도 우리 쭈욱 함께해요  아돌라멋진챌린지,😎
드리핀 아이돌라디오,N
악청심구  에스에프나인 공카 방문수,{hope}
월부터 금요일 오전의 긴장감 미리보기,{kind-smile}
어지러워요 애니플러스 포토카드 교환 구합니다,N
저 알베르트 나츠야 이쿠야아사히디엠주세요,N
뮤지컬 앤 도장 교환저 밤 밤 도장 각각 개,{kind-smile}
데드풀만왠 젤리같은걸 들고있냐하시면젤리왹져들 사이에끼기위한방편이기때문에,N
심비오트들 어차피숙주없으면젤리들이잖아요,N
행복한데 괴로움,{kind-smile}
그치만 트친이 우문현답 해줬다밤이니까 낭만 봐야지 울 프롬이들 존재하는 것만으로 천사야,{kind-smile}
프로미스나인  소서계와 연락 닿았습니다,{kind-smile}
우주토끼 차 샘플이에요,N
눈매 자체는 마음에 들게 나왔지만 수정할 부분이 있는 것 같아 차 샘플까지 가겠습니다,N
무속성우주토끼 국 쟈니 이렇게 갑자기 나타나서 아아악 하고 저음으로 영어하면 쟌프는,N
오늘도 도경수 엑소디오,N
일정 금액 달성 시 추첨 기본 인 급전으로,N
으로 두 분만 받습니다,N
인물 추가 최대 인 컨셉 의상 지정 가능 문의 및 신청은,{flower}
이번주와 다음주 악당 대공님의 귀하디귀한 여동생은 휴재입니다,N
종종 낙서라도 올릴게요,N
이 그림은 수도에 있었을때 데이먼의 숙제를 하다가 골아떨어진 아닛사,N
케플리안 여러부우운,N
오늘 시 쇼챔피언 케플러 보러올 거죠,N
오늘 진짜 전부 예쁜데,{flower}
분동안의 셀카타임의 사진,{flower}
배포 목록더블크로스 타이만 회문시날,N
더블크로스 인 테겜,N
더 갖고싶죠 그럼요,N
그럼 가져야죠대신 꼭 기억해주셔야 합니다,N
그가 마지막으로 했던 말을 기억하세요,N
수령 후 추첨예정 한 명,N
찍어둔 사진이 없어서 한복 사진이라도,N
이번주와 다음주 악당 대공님의 귀하디귀한 여동생은 휴재입니다,N
태용 네이처리퍼플릭 영통 팬싸,{flower}
인생 네컷 포즈여,N
그럼여 후비적귀여워서 심장 아픔,N
엔시티 태용 영통팬싸 네이처리퍼블릭,N
하  허경영은 밈이 아닙니다,N
쟤를 찍어주면 공식적으로 국민의 지지를 받는게 되어요,N
그게 뭐 어떻냐구요,N
대선에서 일정 이상 득표율을 획득하면 선거 유세에 사용한 비용을 세금으로 물어주게 됩니다,🤦
이거 결말 알고보면 더 좋을 것 같은데 누굴 탓해 날 탓해ㅠ 제발 자첫은 빨리 하자,🤦
그리고 쟤는 자기가 몇 만 명의 지지자를 거느리고 있다는 사실을 팔아먹을 사이비 교주라고요 지가 신이라고 한다고 대선은 인기투표가 아냐 제발,🤦
허경영은 밈이 아닙니다,N
하 내일 백신이야,🤦
이건 볼때마다 미ㅣㅣ이쳐버리겠네,🤦
허경영은 밈이 아닙니다,N
완깐 슛기 티존 환장하게 예뻐서 또 미치겠다이 와중에 발음,N
엘르는년내내생일엘르 주년 그 두 번째 이슈,{good-job}
엘르 코리아가 주년을 맞이했습니다,N
그 두 번째 이슈를 기념해 세븐틴 의 맏형즈 에스쿱스 정한 엘르는년내내생일엘르 주년 그 두 번째 이슈,{good-job}
그 두 번째 이슈를 기념해 세븐틴 의 맏형즈 에스쿱스 정한 오늘도 평화로운,{good-job}
최예나 데뷔 축하해,{good-job}
축하축하요  데릭 아직도 모르겠어,N
나는 로잘린을 사랑해,{star}
을 자각하다카카페 폭군의 비서관이 되었습니다시즌 완결,{good-job}
오늘도 평화로운,{good-job}
뱀뱀 뱀뱀 케타포 방문 후기 이벤트,{good-job}
케타포 삼성점에서 앨범 구매 후케타포삼성점 케타포삼성점오픈축하해 오랜만이군,N
새롭게 시즌 으로 돌아온 악당의 아빠를 꼬셔라많이 기대해주세요,N
시즌 복귀악당의 아빠를 꼬셔라 화,N
지금 카카오페이지 에서 만나요,{good-job}
례  ㅅ,{love}
ㅠㅡㅜ다시한번감사합니다,{love}
으앙 멋진 합작 감사합니다ㅠㅜㅠㅠ,{love}
작은 미술관 아니냐구요,N
찬찬히 행복하게 보겠습니다,N
모두 감사하구 수고하셨어요,N
퍼스트룩 핑크승관,N
승관 홀리하다 진짜 예뻐,N
진짜 예뻐 진짜 예뻐,N
일진에게반했을때 이은재 강율 김원필 강혜원 박이현 윤준원 윤현석 최 갹 저 가족들이랑 가는게 잠깐 얼굴 봬요,{open-mouth-smile}
저도 두장 뽑는데,N
티오원을 위해노력하느라 고생이 많아,N
오아아아아 ㅏㅏㅏㅏㅏㅏㅏㅏㅏㅏㅏ 최고,{open-mouth-smile}
에이스 호캉스,N
잠깐의 라이브,N
크래비티 앨런 정모 태영,N
장정의 장징이,N
티오원 노트북이 빠지니 짐이 확 줄어서 너무 편하고 좋다,{star}
최강조합 몬스트로,{star}
아스트로 숨좀쉬자,{flower}
팔로우 추첨 멜둥이 한 마리를 드려요 ㅅ,{flower}
월 일 저녁 시 분양,{star}
빨대 귀여움김선호 너무 귀여워,N
아잉 미인고양이,{love}
너무 이뻐 유빈이 눈부셔,{star}
