x,y
와 완벽한 움짤 코끼리를,N
패댁넘 귀여워요 흐아악,🤤
진짜 너 무 기여워,🤤
우와 이름 진짜 귀여움,N
보고이따  납치와 감금 제전문인거 우째아시구,N
해적 도깨비 깃발 출장십오야열정 해적선 단원들과,🔥
추첨으로 두분께 모든 굿즈를 보내드립니다,N
특전 포함 문의는 디엠이나 페잉으로 부탁드립니다,N
생방송 분 전 이라는 말에 긴장하는스페셜 민지 진희,😭
할 수 있어요 화이팅화이팅 크라운드 마족의 계약 카카오페이지 이벤트,N
마족의 계약 시즌 달리고,N
최대 천 캐시권 뽑기까지,N
이런 대박 기회를 놓칠 순 없지,👉
그 외 다양한 이벤트가 진행 중이 엑소 백현일본 첫 미니앨범 월일 발매,N
번째 샤냥이 리스팅 완료,N
출장미시울산미시 일정금액 달성 시 알티 한 분께 그려드려요,N
헤더특화 고정틀커미션이에요,N
차지인과 파란눈 캐릭터는 할인이 됩니다,N
자세한 건 링크를 참고해주세요 감사합니다,N
달의 일기 이곳이 이달의 소녀의 무대이자 런웨이,N
활력 넘치는 다이나믹한 이달의 소녀의 비하인드 영상을 지금 바로 확인하세요,N
이곳이 이달의 소녀의 무대이자 런웨이,N
댄스 더 훅나잇 문별 과 의 케미가 궁금하다면 본방사수,N
일정금액 달성 시 알티 한 분께 그려드려요,N
재밌는 시간들 이달의소녀,N
포레스텔라의 무대   팬텀싱어 올스타전,N
영은이 신났다서영은,N
저쪽이 인당 하루에 개의 트윗리트윗 한다는 차트 데이터 공계의 분석에 제 탐라는 지금 리트윗 파뤼,N
우리 아미 감동이여여,N
탐라에알티대행진,N
계속 오르네  헐 울 오리언니다,N
사랑해애혹시 멜론티켓 무통장 안되나여,N
티켓팅안한지 년 돼서 기억안남,N
맞아요 싸우긴 커녕 그분도 볼 수만 있다면,N
너무 좋겠구요 최고의 칭찬,😭
설탕뿌려놓은것같다,N
달고 맛있어  비상은 비상인가보다,N
비상은 비상인가보다,N
제시의 쇼터뷰 쇼터뷰에 놀이하러 온 년차 신인가수 유주 알고보니 준비된 예능천재,N
제시의 쇼터뷰,N
제시의 쇼터뷰 쇼터뷰에 놀이하러 온 년차 신인가수 유주 알고보니 준비된 예능천재,N
요시   즐거운 퇴근길은 역시 버터죠,N
문별  온마음 다해 널,{kind-smile}
진짜 비엑스는 누굴까아용,N
비엑스라고불러주세욤,{love}
히히 쪼아요  막상 하고 나니까 볼 때마다 함박웃음 지어져요,N
뿌듯해요지구망 몇화까지봤어요,N
,😎
여자아이들  민니,N
영통 팬싸괜찮겠어,N
화산귀환 아기육검일권,N
알려주셔서 감사합니다,N
카톡 멀티프로필 바꿈,N
엔진 여러분표지 보셨나요,N
여러분 모두 굿나잇,N
고래별 수아 한복 완성,N
트레저 도영 도영 트레저도영,N
벌써부터낙서갈기기,N
츠카사가 존칭을 쓸지는 의문이나,N
전 좌합니다  고스트나인 이신 김수현 양아치상 좋아하세요,N
그럼 김수현 해보세요 고스트나인 이신 양아치상 콜렉터,N
임영웅  아티스트임영웅,{star}
아티스트 임영웅음원강자임영웅 임영웅 임영웅유튜브임영웅웰메이드호랑이기운건행임영웅사랑은늘도망가임영 임영웅 문명으로의 첫걸음,N
이걸 어쩌죠다계정보유웅아티스트임영웅,{star}
나는 너의 지구우리는 서로의 빛,{star}
사랑해 석진아 문일축하해방탄소년단진,N
임영웅 문명으로의 첫걸음,N
음원강자임영웅유튜브 절찬상영중임영웅 임영웅유튜브 임영광 임영웅부캐글로리임영웅사랑은늘도망가 밍서야,N
혹시 빨간 머리 드셔보실래요,N
노제씨 괜찮아요,N
네   민서야  답장받으려면 뭘해야할까,N
코로 엽떡이라도 먹어야할까,N
에리트친소 엑소엘트친소 살인 백도트친소나나나를 받아주세,N
같이 가요  컬투쇼뽀작뽀작 휘이니,{kind-smile}
휘인 마마무  임영웅 임영광 문명으로의 첫걸음,N
능청 영광 영감 떠오르다,N
임영웅임영웅임영광임영웅인기급상승동영상위임영웅잉스타뭐라구램임영웅브평 임영웅 임영광 문명으로의 첫걸음,N
임영웅임영웅임영광임영웅인기급상승동영상위임영웅잉스타뭐라구램임영웅브평 포근수인 무슨일인데,N
흥 포근를 현실화 한 언니가 말해봤자다,{kind-smile}
임영웅 임영광 문명으로의 첫걸음,N
임영웅임영웅임영광임영웅인기급상승동영상위임영웅잉스타뭐라구램임영웅브평 추첨 분께 재현 마크 제노 부적합 시리즈 증사 종 중 종을 드립니다,N
우편비 부담 가능하신 분들만 참여해주세요,N
국내주소지 한정 시즈니만 가능,{hope}
도영생일 나눔,{hope}
수량 날짜별 개자세한 나눔 장소와 시간은 당일 타래공지,❗
추첨 분에게 애기도영사탕을 추첨 분께 재현 마크 제노 부적합 시리즈 증사 종 중 종을 드립니다,N
재주도 많은,N
라벨스티커 보내드려요월 라벨신뢰커미션,{hope}
새로운 디자인도 많이 추가되었어요많관부,N
혜화 키햐아연어가 미친놈임,N
피스 약간 느끼할수있는데 라멘이 아주 칼칼해서 조합이 조았다,N
앞에 단체주문이써서 조금 기다렸는데 서비스로 새우튀김도주셨다ㅠㅜㅜㅜ 출쪽이지만 깊이안들어가도 돼서 가기좋음 추첨 분께 재현 마크 제노 부적합 시리즈 증사 종 중 종을 드립니다,N
케이에서만해도 트렌딩만가까이 나오는데전세계하면 어마할텐데왜,N
담주차트 낼시까지가 마감인가,N
음  알티 추첨 분께 원하시는 탑꾸 보내드릴게요,{hope}
햇살탑꾸 만원의 행복,{hope}
금요일 시 오픈 예정,N
팔로우 명 기념 모든 탑꾸를 만원,{hope}
귀여운거 볼사람,{flower}
김호중나태주자서전김호중나태주자서전연중무휴오직호중뿐김호중,{flower}
리틀 나나듀이 리틀 다람듀이 리틀 베리듀이 크림듀이다람듀이 핑크 베어듀이 브라우니 청키듀이티티듀이 블랙,{flower}
같아  귀여운거 볼사람,{flower}
김호중나태주자서전김호중나태주자서전연중무휴오직호중뿐김호중    다정여보세요,N
뭐해오늘 하루도 고생해써 잘자 윈시픽시 윈시,N
엔하이픈 사운드웨이브 럭드 양도 교환사웨 성훈 제시해 주세용,N
교환은 사웨 파스테 정원으로 받아요,{love}
엔하이픈 정원 희승 제이 제이크 성훈 선우 니키 양도 판매 교환 분철 미공포 럭드,N
동숲썰 말하는 선우 생각나고 너무 귀여워,N
다정여보세요 뭐해,N
오늘 하루도 고생해써 잘자 윈시픽시 윈시,N
민서야빌 보드 차트 위 떡잎 누구,N
런 언제나 드리밍 마음 속 위 누구,N
헉 컷 완성ㅠㅠ 넘 귀엽다,N
뮤직코리아진짜냥냥이,{love}
정원 양너무잘해정원,N
하루에 두세 번씩 자기 이름 서치해본다는 용복이가 이런 영상들 직접 찾아보면서 나 사랑받고 있구나,{love}
행복하다 생각했다는 거 아냐 가슴이 늠 몽글몽글 따끈따끈해짐,N
젠지 전 라인 다 한 번씩 피오지 받은거네,{love}
네 아쉽게도 언니가 과분한척하는데 너무 좋아하네여,❗
가격이 괜찮으면 사보라고 할텐데,N
너무 비싸 양도 얼마 안하는데,N
다들 자란것 좀 봐,N
기억이 날 것 같기도 한데 잘 모르겠어,N
항상 사는 것만 사다 보니까,N
검색해 봐야겠다트친소레전드밍천지,N
같이 민규얘기해요,N
그니깐요 임티두 뮤트가된다면 을매나 좋을까요,N
ㄴ왜ㄴ 진진라키 목소리가 너무 달콤해서,🤤
스페셜클립  에서 가장 수익성 높은 유틸리티를 가진 가장 인기있는 새로운 토큰을 확인하십시오,🔥
에서 가장 수익성 높은 유틸리티를 가진 가장 인기있는 새로운 토큰을 확인하십시오,🔥
종교 신천지 안드레야고보지파 천국비밀 실상 증거 세미나 비유한 씨밭나무새는,N
무료 온라인 말씀교육신청,N
추천인번호 신천지신천지예수교회시온기독교선교센터천국비밀비유와실상증거세미나,N
몬스타엑스의 신개념 비대면 공연저도 저기 끼워주시면 안 될 까 요,N
알림 설정에서 다시 보기,👉
몬스타엑스의 신개념 비대면 공연저도 저기 끼워주시면 안 될 까 요,N
카라는 공식적으로 제작진에게 드라마 태종 이방원의 낙마장면 말 학대 해명을 요구합니다,N
보다 정확한 소식과 후속 대응을 준비하는 동안 시민 여러분들의 동참을 요청드립니다,N
최강창민 뮤비 매니악 프로모션 비디오,N
엠카 직캠  무대뮤직 뱅크,N
투표권 회수 잊지 마시고 계속 힘내주세요,🔥
추가 계정 생성추천인 코드,N
에서 가장 수익성 높은 유틸리티를 가진 가장 인기있는 새로운 토큰을 확인하십시오,🔥
,N
빙고중독온 회 신혼집으로 돌아가자 김독자의 빙고 이벤트를 공개합니다,N
빙고를 가장 빠르게 완성한 분께 미니 배너를 드립니다,N
협력 징짜 너무 많은 축하랑 행복을 주셔서 감사함니다아아,{love}
덕분에 오늘 하루 완젼 분에 넘치게 행복했는데 그것만큼,N
그거보다 거 다들 행복하시길 바래여어,N
신천지예수교회 주석이 난무하는 오늘날이 영적인 기근의 때,N
샤라라라,N
협력,N
보고싶다 우리 링이들,N
엘라스트 원혁,😈
길티파티투나잇 길티파의 일을 기념하며 년 월 일 뜨거웠던 현장을 일부 공개합니다,N
다시 한번  에 밤이 찾아왔습니다,N
빌런 으로 돌아온 드리핀,😈
은 고개를 들어주세요,N
오늘 밤 시에서 만나요,N
뮤지컬 더데빌 역박규원 배우님,😈
윤재 가디언이랑 고개로 쿵치따치,🔥
둘이 날카로운 눈빛으로 화엑 째려보기,😈
그러다 마지막에 미소 짓는 거 극락,😭
트맵은 끝났지만 더 자주 볼거니까 너무 걱정마요 트메,N
민서야 우리 둘 다 황소자리구나,N
무대의 예술화최강창민,😈
드리밍의 심장 빌런,N
드리핀 손주들이 왔어요,😈
시 방송 거치면흥하리  드리핀 윤성님과 함께 치명적이게,😈
피원하모니  히어로,{open-mouth-smile}
예나 빌런 비비 예나  비비,N
드리밍 빌런 첫 음악방송 무대 어땠나요,N
드리핀  가 움직이는 모션을 가지고 돌아왔습니다,N
오픈씨에서 만나보세요,N
가 움직이는 모션을 가지고 돌아왔습니다,N
현재 재현즈 수고하셨습니다,N
엔하이픈가장 마음에 드는 장면,N
제가 원더킬포랑 상성이 잘맞는것같습니다하루종일 이영상만 보게되는군요,😎
대천재 뱀뱀 뱀뱀  학생 소개 하나코트리니티 종합학원 보충수업부의 하나코 씨는 틈만 나면 야한 말로 주변을 곤란하게 만든다고 하는데요,N
블루아카이브  웬일로 경제지에서 방문 성과를 정리한 기사가 나왔네요,{laughing-out}
저스트비  대망의 생일 하루 전,N
설레고 기쁜 마음으로 직접 만든승윤이의 생일 초대장이 도착했습니다,N
모두 빠지지 추첨을 통해 한 분께 투명 담배 케이스를 드립니다,N
가격 개당 원 기간 조기마감 할 수도 있습니다,N
문의는 디엠 대망의 생일 하루 전,N
모두 빠지지 대망의 생일 하루 전,N
밀어내기 가능밀어내기 불가능자리 많이 남았으니 연락 주세요,N
앨범만 북마크 필름 포스터 스티커 포함ㅅㅊㅇ 몬엑 주헌 형원 기현 미공포 사웨 포토카드 포카 양도해요,N
과감한 사랑 고백 프로미스나인의 무대 엠카운트다운,N
프로미스나인의 무대 엠카운트다운,N
차 티켓 오픈 캐스팅 스케줄 공개 오픈 일정 월 일화 오후 시 오픈 기간 월 일화 월 일일 예매처 인터파크 티켓 단독 할말,N
을 잃었 진짜 드리핀 드리핀과함께하는멘션파티제 생일 동윤오빠의 틀 후에요,N
같은 생일이었으면 좋았을 텐데,😣
탄은 살까말까 고민했지만 신상을 대비해서 참았습니다,😣
주말에 당신의 최애에게 오는 연락서은한님은 당신이 멍때리고 있을때피곤해,N
왜 벌써 잠이오지나랑 같이 전화하면서 자자라고 연락이 왔다,N
어쨌든 전화하잔거지,N
좋아  예전에 잠깐 만들어뒀던 자캐인데 너무 너무 가지고 싶어서 구현해봤여요,N
이거 앞머리 너무 유니콘 같아서 좋아혀,😣
맨날맨날 너무 좋아해서 아침도 잠도 못자고 있어요,😣
어떻게 하면 좋을까요,N
어어 좋아하면 안되겠죠,N
상체만 볼래요 허허허,N
디스코드 계정이 개인데 캠스 할 때만 쓰는 계정으로 서버를 들어가버렸네,😣
케이쥐받는다라 난 힘들어,N
임영웅 사랑은 늘 도망가 개영상 유튜브 총조회수 만뷰,{good-job}
방탄소년단진 엠투유 대면 팬사인회,{flower}
케플러 서영은,N
포토 대한민국 퍼스트브랜드 대상 시상식 현장수상을 축하드립니다,{flower}
전소미 스타트가좋네요,N
엠투유 대면 팬사인회,{flower}
뮤지아트 팬사인회,{flower}
케플러 서영은 영원단,N
꽃밭의 나비,{flower}
앜 너무햄  지금 생각나는건 콜옵션 가치 구하기,N
재밌게 했는데 기억이 하나도 안나서 너무 슬퍼 너무 재밌어서 한 번 해보았던거같은데 와 내가 이거도 해내고 대단한걸,N
이런 느낌을 가졌던거같은데,N
음 정말 슬프넴 김건희 억 줄 수도,N
발언 선거법 위반,N
선관위의 애매한 대답 민주당은 고발하라,N
김건희 억 줄 수도,N
새침하게  이릉게 이써요,N
성욕살려 섹트 김건희 억 줄 수도,N
이러면서 앉으려는데 뉴 성공 듣고 폴짝 뛰어서 나감 ㅠㅠ,N
이게 뭐여그노무 소설,N
시러 빌봅봅 데릭 아직도 모르겠어,N
데릭 아직도 모르겠어,N
추첨 분께 세븐틴 포토매틱,N
직접 꾸민 프리쿠라,N
버논 시그 포카 폴라로이드,N
우승자 블랙핑크 지수,{good-job}
민서야오늘 는미피면 당연히 뮤트를 안 그릴 수가 없잖아요,😭
프리뷰 마시로  케플러 사카모토마시로,N
퍼스트룩 핑크승관,N
승관  앙스타  애교가 익숙하지 않은 히이로,{love}
그래 넌 미쳤어,N
이건 비밀인데 멋진 사람들은 다 미쳤단다 영화보고 제일 좋아한 글 누가 나한테 미쳤다고 해도 난 멋지니까,N
라는 느낌을 받게 해줘서 별언니의 루나틱 사랑에 미친 사람 퍼스트룩 핑크승관,N
승관  프리뷰 마시로  케플러 사카모토마시로,N
툽 지는거 뭐 그럴수 있어 그런데 그걸로 별 놈들이 넥스트비티어쩌고 염병 떠는 건 참을 수 없어,{mad}
론스타로 재미본 짐로저스,{mad}
툽 지는거 뭐 그럴수 있어 그런데 그걸로 별 놈들이 넥스트비티어쩌고 염병 떠는 건 참을 수 없어,{mad}
저 이거보고 화가 나서말 목이 확 꺾여서,😭
달리는 말한테 밧줄이라니,N
뒤에서 잡아당기는 사람도 한둘이 아니고,N
살아있는 동물을 너무 소모품 취급하는거 같아서,{mad}
사랑은 생명체가 본능적으로 자신의 유전자를 전파하거나 보존하고 다형질의 결합으로 자손을 퍼뜨려 강자생존 세상에서 살아남게 하는 아무튼 그런거임,N
여친 없어서 이러는거 아님,N
근데 일본곡은 진짜 솔찌키 하나 못꼽아요 진짜루 진지하요,{mad}
월 리워드 광고 선물,N
우승을 축하합니다월 일부터 월 일까지,N
요케 올리구 입 막 일케 해가지구 도로 예쁘게 쳐다보는데 기여워 디질거같아요 정말로 죽을거같아요 장난이 아니고,N
월 리워드 광고 선물,N
우승을 축하합니다임스타 진정 축하존재가 덕이다임영웅 임영웅별빛같은나의사랑아 엔하이픈 갓더케이에 짱하이픈 등장,N
너무 흥미롭군  근데 여기서 잠깐 분초 중에 마음에 드는 장면 그거 뽑는거 가능하냐구,N
나는 절대로 못해,{solid-sad}
카메라 무빙도 최고,N
오디오 설정 좀 건드린다고 건드렸는데 그냥 멸망해버렸네,N
써브웨이를 써브웨이라고 말해버린 홍중,{solid-sad}
써브웨이를 써브웨이라고 말해버린 홍중,{solid-sad}
아나 줄이겟다면서 결국 쓰셨잖아,N
전 걍 좋아한 사람들의 그거랑 반대 언급을 너무 많이 봐서 지쳤어요,N
친했고 여전히 좋아하지만 그냥,N
이러저러해서 무신론자가 됐기 때문에 약간 자학개그느낌이긴 한데 머,N
이번 주의 화요일은 어떻게 보내고 있나요,N
제가 어렸을 때 생각했던 일주일 중 화요일 때쯤의 기분은,{solid-sad}
이 정도였던 것 같은데 혹시나 여러분들의 화요일도,{solid-sad}
정도라면 제가 로 만들어 주고 싶,N
뿌에에엥 빅톤 이러기야,N
나보자 먼저찍고 편집했는데 나보다 늦게올리기야,N
쳇 삐질거양미리 올렸어야지이이이이이너무 하자나 이건,N
이러기야쳇 흥칫뿡이당,N
왜물어봤어 푸조가 자동차 브랜드로 알려져 있지만 초기엔 커피 그라인더 잘 만들기로 소문난 곳이었다,N
재봉틀부터 포탄과 칼과 같은 전쟁용 무기 그리고 식기세척기와 같은 생활가전은 물론 심지어 가구까지 안 만드는 게 없었음,N
아주 그 그냥 이십사시간 트위터에 콕 박혀있는 트창ㅇ,N
이 아니라 암튼 뭐 가시면 나쁘지 않으실거에여,{solid-sad}
오빠야 이럴래  다음주 서울 앵콜콘 준비 됐나,😏
트친소 도리벤트친소 그림러트친소최근에 도리벤 권까지 완독했고아직 도린이라 최애는 없어서 다먹어요,N
흔적남겨주시면 무멘팔가요,🙌
앙상블스타즈 천사님모심글앙스타 장르의 츠키나가 레오세나 이즈미카게히라 미카이츠키 슈 천사님을 모십니다,N
밑에 표메모장 잘 읽은 후 표 작성 하고 와주세요,N
누굴 위한 평화인지,N
감사합니다 겉은 착해보여도 속은 무서운 단 어린이들입니다 후후,{love}
김호중나태주자서전김호중나태주자서전연중무휴오직호중뿐김호중    메인트 이벤트 참여자 많아지면 추첨 미미 드려요,N
자석이 오른쪽 엉덩이에 있습니다,{laughing-out}
이외의 하자는 없습니다번째 사진 확인해주세요,N
이 글 해주시면 됩니다팔로워 한정입니다,N
울집피아노도인테리어소품될까봐가끔쳐주는,N
지금은 덮개 위에 화분 올려뒀음,{laughing-out}
년 연말에 코시국땜에 아무데도 못가서 심심한 나머지 신장판 나온거 보고 만화책이나 보자고 전권지름의 결과완독후 바로 입덕서칭일웹탐사국내온리전탐라입성은인을 만나 회지를 얻어읽고사고 또 사모아서 현재에 이르렀다네,{laughing-out}
이렇게 깊이 빠지게 될줄이야,N
아미님들은 재치꾼,N
첫미니앨범,N
오 당신도 빈털털이,N
와 윤석열 후보가 범죄와의 전쟁도 공약했었었군요,N
요즘 체감이 확 들 정도로 조폭들의 활동이 늘어났었죠,N
특히 이재명 후보는 조폭들과의 연루설이 파다했고요,N
폰 화면 글씨가 잘 안보여서 독특한 자세로 보다가시력이 좀 안좋아진거 같다구,N
해야할 일을 가능한 작게 쪼개어 뇌가 좋아할 만한 행동단위로 만들어 그 중 첫 번째 것을 수행한다면 딴짓들 메뉴와 경쟁할 수 있을겁니다,N
다만 뇌는 꽤 까다로운 고객이고 해야할 일을 작게 쪼개는 것도 썩 쉬운 일은 아 뒤에 모르지만 왠지 알 거 같은,N
오늘 뭐 했어요 주말인데 어디서 쉴 수 있어,N
내일은 벌써 평일이야,😭
내일은 뭐 할 거야,N
리허설 다시 하실래요,N
힘내줘저녁은 뭐 먹었어,N
여리에게 찬열,N
지민아 난 우리지민이가 젤 웃긴데,N
만날 지민이 보고 실실 웃는다,{open-mouth-smile}
오늘은 좀 더 편안해졌는지 모르겠네 무리하지말고 천천히 회복하자 지민이가 최고,{good-job}
쥬 체고다,🔥
라인 나 디엠으로 와주세요,{love}
섹트 자위 자지 핑크자지대물 자포 쿠퍼액 디그레이디일탈 대면팬싸인회 너무 재미잇엇어요,N
오메가엑스 세빈,N
에이스 초이스,N
우리는 영원히 함께에요 고마워요,N
드립니다 팔로한정 월요병주치의 돌아왔슴다,😎
다들 이번 주말은 잘 쉬었어요,N
우리 곧 만날 거 생각하면서 내일부터 트레저도 트메도 모두 배세진생일가뵤자고세진이의눈부시고도아름다운제막세지니 생일 쭈아,N
생일 축하해 하고 싶어서 옛날에 맡긴 커미션 어기적 끌고 나온,{open-mouth-smile}
슬임님  내가 너무 사랑하는 그시절의태형이,{love}
월요병주치의 돌아왔슴다,😎
우리 곧 만날 거 생각하면서 내일부터 트레저도 트메도 모두 추첨 아래 탑꾸들이 전부 판매완료되면 한분께 아래 탑꾸중 하나를 새로 만들어 보내드립니다,N
데코덴 탑꾸하루티켓 라흐마니노프김경수 티켓꽂이 도안나눔,{love}
개인용도로만 사용해주세요,{hope}
원본은 링크에서 다운로드,N
트윗은 썸네일용이라 화질 낮아요,N
출력시 그대로 출력,N
우리 곧 만날 거 생각하면서 내일부터 트레저도 트메도 모두,{love}
,{love}
버논이 생일 기념 대박 짱 귀여운 투명 프레임 포카를 나눔합니다,{love}
까지많관부많관부,{love}
두발벌려 환영합니다요,{love}
비행기에서 보는 낮은 구름에 마음을 빼앗기고밤은 야경에 시선을 빼앗기는 것 같앙,{love}
기체가 많이 흔들려서 토 할 뻔 했지만,N
이거 넘 잼써용 심심할 때 하기에 딱 좋은,{laughing-out}
근데 이게 진짜 미묘하게 웃긴게 정국이는 전정국이라 부르면 정없는 거임,N
근데 민윤기는 민윤기라 불러야 함,N
왜냐면 그 민 윤 기 한 글자 한글자가 다 사람을 미치게 하기 때문임,🤦
이발렌타인 연주회,N
마이크랑 피아노 빼고 매입했을 때 소리에요,N
혹시 궁금하셨던 분들은 참고하시기,N
등템 안 샀다면 피아노도 매입했을 거 같아요,{laughing-out}
너무 제 취향인 재즈풍 연주,N
상상만  호비 태형이 인별에 댓글,N
깸짝 놀랐대  코빅 사이코러스 코너에미노형 출연했는데마무리는 웅이로,{laughing-out}
장하다 임영웅장점이 너무 많은 임영웅장민호가 인정하는 임영웅,N
다 맞말인데어쨋든 웅이 없는 웅이 분량은 오늘도 어김없이 푸카푸카낙 천팔 이벤트,N
천팔 감사합니다  여러모로 믿고 맡겨주셔서 정말 감사하다는 말밖엔 나오지 않네요,N
감사의 마음을 담아 해주신분께 추첨을통해 아래의 슈 인형을 드리니 많은 참여 너네들은 년이네,{laughing-out}
이 지헌 오늘 재밌었어요 다음에 또 보자,{kind-smile}
당첨자 발표는 월 일이벤트 종료 후입니다,{kind-smile}
우리 모두 미리 잘자,N
내일부터 진환 윤형 생일 이벤트 시작합니다,{good-job}
특전은 나눔존에 두었으니 편하게 챙겨가세요,{kind-smile}
나눔존에 역대급 나눔들이 있으니 오셔서 한가득 챙겨가세요,N
지민시히히 다음에 또 만나여,{kind-smile}
영재야 이 수달 보러 오세요,N
나는 당신이 그것을 복사하고 있다는 것을 알고 있습니다,N
토롯코 보라머리진 방탄소년단 진 석진 직캠 영상을 업로드했습니다,{kind-smile}
오늘 영상회 딱히 새로울건 없는 영상들이었는데 예상 보다 많은 분들이 봐주셨네요 배드럽 영상도 급하게 편집하느라 엉망이고,N
ㅠㅠ나중에 다시 제대로 편집해서 들고올게요아직 찍어놓고 못보여드린 영상들이 많은데 다음번엔 새로운 애들 지지곰이랑 대니곰 구분못하는거내 발작버튼,N
망한팬싸대회제출해야됨 이거,N
사랑뷔님 잠금화면 태형이도 넘 이뻐요,{kind-smile}
그림러트친소푸른색으로 가득한 그림을 좋아해요 흔적 남겨주시면 알티위주로 찾아갈게요,{hope}
앙스타장터 시노 하지메 하트아크릴 구합니다,N
너무 안 구해져서 울고 있습니다 정도에 개 구합니다,N
토모야 나즈나 미츠루 하트아크릴도 구합니다,N
사람 한 명 살려주세요,{hope}
개 멜론 주간 인기상 완료,{hope}
중독온신돌온 오 부스 인포문의사항은 페잉으로 부탁드립니다,{hope}
낙님과 기태호님의 김독자 생일엽서가 배포됩니다,N
언제 할까 소리는 못 지르더라도 규봉이라도 흔들게 올해는 제발 꼭 좀 해줘라,{hope}
규현아사랑해규현아믿고있었어 규현이에게물들다,N
혹시 제이크듀스에 제이크 후보에 있나요,N
제발   팔로우 이벤트,👉
안녕하세요 제이굿즈 부산점이에요 이번 이벤트 상품은 앙상블스타즈,N
아르카나 카드 한박스 입니다,👉
많은 참여 해주세요 감사합니다,{hope}
추첨일 월 일일,N
주안동글래머목포글래머 바라며주 동안 함께 해준 영재와 달꾸라 가족들,N
꿈꾸라는 내일도 계속 돼요,N
잠시 후 시 분 집사부일체 에 효정 이 일일 제자로 함께합니다,N
