x,y
완벽한 블로킹과 세ㄴ터적 모먼트,😎
완벽 그 자체 그리고 빼놓을 수 없는 세ㄴ터 수지킴,👍
토스할 때 너무 좋아,😭
안구정화 심신안정을 찾아줄 빛나는 미모의 찐,😍
원우쓰  앙스타장터 앙스타장터 앙스타 파샤 온 박스 공구 양도 받습니다,🙏
차금  이하로 구하고 싶어요,💕
즉입 가능해요 해당 파샤를 구할 시 추첨으로소소한 기프티콘 드려요,🙏
여러분 메리크리스마스,💚
슬임님  지성이의 생일을 맞아,🐹
국내주 아무도 따라할 수 없는 명품 호흡으로 온통 만개한 김호중의 인생이야기김호중만개만뷰달성우주까지만개하라김호중여일을 스스로 만개했지,💜
역시 레전드 케플리안이라면 가볍게 문제 모두 만점,💯
퀴즈 너무 재밌게 풀었어요,💕
너무 감사합니다 당연히,💖
후불제양천출장안ㅁㅏ,💯
양천미시양천출장마사ㅈㅣ,💯
양천키스방양천출장만남,💯
출장콜걸포항콜걸춘천출장안ㅁㅏ 후불제 출장샵,💯
하디만 아직 안풀렸음 전정국에서 전정구기 됐어,🤭
엘르도한나 자영 살사람,❤
쿨거 서비스 많이줄게여,❤
ㅓ걱 진짜였어 왤케 잘해졌지 천잰가바여,🤭
똑같다   제이콥,🤭
메뉴가 다 내가 좋아하는 거다,🤭
짱이야  제이콥,🤭
꽃꽂이 대신 생선꽂이하고 당당한 카나타,🤭
그리고 푸카하러 가버림,🤭
목 어깨   원찬 들어보세요,❣
녹음의 관 화지금 카카오페이지 에서 만나요,💗
총공일시월 일 일,❣
해시태그 한개가 막혔을 때의 대체문구해피 우리 토미도 간바리마쇼,❣
비둘기는 모르고 통일호는 아라여,❣
주찬이 엔딩멘트,🥺
ㅌㅇㅌㅇㅈ 박일동안 겁나 즐거워따아,❣
모나 운전 해주느라 고생도 많이했움,💕
제일 중요한 라면 앤나 김치는 예절샷 못 찍음ㅠ 다음에 또 놀러오렴,❤
나두 알러뷰 언니도 쫀밤되길,💕
오늘 블록이 햇살님이랑 티풀님 만나따,❣
쌤들 담에 웅 때 만나면 저 후다닥 달려가서 인사 할 거니까 저 품어주새오,🔥
무섭지 않아요 아픈 사람 낫게 해주는 곳인데 모가 무서워요,💚
구하다 지쳐서 열어요,😭
같이 시끄럽게 데식 얘기할 분들 모셔요,🥰
셀카 달라고 했더니 비하인드라고 그래서 고맙다고,😆
푹 잘 잠들기를 굿나잇,😘
태형이 아기였을때 왜 난 아미가 아니었을까,😭
준슥아 니 말이 맞대이레벨 리슨 구독 해지,😑
남은 날 많아 끊길 때 까진 보겠지만,😑
난 그냥 나 사랑하는 여자들만 바라보고 살래,😑
기사 났네 제목 참 잘 뽑았네,😑
지들이 하면 정의로운 신혼여행비 모금이죠,😑
고래연갈색바지연보라,😑
당비로 이런거나 쳐만들고 있으니,😑
남우현 우현 인피니트  죄송해요,😭
매끈매끈 반들반들한 피부,✨
시끌벅적 인더 숲,🥰
배고파  쇼트트랙 홍보 한 번만 해도 될까요,🥺
일정 슬롯이 찰 때마다 해주신 분들 중 한 분을 뽑아 그려드려요,❣
오늘은 에디첼라 꿈 꾸려구요,🤤
컴백 서둘러  살이살살녹네,🤤
드릴께요  우주소녀 쪼꼬미,💖
팔로우 이벤트,👉
생일 축하해지금 바로 공식 홈페이지에서 지성 이의 감사 메시지를 확인 해 보세요,👉
요럴때 보면 또 너무 사람재질 난 태형이가 신이 환생한거 아닐까 싶었거든,👉
넘 갓벽해서   팔로우 이벤트,👉
아이폰 갤  팔로우 이벤트,👉
등살뿌수기 운동도  오늘은,🔥
웅 무궁화 죵죵이는 슬퍼ㅜㅜ 후엥엥,❤
귀여워 ㅠ   네네 친해져요,🥰
드립니다 친해지는거랑 이벤트 여는거 좋아하는 최강잼프인 저랑 트친해요,❤
친해지면 선물도 퍼줍니다,😊
방탄소년단  투댕댕즈야,❤
우빈아안뇽 안뇽귀여워너무 예뻐잘생겼다헤헤,😍
영상 진짜 잘 나왔어너무 예뻐진심이야,👍
사진 고마워 귀여운 종업이,😆
당욘한 졸림지금이 어엄청 행복해졌어,💕
메세지 하나하나가 넘 행복해 보여,😍
성인을 위한 학습만화 꾹나잇요,💜
본 글을 후 계정을 팔로우하시면 추첨을 통해 한분께 앙스타 아르카나 카드 컬렉션 박스 를 드립니다,💕
팔로우 이벤트,👉
팔로우 이벤트  본 글을 후 계정을 팔로우하시면 추첨을 통해 한분께 앙스타 아르카나 카드 컬렉션 박스 를 드립니다,💕
인생에 모자라는 걸 안써본 사람이라서,😂
모두 우리 행복이 생일 축하해주세요,🐹
늘 밤주간의 달꾸라가 끝이 났습니다,🙏
간밤에 누가 덮어주고 간 포근한 이불 같던 달디,😭
원필이의 솔로 데뷔 많은 축하 해주세용원,💚
추첨 한 분께 보내드려요,🐹
추첨 한 분께 보내드려요,🐹
구미출장샵 추첨 한 분께 보내드려요,🐹
추첨 한 분께 보내드려요,🐹
문빈아스트로기생충더블업,💜
사랑해요 유니버스 빈이 폴라 하나만 부탁드려요ㅠㅠㅠㅜ제발요,🥺
오늘의 유진한유진 아이돌 왜 안하냐 이렇게 찰떡인데,😭
신고해도 별 소용도 없나봐신발은 다들 어케 보관 하시지,🤤
수요가 많다면 고려는 해보겠지만 그 정도로 수요가 나올 것 같지는 않네요,😭
헤이세이점프 덕후 밋치의 첫콘 간 이야기,💗
유겸 갓세븐   팔로우 이벤트,👉
유겸 갓세븐  추첨 한 분께 한 세트 드립니당,💖
기다리겟읍니다,💗
석양이 지는 후원에 이런 구도면 브리아나의 얼굴이 잘 보이지 않아서 로저가 오해하기에도 딱 좋겠다요,🤤
생방송으로 진행 마이,💖
리트윗 달성 시 총 명에게 아티스트 폴라로이드를 드립니다,💖
이 트윗을 해주신 한 분에게 공룡 텀블러를 보내드려요,💚
캐럿 한정  디노날 디노시 당발디 하루티켓 라흐마니노프김경수 티켓꽂이 도안나눔,😍
하루티켓 라흐마니노프김경수 티켓꽂이 도안나눔,😍
모 아니면  도 너 아니면,👍
배세진생일가뵤자고세진아,🐹
배세진생일가뵤자고세진아,🐹
배세진생일가뵤자고세진아,🐹
너무 멋져요 최고입니다,👍
와 혜주 모야이렇게 애교쟁이 사랑둥이라니,🥰
남은 인생을 걸고 말할게 두번은 없어 넌 나의 마지마악,🥰
출장유부녀고창유부녀,❤
출장콜걸하동콜걸 년 첫 꽃,💜
올해도 잘 지내보자아 이삐야,❤
그게 나야  마음이 너무 충만해요,💖
이 에피소드에서 내가 가장 좋아하는 노래 중 하나입니다  염소를 데리고 처음으로 몸치장을 했어요,😂
군대 누가 리트윗하는지 따라와요,🔥
리한나는 짙은 입술이 너무 잘 어울려요,💕
무대 위의 명의 왕자들,😍
요 저건 배다스,🔥
당신을 따르는 모든 것을 따라 가십시오,🔥
디오가 너무 불쌍해 보여서 받을 자격이 있어요,💕
너무 아파 그리고 마쉬알라 우리가 도와준 시리아 꼬마들은 너무 착하고 귀여웠어,😭
그리고 마쉬알라 우리가 도와준 시리아 꼬마들은 너무 착하고 귀여웠어,😭
창피한 얼굴이네요,😂
무대 위의 명의 왕자들,😍
루시퍼  공공장소에서 버프 히잡을 보면 또 먹어,😂
제발요 이런 기회를 주셔서 정말 감사해요,💖
내 엉덩짝 마누라,😍
에구 웃는거 너무 귀여워 지금 스트리밍 바이오에서 내 링크를 확인하십시오,🔥
원제 도스트,💚
군대 누가 리트윗하는지 따라와요,🔥
그게 계획이야 사랑,💙
그녀의 물건과 좋아하는 노래,💖
발표자가 그냥 닥치라고 해서요,😭
프롬은 식은 죽 먹기야,😁
아빠 앰프 그의 미니,💗
이런 젠장 그렇게 털썩 주저앉을 줄은 몰랐네,😭
이번에는요 마지막 한 팩을 하고 나서요,😂
솔로 주년    같지만 달라요,🔥
그는 꽤 잘 하고 있었는데 호르몬 괴물이 점령했어  깜둥이가 자제력을 잃었어 망할 포포비치 가족과 함께하는 생각과 기도,🙏
말도 안돼요  법학자 주드 바이가 호메이가드를 받았다 사랑하는 나낭에게 감사한다,😭
미스 페인트 휩 드디어 이걸 끝내고 엽서를 만들게 되어 너무 신나,✨
좋아 됐어 전화기를 북쪽으로 건네줘,😂
젠장  우리 가족은 똥이 아니야,😂
가족과 함께하는 생각과 기도,🙏
어쩐지 옷이 낯이 익더라니,😂
더 많은 삶 더 많은 사랑 언니,💗
정말 고마워요 데이비  저는 아니에요,😭
그랜트  말해봐요 내 친구한테 똥 싸요,💯
못하니까 다시 뺏는거지,😂
이모티콘들이 못을 박았어,💖
예쁘다고 생각되는 이 아름다운 털북숭이 똥꼬가 너무 좋아,❤
나는 예쁘다고 생각되는 이 아름다운 털북숭이 똥꼬가 너무 좋아,❤
세훈 와썹 녀석들 찬열 서프라이즈 모더 퍼커,😂
음 황당해요  고마워요 대런,😊
맹세코 이 거리에서 전쟁이 났을 거야,😂
오늘 오전 시에 처음으로 채팅하기,😁
중쿡은 정말 행복해 보인다 마침내 그는 술을 마실 수 있다,😂
활동 오늘 오전 시에 처음으로 채팅하기,😁
노래 너무 좋다 우우,😍
적은 것에 만족하지 마세요,💖
아름다워요  한번 물어보면 눈물나게 하는 똥이야,😂
가장 재미있는 반응은 손 아래로,😂
벌써 화 기다리고 있어요,😆
좋아요 바닷가,👍
좋아요 바닷가,👍
마침내 주를 만들고 버그 사이언스에 있을 때,😂
트래비스 스콧과 조니 댕과 탁구,😂
엘로베지 당신이 낮은 레스 물건을 싫어할 때,😂
나는 입니다 나는 당신에게 무료 또는 무언가를위한 몇 가지 교훈을 줄 수 있습니다,😂
예수님은 그냥 넘어갈 수 없어요,😂
사랑해 수울 시스타,💕
지금 그를 구하기 위한,❤
가족과 함께하는 생각과 기도,🙏
이제 팀들이 모든 연극을 만들고 있는데 그렇지 않아  곧 시험이라 그런지 너무 편해,😂
얼마나 우상인가,✨
그래도 책 읽는 건 대박이야,😂
옹휘랑 놀고 싶어요 으으으으으으으음  우리는 미워하지 않아,😘
난 평생 이 말을 해왔어 그 혼합물은,🤤
다 왔다  난 평생 이 말을 해왔어 그 혼합물은,🤤
도나는 그렇거든,🙏
리얼토크 일어날거야 가족과 함께하는 생각과 기도,🙏
그게 내가 모든 예술가들과 함께하는 방식이야,😎
제 은 영원히 축복받았어요,😍
진짜 야성적인 바보야,😂
리트윗,👉
사람을 통제하는 게 너무 좋아요  리트윗,👉
그들은 위에 있어 투표 여성들을 위한 메시지 크리드는 너무 과소평가됐어요,😂
제가 원래 못된 머그잔이에요,😭
리트윗 또는 년 불운,😂
제가 원래 못된 머그잔이에요,😭
우리 가족은 똥이 아니야,😂
가 마침내 갚을 때,😂
세상에 저도 합류해요,😍
고등학교 동창회보다 중학교 동창회에 가곤 했어,😂
그래서  내가 방금 개를 위해 산 사자 복장을 제대로 입었다고 해두자,😂
자랑스러운 부모님,😊
내 시체 위로 크리드는 너무 과소평가됐어요,😂
하지만 카일리가 자유로운 엄마가 되기 위해 전쟁에 나가고 싶어요,😂
당신은 매일 당신의 영혼을 확인해야합니다 모든 것이 모든 것인지 확인하십시오,✨
엔딩이 나를 잡아줘,😂
리트윗 또는 년 불운,😂
오늘도 좋은 하루 보내세요,😆
이 사람이요,😂
내 이발사 미쳤나봐,🔥
자위하고 게임하기 지금 플레이,👉
빨리 먹어보고 싶어,💗
하하 고마워요 토리,💗
요청하신대로,💕
만약 당신이 이 되고 싶다면 안녕하세요,😊
약속해요 전 그냥 행복하고 싶어요,😭
깜둥아 음악 좀 틀어 리트윗 또는 년 불운,😂
그냥 사랑을 전파하는거야 월요일에 갔었어   페이스북에서 오래전에 본 사진이에요,😂
사랑하는 사람에게 태그를 달아주세요  내가 어떻게 죽고 싶냐고 물으면 내 대답은 그 망할 허벅지 사이에 짓눌릴 거야,😭
행복하고 행복한 주말 되세요,😂
당신이 사랑하는 사람과 바보가되는 것,😭
흔들어  이마 여친이랑 오빠가 다 한데,💯
하하 하하 하하 하하 하하 하하 하하 하하 하하 하하 하하 하하 하하 하하 하하 하하 하하 하하 하하 하하 하하 하하 하하 하하 하하 하하 하하하 하하하,💙
완벽하게 실행된,💯
사랑해요  는 내가 체육관을 위해 일어 났을 때 에 자신을 싫어하지만 야간 자매는,😘
쿠키 드실래요  내 에 빌어 먹을 공간이있는 것처럼 미리 주문한 전쟁의 신,😂
오늘 밤에는 전설들이 건물 안에 있을 거야,✨
는 내가 체육관을 위해 일어 났을 때 에 자신을 싫어하지만 야간 자매는,😘
방탄소년단 일본 번째 머스터 팬미팅 포스터 포토카드  잭슨 왕,❤
세상에 이해해주시네요,❤
내가 트위터에 올린 적이 없으니까,🔥
적어도 나를 엿 같은,😂
크리드는 너무 과소평가됐어요,😂
라고 말했다 오메가아아앗,😭
나는 누구 짓이야,😂
아주 멋져요 고마워요 사랑스러운,😘
진짜 경찰이랑 싸웠나봐,😂
느낌이 와  음 똥구멍이 너무 좋아요,🤤
다들 결혼하는 수밖에 없어,😂
배가 아이스크림 사줄 때,😍
개월하고 계산하고 있어요,💕
머리도 자르고 이름도 바꿨어,😂
넥트렌준  이안도 쥐고 있어요,💯
너무 귀여워요 사랑해요,💗
월이 너무 기다려져요,😭
그냥 별로 친하지 않은 알림이에요,✨
이건 제게 정말 큰 의미가 될 거예요 고마워요,💖
그 에 있는 누구도 가르칠 수 없었기 때문이죠,😂
이 비디오는 항상 재미있을 것입니다 내 부시 빛이 사라졌습니다,😂
구독 및  월요일에 이런 일이 있었어요,😑
라틴 아메리카 어워드최우수 댄스 커버 토론 중에 옆에 앉아서 이것을 보게 되어 기쁘다,✨
이번 주말에 떨어뜨릴 것 같아,🔥
한번 물어보면 눈물나게 하는 똥이야,😂
크리드는 너무 과소평가됐어요,😂
이 는 모든 걸 웃기게 만들어 이건 중요하지 않아 야 보이가 집에 와요,😭
이 사진들 지금 편집 중이에요,🔥
해리의 콘서트 참석 크리드는 너무 과소평가됐어요,😂
유일하게 중요한,😍
네 맞아요  얼른 보고 싶다,💜
무엇이든 춤출 수 있을 때,🔥
진짜 피자 먹고 싶은데 평생 뚱뚱해지고 싶지 않아요,😭
천국 이 는  재미있는,😂
좋은 아침 남아프리카,😭
당신을 믿어요 이마오 온그랑 지훈이가 클라비스에서 이런 모습을 보니까 기분이 완전 바뀌어서 너무 좋아요,💜
이거 희극이네요,😭
엘리시온 이싱에게 자리를 내줬어,💗
무슨 수업이에요 가입하고 싶어요,💕
인터뷰해야 해요,😂
무대 위의 명의 왕자들,😍
제인들은 이미 철이 든 소년이다,😂
오메갈룰 네르프 트리플 샷티,😂
내 동생에게 평화가 있기를 더 많은 삶과 성공 살아있음 배려의 마음,😊
너는 그들이 방망이를 칠 때 그들의 폼을 본 적이 있어,🤤
고마워요 여러분,💖
얘들아 도와줘 그는 지금 상위 위 안에 들 자격이 있어,N
상상 속에서 나는 무드 컬러 립스틱을 바르고 있고 윗입술은 밝은 자홍색이고 아랫입술은 제트 블랙이다,N
는 방탄소년단의 에 대해 보도하고 있다,N
티어 프리세일즈가 아마존 베스트셀러 위를 차지했다,N
비디오 이래서 내가 페이스북에 답장 안 하는 거야,N
이 흑인 여성들은 의   의 표지를 듣고 있습니다,N
오늘 아침에 깨워주신 하나님께 감사드립니다,N
오늘 아침에 깨워주신 하나님께 감사드립니다,N
망할 젊은이들은 인터넷에서 인기가 있는 것처럼 보인다,N
이것은 시카고 공립학교의 세계적인 웅성거림이다,N
이 깜둥이가 진짜를 얻었으면 좋겠어  첫번째 이름 좋네요,N
나는 남자 친구들이 스크랩을하는 방식을 좋아한다,N
나는 그런 여자 친구를 원한다,N
왜냐하면 때때로 나는 단지 싸우는 분위기에서 를 가지기 때문이다,N
내 피부가 나를 행복하게 해준다고 맹세해요,N
그들의 미소 그들의 눈 그들의 입술 그들의 머리카락 그들의 웃음 그들의 미소 그들의 유머 그들의 이상한 얼굴,N
젠장  맷 코치님 수요일,✨
내 영혼이 필요해,N
그래서 요즘 내가 화난 것 같아,😂
그것의 일부가 되는 것이 너무 자랑스럽고 특별하다고 느껴라,N
그날 밤의 모든 것이 놀라웠다,N
서점 데이트는 항상 싫어,N
게다가 특정 책이 필요해요,N
가장 나쁜 것은 예수가 유대인 설교자였다는 것을 깨닫지 못하는 사람들이다,N
이 취업난 때문에 미치겠어요  고등학교 동창회보다 중학교 동창회에 가곤 했어,😂
미국인들은 동양인을 좋아하지 않아,N
음모론  아이보리안들은 너무 물결치네요  너무 뜨거워요  우리는 전문가들에게 의 관계에 대한 클립을보고 부부의 행동에 무게를달라고 요청했습니다,N
정품 써모스 브랜드 월 지구의 날 프로모션 버스 기사가 이 불쌍한 아이에게 소리를 지르고 있어요,N
내가 솔로 가수가 되기 전에 이 몰랐을 경우를 대비해서 나는 라는 걸그룹에 있었어,N
당신의 트윗은 명의 사람들에게 호평을 받았다,N
이게 니가 하는 짓이라면 바보들 좋은 아침,N
그는 말하고 싶었다,N
의 기념메달특별메달 원 일반메달 원 전면디자인 의 페이스백 디자인,N
이 여자는 그녀의 번째 생일에 가장 달콤한 놀라움을 얻었습니다,N
플롯 트위스트 이 트윗을 개의 응답으로 가져와,N
개의 다른 쇼 독점 너희들이 나를 혐오하는 또 다른 이유는 바보 같은 짓이야,N
걱정마세요 행복하세요,😊
만약 내가 깜둥이에게 결혼해 달라고 부탁한다면,N
이사 농담 홀리데이인 홀리데이인 택시 모두 필로폰 중독에서 벗어난 분자들이야,N
그들의 미소 그들의 눈 그들의 입술 그들의 머리카락 그들의 웃음 그들의 미소 그들의 유머 그들의 이상한 얼굴,N
이 모든 행복 그들은 우리의 이름 우리의,N
전반부  제리,💯
사랑에 빠지는 가장 좋은 신호는 물고기 자리입니다,N
당신이 원하는대로 지출 할 수있는 무료 현금은 어떨까요,N
기프트 카드에 대한 우리의 추첨을 입력하십시오,N
리트윗 크레이지 에일리언 인베이젼 프랭크,N
필요해요  집중 쉽지는 않지만 자유와 내가 원하는 미래를 건설하는 것이 전부입니다,N
우리는 월요일을 하지 않는다 우리는 월요일이다,N
당신이 원하는대로 지출 할 수있는 무료 현금은 어떨까요,N
나만 그런줄 알았는데,😂
사랑해요 세상에,😭
나는 의 팔레트에있는 의 아이섀도 쉐이드 중 하나가 라고 불리는 것을 깨고있다,N
고전이네요  잘 해결되길 바래요,N
진행  마라라고에 있는 우리와 영부인 일본의 신조 를 환영합니다,N
아빠도 에어혼 무서워하시나봐,N
는 아기 의 비디오를 공유합니다,N
대규모 발표 내일 오후 시 오전 시 고마워요 사랑해요 곧 만나요,N
현재의 삶은 어떻게 흘러가고 있는가,N
무대에서 파이를 먹는 전체 이야기는 상징적 인만큼 재미 있습니다,N
좋은 색깔 머리를 말하지 않습니까,N
에 있는 모든 사람들이 카디와 파티를 하는 것을 질투한다,N
분홍색이 예뻐요,N
오 안돼요 방금 대문자를 입력 매개변수로 사용했어요 저도 그 중 하나가 되고 있어요 오늘은 기분이 좀 나아졌어 게임을 시작해서 너희들과 함께 현실을 직시해야 할 것 같아,N
초 안에 행운을 빌어요,N
지금이 바로 그 때야,N
픽시가 지지 비키니를 나눠주고 있어,N
가 지속되는 동안,N
꼭 하나 사도록 해,N
이 비디오에서 오바마가 말하는 것을 믿지 않을 것입니다,N
리트윗 또는 년 불운,😂
그 깜둥이는 소름끼쳐요,😂
년 연속 매우 매우 자랑스럽다,N
패러디 계정은 어떻게 된거에요,😂
가자  다들 그렇게 말하는 걸 봤어,N
제발 도와주세요 배가 필요해요,N
고등학교 동창회보다 중학교 동창회에 가곤 했어,😂
매일  최고의 기분,💖
내가 방금 의 옷장에 추가 한 것을 확인하십시오,N
저녁 식사는 끝났지만 나는 여전히 당신을위한 맛이 있습니다,N
어젯밤에 친구가 보낸 거야,N
내 친구는 완전 바보가 되어 다른 사람들에게 같은 것을 게시하고 있습니다,N
첫 번째 시도 두 번째 앨범에서 영감을 얻음,💕
군대는 리트윗에 신경쓰지 않아요,😂
아기를 너무 갖고 싶어해요,😂
옹은 벌레가 무서울 때 정글에 가는 거야,N
내 사랑하는 아들,N
제 성적도요  오늘 밤 에피소드에서 슬로운의 몰래 피크를 잡아라,N
는 투표을 하기 전에 순 중립성 법안을 죽이기 위해 정류장을 철수하고 있습니다,N
무료 트레일리 포르노,N
왜 머물기를 선택합니까,N
누군가가 방금 전화를 걸어 아직 사랑이 있기 때문에라고 대답했습니다,N
에 감사드립니다 는 유튜브 조회수 억 천 백만 뷰를 돌파했습니다,N
까지 천 백만 더,N
안녕하세요 괜찮으시면 좋겠어요  나는 최악의 편두통이 있고이 운동은 도움이되지 않았다,N
당신이 항상 사람들을 위해 거기에 있다는 것이 우습지만 아무도 당신을 위해 거기에 없습니다 나는 그것에 익숙합니다,N
제 에 넣어주세요 제발  모두에게 충격을 주세요,N
올해의 팀캡틴의 완장프리미어 리그 클린시트,N
그냥 맥주가 다 떨어지지 마 그리고 난 코로나스에 대해 얘기하고 있어,N
테슬라가 요즘 정말 축복하고 있어 난초를 년 내내 살려뒀어,N
며칠 전에 이런 일이 있었어,N
우리 엄마는 내가 졸업 파티에 초대하고 싶은 사람을 묻고 있었다 나는 친구의 작은 엉덩이 그룹이 있다는 것을 깨달았다,N
내가 코첼라에 소스를 가져와야 한다는 건 이미 알고 있잖아,N
리티 댄스  빨리 풀어줘요,N
가서 내 새 노래 우와사를 확인해봐요 지금 여기저기서,N
스트레이트 푸딩 팝스,😂
신뢰 수준  누구 짓이야,N
이런 일이 생기면 어떻게 해야 하는지 알잖아,N
도넛을 만들어  택시 다시는 찾지 않을 긴 장소 목록에 당신을 추가합니다,N
안녕  당신이 당신의 과일을 선호하는 경우 이렇게 포장 된 채소,N
너무 귀여워요  아무 것도 아니지만 우리가 굴러 갈 때 미소를 짓는다,N
는 에서 뛰고 있습니다,N
블랙핀코피셜  나도 그래,N
너무 초현실적이야,N
너희들과 좋은 추억이 너무 많아  당신은 년 동안 차를 가지고 있었소 당신은 그것을 브래드라고 이름지었다,N
당신은 사랑했다브래드,N
그래서 나는 친구가 있다 그녀의 남자는 스냅에 그녀의 사진을 게시 생일 축하 정확히,N
문제가 있습니까 새로운 비디오 가장 인기있는 데이트 사이트 무료 온라인 섹스 데이트,N
선결은 에게 에 포즈를 취한 비서 리김슬기의 사진을 올려달라고 부탁했다,N
다음주가 대학 마지막 한주에요,N
나는 카네다 팔코 아미보를 나눠주고 있어,N
들어가는 방법 그냥,N
첫 번째 사진에서 머리가 보라색인 줄 알았는데 너무 신났어요,😭
카디 가 말했을 때,N
내가 준 것보다 더 많이 줬어,N
너에게 너무 충성해서 나는 나를 배신한다,N
트롤 가장 인기있는 데이트 사이트 무료 온라인 섹스 데이트,N
남자들은 아기를 낳는다,N
자유주의자들은 그렇게 똑똑하지 않다,N
미안해요  트롤,N
지구인에게  누가 내 아기에게 이 를 가르쳤는지 몰라,N
스톰이 너무 귀여워요 웃어요,N
고마워요  만약 카니예가 다음 트윗에서 영감을 주는 트윗에서 완전히 바뀌었다면,N
매력적인 매력을 불러줘,N
이온은 욜이 그를 쓰레기라고 불렀을 때 그의 거짓말을 전혀 보고 싶지 않다,N
사랑해라고 말하는 많은 방법이 있습니다,N
이 알베르탱은 콜린의 말에 동의해요,N
집에 가세요  그 여자가 가져간다고 생각하면 착각하는 거겠죠,😂
에 합류하기 위한 이미 존재한다 매 시간은 만,N
내 지갑이요 메니피스 영주님,😭
나무 두 그루를 심을 거야,N
그래 맞아 나무 두 그루,N
티아나는 자기 냄새를 맡고 있어 언제부터 총을 쏘지,N
딜런 하티건이 목소리로 말했다,N
나는 우울 내 친구들이 활동하지 않을 것으로 예상한다,N
엄마처럼 열렬한 팬이 될 거야,N
우르웰콘 베이비 행복한 목요일 아니야 핸드폰에 저장해둔 것들 다 어슬렁거리고 있어,😂
어휴 더 보고싶다,😭
너무 웃겨서 힘들었어,😭
