x,y
예외 노곤해짐 우리 따봉테너,N
오늘 춤 잘 췄니,N
잘햇겟지 우리 따봉이,N
우헤헤헉 감사합니다,{kind-smile}
후훗 제 속도 어디 안갓네요,{kind-smile}
아빠곰  엄마곰  아기곰,{kind-smile}
꼭 전해주고 말거야,N
언젠가 만날수있어,N
쿱정존경하는 이메계의 백쌤 최신 이메레스 사용,{kind-smile}
생일공 보고 집에 내려 가기전에 세번째이자 마지막 생카투어 깔끔하게 디피된 플북 사진들 필모 메뉴판까지,N
배우님으로 가득한 예쁜 공간에서 잠깐이지만 피곤함도 잊고 힐링하고 갑니다,N
우리 불가살 막촬 비하인드,{love}
굿바이 남도윤 행복해야 해,N
김우석 불가살,{flower}
블랙핑크 리사 블랙핑크 리사,N
김우석 우석아도윤아아찬아행,{flower}
가지 러프틀겨울이 지나 봄네 숨소리 느끼며흩날리는 꽃잎 사이로 네가 보여배포합니다,N
즐겁게 연성에 사용하여주세요,N
프리변형편집즐거운 연성되세요,N
머물렀다 설날에 세뱃돈 많이 받아서 원하시는 분,N
이하 갈포나 덕자,N
드려요 조금 넘는 건 괜찮아요,{flower}
설날에 세뱃돈 많이 받아서 원하시는 분,N
둘다 좋아  화산귀환 절기 합작입춘으로 참가했습니다,N
해당 원고는 포스타입에서도 감상하실 수 있습니다,N
좋은 합작을 열어주셔서 감사합니다,N
설날에 세뱃돈 많이 받아서 원하시는 분,N
예쁜건 천천히 앙스타장터 앙스타장터히요리 주년 파샤 구합니다,N
제시해서 디엠 주세요,🙌
악당과 계약가족이 되었다 화 업로드 되었습니다,🙌
악당과 계약가족이 되었다 화 업로드 되었습니다,🙌
오늘 경기 명장면 개개만 못골라,😅
완벽한 블로킹과 세ㄴ터적 모먼트,😎
블로킹하는 타이밍위치 왼손 모양 진짜,N
완벽 그 자체 그리고 빼놓을 수 없는 세ㄴ터 수지킴,{good-job}
토스할 때 너무 좋아,😭
너무 멋있어  나는 덕질에피소드하면 하나밖에 업는거같다때는,N
더뎁 컷콜에서 빙이 손을 잡아줬고,N
그날 퇴길때 빙이 아팠다는 얘기함서 휴식하고 뺭,🙌
하고 돌아온다고해가지고 귀여움에 입을 틀어막앗는데 그걸 본 빙이 다시 뺭,🙌
수락자막있으니까 소리 쫌 안들려도 이해해주세여,🙌
영팔이님 자주 뵀능데 트친돼서 넘 쪼아요이잘 부탁드려요,🙌
오늘도 행보카다,😋
ㅈㄱ 조건 만남 서울 오늘만날사람,N
무제한에저따먹을사람 간단팰라긴밤가능,😋
진짜 레젠드 밥차,😋
소소한 굿즈샵ㅂ이랄까용,😋
제가 다 먹었어요,😋
최애 전부 다이런 말은 곤란할까요저도 사실 얘네를 다 알고 있는 건 아니지만 마음으로 아는,N
그런거죠 샬님 처음 뵜을 때가 아마 에녹이 올라와 있을 때였던 걸로 기억하는데,N
세번째 배배 끼인 털 빼주기 첫 외출 둘째배배 준등기깡,N
젤 귀여운 부분 두 곳 미리보기,😋
꺄아 가보자고 짱친하는 그날까지,😋
갑자기 이벤트하고싶어짐알티만 해쥬세용솜계에서 뽑음,N
먹어봤는데 맛있어용,😋
피규어프레소서초점 앙상블스타즈 앙스타 중스타 색지 예약,N
기념으로이벤트 를 진행합니다,N
본 트윗을 알티 해주시는 분들 중 한분께색지 단품 개 증정,N
피프 서초점 트위 히에예쁘지,N
히카루 케플러,N
고막남친뭔가 미안하지만,😏
안구정화 심신안정을 찾아줄 빛나는 미모의 찐,{love}
히에예쁘지히카루 케플러,N
지갑은 두고 갈게 나에겐 샘성풰이가 있으니까,😏
트친소라즈 남편 치히로 입니다,N
아이고 귀찮네 이제는 다 아시죠,N
놀러다니기 좋아하는 백수입니다일상트 위주 리겜은 사볼 주력 마이마이 가끔 해요음향 전자기기 좋아해서 수시로 지갑이 고통받고 있습니다뭉치,N
한잔의 술에 인생을 담아 이 좌식이,N
다음부터야야 오늘 뭐 무슨 날이라도 돼,N
뭐 이렇게 술을 먹고 설치는거야,N
한잔술전동석 빅터 생일빵,N
히에예쁘지히카루 케플러,N
흠 그렇죠 어쨌든 저도 대위님이 자기 맘대로 잘 안 되는 경험을 할 필요는 있다고 봐요,N
근데 이제 자기 맘대로 몸을 못 가눌 수 있다 그런 쪽으로,N
세상일이 아니라 일단 대위님의 신체 쪽으로다가,N
그러면서 부차적으로 더 친해지면 좋고 아님 말고,😏
어쨌든 앙리를 늘 응원합니다,N
얍얍 았ㄱ  감사합니다,N
학생증이라서 옛날에 찍었을테니,N
과거 외관으로다가 그려봤습죠 도겸 흔들리지 않는 편안함,N
원우쓰  앙스타장터 앙스타장터 앙스타 파샤 온 박스 공구 양도 받습니다,{hope}
차금  이하로 구하고 싶어요,{love}
즉입 가능해요 해당 파샤를 구할 시 추첨으로소소한 기프티콘 드려요,{hope}
고생하셨어요 좋은밤보내세요,N
천년전에 도유니는해석이모를 어머니라고 불렀네,{kind-smile}
불가살 김우석우석아도윤아아찬아행복하자,N
앞으로 자주 봬요,{kind-smile}
네 내일 알바 첫 출근이라서,{kind-smile}
방학에도 공부하시다니 독사님이 짱이에요 오허니 보컬코러스 살린 버전 기광 파트 공유합니다,N
감으로 이어놓은 거라 사운드 조절 안되어있고 매우 어색합니다,{kind-smile}
넘 달달해서 혼자 들으려고 만들어놨는데 듣고싶으신 분들이 계신 것 같아,N
반해취해원해베이베는 레전드예슬슬 메이크업을 해볼까,{kind-smile}
구사 겹치는 아이템이 많ㄴ ㅔ,{kind-smile}
설날을 맞아 한 분께 다이어리를 보내드려요,N
월에도 일기를 쓰다 멈추었다면 한국식 새해,N
부터 다시 시작하는 마음으로 올해는 꾸준히 해보기,{kind-smile}
발송은 판매건과 동일하게,N
이벤트웹툰 이번생은가주가되겠습니다 시즌 오픈 기념 이벤트,N
유칼리램프를 선물로 드립니다,N
더욱 재미있는 이야기로 돌아온 이가주 시즌 오늘의 특별 일일 아기 고양이 정원과 함께한 뮤직뱅크,N
즐거우셨냥 차트 위 감사하다옹,{open-mouth-smile}
정원왕냥엠씨 뮤직뱅크,N
오늘의 특별 일일 아기 고양이 정원과 함께한 뮤직뱅크,N
우와 대박감사합니다,{open-mouth-smile}
컴백도 다들 하시는 것 같고 포토팩도 있으니깐 덕자,{open-mouth-smile}
이벤트를 합니다알티와 팔로우 해주신 분들께 덕자,N
를 드립니다 당발 월 일 월요일 오후 시 분,N
안녕하세요 에스파 윈터입니다,N
올 한 해도 벌써 이렇게 다 지나갔네요 ㅜㅜ,N
그래도 우리 마이들 볼 수 있어서 너무 행복한 한 해였어요,N
앞으로 내년 그리고 내내년 내내내내 베이징 개막식 부터 폐막식 까지 트위터에서 베이징올림픽 과 관련된 다양한 해시태그를 쓰면 올림픽 을 상징하는 이모티콘이 자동으로 공유됩니다,{open-mouth-smile}
올림픽 가족 여러분들도 트위터에서 올림픽을 함께 즐겨보세요,N
컴백도 다들 하시는 것 같고 포토팩도 있으니깐 덕자,{open-mouth-smile}
저 심멎사하면 김재중 때문인 줄 아세요,{open-mouth-smile}
김재중,N
웅 좋아  로서 바닥에 물을 쏟으면 차라리 감사할 지경이다 왜냐면 물은 내가 여태 무수히 쏟아온 술 콜라 커피 에이드 라면 드레싱 간장 설탕 고춧가루 퐁퐁 샴푸 락스 이런 것보다 훨씬 치우기 쉬우니깐,{open-mouth-smile}
우하하 매년 우리에겐 봄눈이 올거야,{open-mouth-smile}
여원 여창구 펜타곤,N
온리원오브  일 뒤면 출근한지 한 달오늘만 가보자일주일만 이주일만했던 것이 그 와중에 야근까지 함,N
명절이라고 선물셋트도 받아보고생애 첨으로회사 건강보험도 가입된걸 봄잘했다 나야,{open-mouth-smile}
트친소 내렸습니다,N
새로 오신 분들 앞으로 잘부탁드려요,{open-mouth-smile}
염라대왕 멱살이라두잡아서 다시 돌아오라더니둘다 다시 태어났네,{open-mouth-smile}
매년 우리에겐 봄눈이 올거야,{open-mouth-smile}
배우님의 생일을 축하하며 이글 알티 해주신분들 중 추첨 한 분께폴바셋 아이스크림 라떼 기프티콘을 드려요,N
추첨은 월 일 중 하겠습니다 고마워요,{open-mouth-smile}
남녀 두분다 알려주다니 엔진여러분,N
오늘 이준의 영스트리트 보이는 라디오 재밌게 듣고 보셨나요,N
벌칙아닌 벌칙도 받고 넘 재밌었어요,N
작업해보고싶어 남깁니다,{open-mouth-smile}
단가는 캐주얼로 축정됩니다 둘러보시고 문의주세요,N
나중에 씨 생일에 다시 찍어볼게요,N
김해 봉하마을 에서의 이재명 민주진영 대선후보 유세 영상짧고 임팩트가 큰 마지막 장면,{open-mouth-smile}
이제 트친 잘 부탁드려요 헉,N
이어볼게요 코바늘만 있으면 두렵지 않답니다,{open-mouth-smile}
김해 봉하마을 에서의 이재명 민주진영 대선후보 유세 영상짧고 임팩트가 큰 마지막 장면,{open-mouth-smile}
임영웅 제회 골든디스크사랑은늘도망가별빛같은나의사랑아만뷰 돌파 축하합니다,{open-mouth-smile}
임영웅임영웅별빛같은나의사랑아임영웅사랑은늘도망가임영웅감성장인임영웅,{open-mouth-smile}
풀썩이라니 바람일으킬텐데,🤦
안될거없지 임영웅 제회 골든디스크사랑은늘도망가별빛같은나의사랑아만뷰 돌파 축하합니다,{open-mouth-smile}
임영웅임영웅별빛같은나의사랑아임영웅사랑은늘도망가임영웅감성장인임영웅 임영웅 마량에가고싶다사랑스러운 미소,{open-mouth-smile}
설레임  임영웅 임영웅마량에가고싶다임영웅정통트롯장인임영웅브평출처미스앤미스터트롯공식계정 편집스트로베리마미  임영웅 제회 골든디스크사랑은늘도망가별빛같은나의사랑아만뷰 돌파 축하합니다,{open-mouth-smile}
임영웅임영웅별빛같은나의사랑아임영웅사랑은늘도망가임영웅감성장인임영웅 배세진생일가뵤자고세진이의눈부시고도아름다운제막세지니 생일 쭈아,N
만점 중 뵤점인 당신에게,N
햄찌표 참 잘했어요 도장 뵤했어요,N
를 분께 드리겠습니다,N
역주행 사랑받고 있어요 호중 너무 이쁘신거 아닙니카,N
역시 레전드 케플리안이라면 가볍게 문제 모두 만점,{good-job}
퀴즈 너무 재밌게 풀었어요,{love}
이렇게 재밌는 퀴즈에다가 폴라로이드 이벤트까지,N
너무 감사합니다 당연히,{love}
후불제양천출장안ㅁㅏ,{good-job}
양천미시양천출장마사ㅈㅣ,{good-job}
양천키스방양천출장만남,{good-job}
양천출장샵틱톡비투비 이민혁 선배님과,N
성공 누군가가 내 걸음을 따라 나를 계속 쳐다보는 것 같습니다,N
이민혁 비투비 최유진 휴닝바히에 케플러,N
출장콜걸포항콜걸춘천출장안ㅁㅏ 후불제 출장샵,{good-job}
오늘 도한세 존나게 귀여웠던 포인트 저 자세로,N
애옹이  안절부절,N
출장호텔철원호텔남들은 싫다는데난 내 남자친구가 옷차림 단속해주면 좋겠당노출 조금이라도 있으면 예쁜데 다른놈들이 지나가면서 훑는것도 싫다고 자기만 볼거라고 노출 다 가리고 꽁꽁 싸매주면 좋겠다난 거기서 애정느끼는데,{love}
처음 만났지만 넘 반가웠어요,N
들구 만나요 전정구기 인스스 가사 머야,N
진짜 머냐구왜 자꾸 나 꼬셔,{love}
하디만 아직 안풀렸음 전정국에서 전정구기 됐어,{kind-smile}
이 앙큼한 토깽이  친절하신 직원분이 보고 하나씩주셧어,{love}
일단 기대중이에요,N
전정구기 인스스 가사 머야,N
이 앙큼한 토깽이  밤샘이랑 또 하나는 말할 수 엄서 북끄러후니까,N
전정구기 인스스 가사 머야,N
이 앙큼한 토깽이  푸카푸카낙 천팔 이벤트,N
감사의 마음을 담아 해주신분께 추첨을통해 아래의 슈 인형을 드리니 많은 참여 썸네일 뜨자마자 즈 케미 두근두근 하면서 기대했는데 귀여운 승철이 모먼트랑 케미가 좋아서 분내내 깔깔 거렸습니다 킬포가 많아서 여러장 담았습니다즈 케미가 이렇게 잘 보이는 영상이 있을 수 있는 거임,N
엘르도 썸네일 뜨자마자 즈 케미 두근두근 하면서 기대했는데 귀여운 승철이 모먼트랑 케미가 좋아서 분내내 깔깔 거렸습니다 킬포가 많아서 여러장 담았습니다즈 케미가 이렇게 잘 보이는 영상이 있을 수 있는 거임,N
말투 착하게 해주세영 말투 안착하면 저도 똑같이 대꾸 할수밖에없어요,N
띵동 띵동 안녀하세요 도영이에여,N
중식이 부남이와 부르던 바로 그 노래 쇼,N
지수 허밍 모음,N
띵동 띵동 안녀하세요 도영이에여,N
복면가왕뱀뱀 그리고 머리머리머리,N
하려다가 밀대 부셧어,N
호엑사고쳣따 지금 형광등이 문제가 아니야,😒
심각휴 아저시 때문에 전 지구를 부술 거 같아요,N
,😒
,😒
글케 때려놓고,😒
흥,😒
내 일요일 어디갔어,N
누가 훔쳐갓지,😒
ㅓ걱 진짜였어 왤케 잘해졌지 천잰가바여,{kind-smile}
똑같다   제이콥,{kind-smile}
헐 히히 등이요,N
배민맛이 지겹고 집밥이 그리울 때 체력에 따라 쉽게 해먹을 수 있는 일본가정식 레시피,N
메뉴가 다 내가 좋아하는 거다,{kind-smile}
짱이야  제이콥,{kind-smile}
꽃꽂이 대신 생선꽂이하고 당당한 카나타,{kind-smile}
그리고 푸카하러 가버림,{kind-smile}
마음에 들었으면 좋겠다,N
어때쪽고맙습니다 누님,N
소중히 간직하겠습니다,N
물론 다 끝났지만,N
골든차일드 주찬 홍주찬,N
한거라곤 몬엑 영상보고 웃고 떠들고 계속 먹은거 밖에 없었지만,N
모나 운전 해주느라 고생도 많이했움,{love}
나두 알러뷰 언니도 쫀밤되길,{love}
쌤들 담에 웅 때 만나면 저 후다닥 달려가서 인사 할 거니까 저 품어주새오,🔥
또 덩쿨 아크릴도 구해요,N
구하다 지쳐서 열어요,😭
알티 해주시는 분들중에 분을 뽑아 유사코롯타 탄 원하시는 박스를 드려요,❗
텍관 구해봅니다평소 흥청망청 헤실헤실한 친구에게 붙어 잔소리를 하고싶습니다 잔소리 들으실 분,❗
마이데이트친소 마이데에트친소 마데트친소트찐인 중딩마데와 함께,N
질리도록 얘기할 트친을 모집합니다,N
흔적 남겨주시면 찾아갈게요,❗
타돌트친들 홍보 부탁해욤 앙녕하세요선물왔어요 나애게는 마넌이 잇따,N
받고 싶으면 지금 당장 알티와 멘션을 하거랏,N
원래 커미션 마넌 치를 사려구 했는데딱히 취향인 그림체가 읍어서잉,N
아무 앨리스 몇기세요,N
너무 듬직빅톤 세준,N
학교 남자화장실에서 후배한테 강간플 당한적있어,N
난있는데  섹트 일탈계,N
케플러 숨은글씨찾기 어딨게요,N
휴닝바히에 케플러,N
셀카 달라고 했더니 비하인드라고 그래서 고맙다고,{open-mouth-smile}
너무 이쁘다 역쉬 청은 찰떡인데,N
푹 잘 잠들기를 굿나잇,{love}
앨리스 몇기세요,N
세트메뉴 특전이 있죄홉,{hope}
해시후기 추첨 선물을 드린다구홉 추첨 한 분 햅삐홉박스현수막을 드려 앨리스 몇기세요,N
귀요미 이모티콘,N
쭈압   대면팬싸인회 너무 재미잇엇어요,N
조치원읍조건만남 대면팬싸인회 너무 재미잇엇어요,N
대면팬싸인회 너무 재미잇엇어요,N
돌판트친소 트친소 돌판 시즈니트친소 미남들을 좋아하고 있읍니다,N
올팬드프이구 런쥕 이즈 마이 페이보릿 뽀이강경 싫어요 타돌 언급 잘 없읍니다,N
사랑헤요  대면팬싸인회 너무 재미잇엇어요,N
나는 서명에 의한 를 정말 좋아한다,👀
카페맛집숙소,N
믿어볼게요,N
비바람을 뚫고 불빛을 번쩍거리며 달려가는 모습 완전 멋지다,👀
김재환 그 시절 우리가 사랑했던 체대오빠,👀
나중에 오리농장에 함 초대해쥬세요,👀
음악방송 마지막 활동 모음,N
팬카페에서 확인해 주세요,👀
감사합니다 ㅁ  약먹고 편히 잘게요,😪
잘자용인스타에 태형이 트럼펫연기보러 갔다가 만난 아기,N
태형이 아기였을때 왜 난 아미가 아니었을까,😭
요즘 밤마다 누워서 아미이지못했던 지난날을 반성하고남은날 행복해보자고 다짐하고 잔다구,😪
자기잠자기 오늘의방탄 아미들의 목소리가 가득한 공연장,N
이거 꿈 아니죠,😪
방탄소년단 은 내일도 이 자리에서 아미 여러분들을 기다리고 있겠습니다,N
또 만나요 아미  오늘의방탄 아미들의 목소리가 가득한 공연장,N
또 만나요 아미  잘자,😪
자야지  온니찜님도 짐나잇,😪
오늘의방탄 아미들의 목소리가 가득한 공연장,N
또 만나요 아미  영상 올렸을 땐 반응이 좋았대,N
야이 미친놈들아,N
느네 미친 지지자놈들이나 알았지상식적인 사람들은 그거 알지도 못했다,N
민주당 악귀놈들 싸그리 청소해야 내가 편하게 눈을 감지 싶다,N
준슥아 니 말이 맞대이레벨 리슨 구독 해지,😑
남은 날 많아 끊길 때 까진 보겠지만,😑
난 그냥 나 사랑하는 여자들만 바라보고 살래,😑
국민의힘 비판한건데 여당서 항의 이재익 작별인사 무슨일 출처 중앙일보 네이버 뉴스,N
기사 났네 제목 참 잘 뽑았네,😑
지들이 하면 정의로운 신혼여행비 모금이죠,😑
고래연갈색바지연보라,😑
요즘 또 슛아웃 원호에 빠짐,N
맨날 빠져있긴한데 예카도 인정 해주시나요,N
당비로 이런거나 쳐만들고 있으니,😑
뭔  재밍이라고,N
몇년 사이에 이렇게 분위기 바껴도 되냐구요,N
더비구함 레전드지창민순덕,N
고딩이상만,N
,N
콘서트하면 꼭 해주라,N
더비구함 레전드지창민순덕,N
과연 결승에 진출할 자는,N
위아이 강석화 석화,N
더비구함 레전드지창민순덕,N
모범택시리무진 판정단 인의 퀴즈 대결,N
방송우주소녀 유연정 연정 복면가왕 시그 대면팬싸기억의 습작 회색도시 커버듣는 그날까지 나 숨 참는다,❗
손하트 받을 싸람 여기여기 붙어랑,🙋
남우현 우현 인피니트  죄송해요,😭
계정 키우려고 여는 이벵,{kind-smile}
앑 팔로하시구 멘으로 원하시는 상품 알려주세여 마멜 콜북이요,N
팔로워 명 되면 그때 뽑 캐비지롤 완성,🙋
정말 목소리 손 처돌이 여기있습니다,🙋
스물다섯 스물하나 스페셜 포스터 토 밤 첫방송,🙋
김태리 남주혁,N
링가의 막내아들,N
새로운 다이에이 언데드코가아도 굿즈를 종을 준비했어요,N
내일 오후 시부터 판매될 예정입니다,🙋
스물다섯 스물하나 스페셜 포스터 토 밤 첫방송,🙋
새로운 다이에이 언데드코가아도 굿즈를 종을 준비했어요,N
내일 출근이라구,N
길었던 설 연휴 후유증으로 짧게만 느껴졌던 주말,{solid-sad}
악 심장 터지기 직전,N
그렇네요 저 후에 엄청 터져버렸을것같은,N
그쵸ㅠㅠㅠㅠㅠㅠㅠ 바지군,N
미래정말 미래에서라도 기다린다면 좋을텐데,N
뭔가 루프물바후가 생각나는 밤이네요,N
올려주실 공은 안 주셔서,{solid-sad}
결국 난 사버림,N
슈휴재현을 정신이 어케 되어버린듯 하다,{solid-sad}
매끈매끈 반들반들한 피부,{star}
나도 함께 포장 마차에 가고 싶다,{solid-sad}
누구한테 가르침 받고싶다,{solid-sad}
난진짜 마 라는 남자를 왜이렇게사랑하는거야엄마,{solid-sad}
저도 보고싶어요 그럼 저 진짜 잠 못자요,N
아침햇라산이사람지치게하네,{solid-sad}
천재 아이돌 희승 엔하이픈희승 희승,N
카카오페이지 만화 악당과 계약 가족이 되었다 화,N
그러닉가 봉하에서 또 즙짜기 이해 못 하겠어 너무 역겨워 저렇게까지 연기하는 전과범 권력과 돈에 대한 욕망이 사람들이 상상도 못 할 정도로 엄청나네,N
더러운 쓰레기  장인어른이 어떤 분이신지 알았다면,N
성실하고 됨됨이가 된 사람이라면,N
집산다고 처가집에 손을 벌렸을까 싶네요,N
나쁜새끼 저는 우찬엄마,N
조우찬 데뷔해 헐 더 써러봐 어디,{mad}
건강해야돼 후엉 ㅅㅂ,N
무슨 그런걸 질문이라고,{mad}
득달같은 서치력슬프다,N
트친소웬투 웬투,N
무려 오늘새 트친깅으로부터,N
맞 팔받겠 습니다,N
예능은 예능일 뿐,{dunno}
메이크스타 대면 팬 사인회 메이크드림홀흔한 와 의 대화,{dunno}
원어스 레이븐 깨비덕질,N
오늘은인요일 인요일 시리즈의 열일곱 번째 순서는요즘 저의 플레이리스트를 가득 채우신트레저님의미쳐가네 랍니다,N
이어폰 필 쥬 생일 삼춘이 잊을 수 없어,N
나지금은본가왔엉,N
자취해 집나오면울집와,N
시 되는 순간 바꿔야징,{dunno}
이승기 두상이요 두상이 너무 동글동글 동그리눈도 댕그리 귀염 귀염 꽤꼬닥,{dunno}
웅 박살   제이어스,N
웃으면서 바르고 고운말로 공격함,N
제가 요즘 하루에 시간씩 투자하는 영상 공유합니다,N
초만에 세상에 존재하는 모든 끼를 부리고 잇는 조슈아를 보고잇자니 달달해서 대가리가 녹는 기분이야요,N
평창 때부터 사랑했던 최민정 선수님 김아랑 선수님 많관부,N
무례하긴 순애야 극장에서 봐줘야 하지 않겠어요,N
알티하신 분 중 분께 예매권 매씩 드립니다,N
반고정틀 커미션을 개장했습니다,N
인 원 커스텀 소수 가능,N
신청 및 문의는 으로 받고있습니다,N
에이티즈  명재원 생일 이벤트연인은 물론 낙원의 매일을 특별히 만드는 한 아름 프리지아꽃 같은 명재원의 생일을 축하하며 한 분께 프리지아 향 바디워시를 드립니다,N
우아       호적메이트 위너가 더 가족같아,N
가족이지만 어색한 김진우김진희 남매의 친해지길 바라,N
김진우 김진희 친남매,N
목소리가 안 나와,N
너모 귀여운데몇 번 입히면 허리 늘어날까 곡죵,{solid-sad}
헐 ㅠㅠ 어뜨케 ㅜㅜ아프면 안되는데,N
못오면 너무 아쉽겠다 ㅠㅠ 빨리 나아,{solid-sad}
앙너무 좋은 우리재중와빠 보인당,👀
아일동안 아예 집에 출퇴근 못하고 촬영현장에 있었던거에요,N
히웅고생했어요얼마나 피곤할까,N
집에간다고 웃는모습이 귀엽고 제가 기분좋네요조심히 가셔서 푸욱쉬어요오랜만에 집에가는 느낌 알아서 기분좋네요좋고좋은 하,{solid-sad}
가존나 같아서웃김 쥬아용,{solid-sad}
이번달 말쯤 맞아야겟어요 흑흑 어차피 백신은 계속 맞아야 하니깐,N
은미도 보고싶다ㅠ 은바고 나 무지 사랑했는데,N
유리 안드레이비치 지바고,N
초연에서 재연으로 오는데 년이나 걸렸는데 삼연은 좀더 일찍 와주면 안될까,N
진짜루 만약만약만약 코로나 걸려도 차 접종했으면 안 했을 때보다 덜 고생한다고 그러더라구요 조심스레 추천 드립니다,{solid-sad}
배  끼요옥 맛 잇다,N
같은 향이 나는 숨결을 공유하는 두사람,N
오늘은 에디첼라 꿈 꾸려구요,🤤
컴백 서둘러  살이살살녹네,🤤
아닛밑에 어디갔됴,N
더 내려주세요쫍  나도언니가넘조하서보이는것들족족다맘찍할거야,N
어흐흐흐흐흐흫 제가 드림 컴백까지 를 못모으면 추첨 덕자,N
드릴께요 혹시라도 도 못모으면,N
드릴께요  우주소녀 쪼꼬미,{love}
팔로우 이벤트,👉
생일 축하해지금 바로 공식 홈페이지에서 지성 이의 감사 메시지를 확인 해 보세요,👉
우리집 기타와 같은 신세,{laughing-out}
어느집이나 이런거 하나쯤 있지 않나요,N
악기든 운동기구든 그림도구든,N
요럴때 보면 또 너무 사람재질 난 태형이가 신이 환생한거 아닐까 싶었거든,👉
잠시 후 월 일 시에 카카오페이지에서 만나요,N
기다리면서 데못죽 보기,N
아이폰 갤우리집 기타와 같은 신세,{laughing-out}
넘 갓벽해서   팔로우 이벤트,👉
아이폰 갤  팔로우 이벤트,👉
팔로우 이벤트  안녕하세요 제이굿즈 부산점이에요 이번 이벤트 상품은 앙상블스타즈,N
출장호텔합천호텔방탄업기단오늘의운동갓댓라잇바디앤댓라잇마인드 아미체력적금방탄업기단 오늘의 운동,N
등살뿌수기 운동도  오늘은,🔥
스티커가 너무 예뻐,N
이제 도배 끝이제 지우학 회전문 돌아보자구우,N
이제 도배 끝이제 지우학 회전문 돌아보자구우,N
엔진오늘도 고생 많았어용,{kind-smile}
이제 지우학 회전문 돌아보자구우,N
코끼리 악보 안소니 프로필,{kind-smile}
사파리 티켓홀더 없으셔도 됩니다 포토카드 가로형 편하게 멘션주세요 저두 소심하게 한번,N
신청 저희 애는 다 잘하니까,N
내 폴라로이드ㅠ 소심하게 손 들어봅니당,N
귀여운 망무 코스튬,N
배세진생일가뵤자고세진이의눈부시고도아름다운제막우리 뵤 생일 축하해,N
